,Variant_classification,Gene_classification,Comment,Difficultregion,CNV-SNV,ID,OMIM_Phenotype,Disease,Clinical_synopsis,OMIM_Link,Uniprot,Inheritance,Zygosity,CHR,POS,REF,ALT,Flank,Repeat_flag,FILTER,FORMAT,VAF,Pileup_data,Mutation_type,Gene_name,Entrez_Gene_Id,In_Key_Gene,HGVS_nomenclature,HGMD_transcript,ExonNumber,PolarChange,1000G_ASN_AF,1000G_ALL_AF,ESP6500_AC,ESP6500_AF,gnomAD_exome_ALL,gnomAD_exome_EAS,gnomAD_genome_ALL,gnomAD_genome_EAS,ExAC_EAS_HomoAlt_Count,ExAC_EAS_AC,ExAC_EAS_AF,ExAC_HomoAlt_Count,ExAC_AC,ExAC_AF,In_house_freq,In_house_count,ExAC_Link,ExAC_MisZ,ExAC_Expected,ExAC_observed,ExAC_PLI,PLI_Link,Phylop_Vertebrate_score,Phylop_Mammal_score,SIFT_score,SIFT_prediction,Polyphen2_HDIV_score,Polyphen2_HDIV_pred,Polyphen2_HVAR_score,Polyphen2_HVAR_pred,LRT_score,LRT_prediction,Mutationtatser_score,Mutationtatser_prediction,Gerp++,CADD,Rs_ID,Swiss_prot_function,Swiss_prot_disease_association,Swiss_prot_post_translational_modifications,Swiss_prot_expression,HGMD_mutation_type,HGMD_variant_class,HGMD_disease,HGMD_pubmed_ID,HGMD_indel_type,HGMD_Indel_class,HGMD_indel_disease,HGMD_indel_PMID,HGMD_nearby_alleles,Clinvar,Clinvar_Link,CosmicID,Cosmic_Occurence,Mother_zygosity,Mother_filter,Mother_format,Mother_VAF,Mother_pileup,Father_zygosity,Father_filter,Father_format,Father_VAF,Father_pileup,Recessive,Com_het,De_novo,Other_relatives,Covered,Less_20,GO_BP,GO_CC,GO_MF,KEGG_PATHWAY,PID_PATHWAY,BIOCARTA_PATHWAY,REACTOME_PATHWAY,pheno_rank,intersect_rank,CaseID
88,.,.,OMIM|low_frequency,Name=SegmentalDuplications,.,AX114,610205;102500,Alagille syndrome 2;Hajdu-Cheney syndrome,"1.$$$mimNumber,610205###prefix,####preferredTitle,ALAGILLE SYNDROME 2; ALGS2###inheritance,Autosomal dominant ###headAndNeckFace,Pointed chin ;###headAndNeckFace,Broad forehead ###headAndNeckEyes,Posterior embryotoxon ###headAndNeckNose,Long nose ;###headAndNeckNose,Bulbous tip ###cardiovascularHeart,Atrial septal defect ;###cardiovascularHeart,Pulmonic stenosis ;###cardiovascularHeart,Tetrology of Fallot ###cardiovascularVascular,Hypertension ###abdomenLiver,Cholestatic liver disease ###genitourinaryKidneys,Small kidneys ;###genitourinaryKidneys,Cystic kidneys ;###genitourinaryKidneys,Renal tubular acidosis ;###genitourinaryKidneys,Renal insufficiency ;###genitourinaryKidneys,Proteinuria ;###genitourinaryKidneys,Hematuria ###miscellaneous,Variable phenotype ###molecularBasis,Caused by mutation in the homology of the Drosophila Notch 2 gene (NOTCH2, ) 2.$$$mimNumber,102500###prefix,####preferredTitle,HAJDU-CHENEY SYNDROME; HJCYS###inheritance,Autosomal dominant ###growthHeight,Short stature ###growthOther,Failure to thrive ###headAndNeckHead,Bathrocephaly ###headAndNeckFace,Coarse facies ;###headAndNeckFace,Long philtrum ;###headAndNeckFace,Full cheeks ;###headAndNeckFace,Micrognathia ###headAndNeckEars,Low-set ears ;###headAndNeckEars,Hearing loss, conductive ;###headAndNeckEars,Prominent ear lobes ###headAndNeckEyes,Downslanting palpebral fissures ;###headAndNeckEyes,Epicanthal folds ;###headAndNeckEyes,Telecanthus ;###headAndNeckEyes,Synophrys ;###headAndNeckEyes,Thick eyebrows ;###headAndNeckEyes,Long eyelashes ###headAndNeckNose,Broad nose ;###headAndNeckNose,Anteverted nares ###headAndNeckMouth,High-arched palate ###headAndNeckTeeth,Early tooth loss ;###headAndNeckTeeth,Malocclusion ###headAndNeckNeck,Short neck ###cardiovascularHeart,Congenital heart disease (variable) ;###cardiovascularHeart,Septal defects ###cardiovascularVascular,Patent ductus arteriosus ###abdomenGastrointestinal,Intestinal malrotation (less common) ###genitourinaryExternalGenitaliaMale,Hypospadias ;###genitourinaryExternalGenitaliaMale,Inguinal hernia ###genitourinaryInternalGenitaliaMale,Cryptorchidism ###genitourinaryKidneys,Renal cysts ###skeletal,Osteopenia ;###skeletal,Osteoporosis ;###skeletal,Pathologic fractures ;###skeletal,Joint laxity ###skeletalSkull,Bathrocephaly ;###skeletalSkull,Wormian bones ;###skeletalSkull,Failure of suture ossification ;###skeletalSkull,Thickened skull vault ;###skeletalSkull,Absent frontal sinus ;###skeletalSkull,Elongated sella turcica ;###skeletalSkull,Progressive basilar impression ;###skeletalSkull,Small mandible ###skeletalSpine,Narrow disc space ;###skeletalSpine,Biconcave vertebrae ;###skeletalSpine,Tall lumbar vertebral bodies ;###skeletalSpine,Kyphoscoliosis ;###skeletalSpine,Cervical instability ;###skeletalSpine,Vertebral collapse ###skeletalLimbs,Joint laxity ;###skeletalLimbs,Genu valgum ;###skeletalLimbs,Dislocation of radial head ;###skeletalLimbs,Long, bowed fibulae ;###skeletalLimbs,Serpentine fibulae ###skeletalHands,Pseudoclubbing ;###skeletalHands,Short distal digits ;###skeletalHands,Acroosteolysis ;###skeletalHands,Crowded carpal bones ###skeletalFeet,Short distal digits ;###skeletalFeet,Acroosteolysis ###skinNailsHairSkin,Hirsutism ###skinNailsHairNails,Short nails ;###skinNailsHairNails,Curved nails ###skinNailsHairHair,Synophrys ;###skinNailsHairHair,Thick eyebrows ;###skinNailsHairHair,Long eyelashes ;###skinNailsHairHair,Thick, straight hair ###neurologicCentralNervousSystem,Hydrocephalus ;###neurologicCentralNervousSystem,Normal intelligence ###molecularBasis,Caused by mutation in the homolog of the Drosophila Notch 2 gene (NOTCH2, )",https://www.omim.org/entry/610205;https://www.omim.org/entry/102500,.,Autosomal dominant,Het,1,120539661,C,T,.,.,PASS,0/1:48:104,46.15,",T,T.,.,,ttTT,,T.t,,.tT,T,T...TT,T.t,TtT.T...,.tTTt..t.T.T..t.T.T,T...TTTT.T,TT.Tt..TT.tT,.tT...,T..T....",missense_variant;missense_variant,NOTCH2,4853,.,NM_024408.3(NOTCH2):c.710G>A(p.Arg237Gln);NM_001200001.1(NOTCH2):c.710G>A(p.Arg237Gln),NM_024408.3,exon4(34);exon4(22),P+=>P0;P+=>P0,0.002,0.0004,1,0.000077,0.0001,0.0016,0.0002,0.0031,0,18,0.0021,0,20,0.00017,0.016393442623,8/488,http://exac.broadinstitute.org/variant/1-120539661-C-T,3.78,69.2,4,1.0,http://exac.broadinstitute.org/gene/ENSG00000134250,0.75161,1.16E-4,0.58,T,0.95,P,0.612,P,0.054,N,0.999,D,4.91,20.6,rs146498360,.,.,.,.,.,.,.,.,.,.,.,.,.,.,.,.,.,.,.,.,.,.,.,.,.,.,.,.,.,.,.,.,.,"apoptotic process (GO:0006915)|atrial septum morphogenesis (GO:0060413)|bone remodeling (GO:0046849)|cell cycle arrest (GO:0007050)|cell fate determination (GO:0001709)|cell growth (GO:0016049)|ciliary body morphogenesis (GO:0061073)|determination of left/right symmetry (GO:0007368)|embryonic limb morphogenesis (GO:0030326)|gene expression (GO:0010467)|hemopoiesis (GO:0030097)|humoral immune response (GO:0006959)|in utero embryonic development (GO:0001701)|inflammatory response to antigenic stimulus (GO:0002437)|interleukin-4 secretion (GO:0072602)|intracellular receptor signaling pathway (GO:0030522)|morphogenesis of an epithelial sheet (GO:0002011)|multicellular organismal development (GO:0007275)|negative regulation of apoptotic process (GO:0043066)|negative regulation of cell proliferation (GO:0008285)|negative regulation of transcription from RNA polymerase II promoter (GO:0000122)|nervous system development (GO:0007399)|Notch receptor processing (GO:0007220)|Notch signaling involved in heart development (GO:0061314)|Notch signaling pathway (GO:0007219)|organ morphogenesis (GO:0009887)|placenta blood vessel development (GO:0060674)|positive regulation of apoptotic process (GO:0043065)|positive regulation of BMP signaling pathway (GO:0030513)|positive regulation of cell proliferation (GO:0008284)|positive regulation of Ras protein signal transduction (GO:0046579)|pulmonary valve morphogenesis (GO:0003184)|regulation of transcription, DNA-templated (GO:0006355)|stem cell maintenance (GO:0019827)|transcription initiation from RNA polymerase II promoter (GO:0006367)",cell surface (GO:0009986)|cilium (GO:0005929)|endoplasmic reticulum membrane (GO:0005789)|extracellular region (GO:0005576)|Golgi membrane (GO:0000139)|integral component of plasma membrane (GO:0005887)|membrane (GO:0016020)|nucleoplasm (GO:0005654)|nucleus (GO:0005634)|plasma membrane (GO:0005886)|receptor complex (GO:0043235),calcium ion binding (GO:0005509)|ligand-activated RNA polymerase II transcription factor binding transcription factor activity (GO:0038049)|receptor activity (GO:0004872),.,.,.,.,45,3,AX114
310,.,.,OMIM|low_frequency,.,.,AX114,121050;616118,"Contractural arachnodactyly, congenital;Macular degeneration, early-onset","1.$$$mimNumber,121050###prefix,####preferredTitle,ARTHROGRYPOSIS, DISTAL, TYPE 9; DA9###inheritance,Autosomal dominant ###growthOther,Dolichostenomelia ;###growthOther,Marfanoid habitus ###headAndNeckHead,Scaphocephaly ;###headAndNeckHead,Brachycephaly ;###headAndNeckHead,Dolichocephaly ###headAndNeckFace,Micrognathia (27%) ;###headAndNeckFace,Frontal bossing ###headAndNeckEars,Crumpled ear (76%) ;###headAndNeckEars,Poorly defined conchae ;###headAndNeckEars,Prominent crura ;###headAndNeckEars,Folded helices ###headAndNeckEyes,Ectopia lentis ;###headAndNeckEyes,Myopia ###headAndNeckMouth,High-arched palate (28%) ###headAndNeckNeck,Relatively short neck ###cardiovascularHeart,Mitral valve prolapse ;###cardiovascularHeart,Mitral regurgitation ;###cardiovascularHeart,Atrial septal defect ;###cardiovascularHeart,Ventricular septal defect ;###cardiovascularHeart,Bicuspid aortic valve ###cardiovascularVascular,Patent ductus arteriosus ;###cardiovascularVascular,Aortic root dilatation ###chestRibsSternumClaviclesAndScapulae,Pectus carinatum ###skeletal,Osteopenia ###skeletalSpine,Congenital kyphoscoliosis (45%) ###skeletalPelvis,Hip contractures (25%) ###skeletalLimbs,Elbow contractures (86%) ;###skeletalLimbs,Knee contractures (81%) ;###skeletalLimbs,Subluxation of patella ###skeletalHands,Arachnodactyly ;###skeletalHands,Camptodactyly ;###skeletalHands,Ulnar deviation of fingers ;###skeletalHands,Adducted thumbs ;###skeletalHands,Flexion contractures of proximal interphalangeal joints ###skeletalFeet,Metatarsus varus ;###skeletalFeet,Talipes equinovarus (32%) ###muscleSoftTissue,Hypoplastic calf muscles ###neurologicCentralNervousSystem,Motor developmental delay ###molecularBasis,Caused by mutation in the fibrillin 2 gene (FBN2, ) 2.$$$mimNumber,616118###prefix,####preferredTitle,MACULAR DEGENERATION, EARLY-ONSET; EOMD###inheritance,Autosomal dominant ###headAndNeckEyes,Decreased visual acuity ;###headAndNeckEyes,Pigmentary changes of macula ;###headAndNeckEyes,Pigment epithelial atrophy of macula ;###headAndNeckEyes,Choroidal neovascularization ;###headAndNeckEyes,Atrophic macular disease ###miscellaneous,Onset of disease in fourth or fifth decade of life ###molecularBasis,Caused by mutation in the fibrillin 2 gene (FBN2, )",https://www.omim.org/entry/121050;https://www.omim.org/entry/616118,.,Autosomal dominant,Het,5,127595212,C,A,.,.,PASS,0/1:44:73,60.27,"..AAA..A...aAA,..aaA.a,AAa,Aa,.,AAAaAaAaA..aaa.AaAA.AA,a..a..^]A^].^],^],",missense_variant,FBN2,2201,.,NM_001999.3(FBN2):c.8674G>T(p.Asp2892Tyr),NM_001999.3,exon65(65),P-=>P0,0.003,0.0006,0,0,0.0004,0.0057,6.46e-05,0.0012,0,45,0.0052,0,49,0.00040,0.00409836065574,2/488,http://exac.broadinstitute.org/variant/5-127595212-C-A,1.22,108.4,13,1.0,http://exac.broadinstitute.org/gene/ENSG00000138829,0.29872,.,0.03,D,0.306,B,0.055,B,0.002,N,1.000,D,4.61,11.58,.,.,.,.,.,.,.,.,.,.,.,.,.,.,.,.,.,.,.,.,.,.,.,.,.,.,.,.,.,.,.,.,.,.,anatomical structure morphogenesis (GO:0009653)|bone trabecula formation (GO:0060346)|embryonic limb morphogenesis (GO:0030326)|extracellular matrix disassembly (GO:0022617)|extracellular matrix organization (GO:0030198)|positive regulation of bone mineralization (GO:0030501)|positive regulation of osteoblast differentiation (GO:0045669)|sequestering of TGFbeta in extracellular matrix (GO:0035583),extracellular matrix (GO:0031012)|extracellular region (GO:0005576)|microfibril (GO:0001527)|proteinaceous extracellular matrix (GO:0005578),calcium ion binding (GO:0005509)|extracellular matrix structural constituent (GO:0005201),.,.,.,.,9,1,AX114
356,.,.,HGMD|OMIM,.,.,AX114,175700;241800;146510;174200;174700,"Greig cephalopolysyndactyly syndrome;Hypothalamic hamartomas, somatic;Pallister-Hall syndrome;Polydactyly, postaxial, types A1 and B;Polydactyly, preaxial, type IV","1.$$$mimNumber,175700###prefix,####preferredTitle,GREIG CEPHALOPOLYSYNDACTYLY SYNDROME; GCPS###inheritance,Autosomal dominant ###headAndNeckHead,Macrocephaly ;###headAndNeckHead,Scaphocephaly ;###headAndNeckHead,Trigonocephaly ###headAndNeckFace,High forehead ;###headAndNeckFace,Frontal bossing ###headAndNeckEyes,Hypertelorism ;###headAndNeckEyes,Downslanting palpebral fissures ###headAndNeckNose,Broad nasal root ###abdomenExternalFeatures,Umbilical hernia ###genitourinaryExternalGenitaliaMale,Inguinal hernia ###skeletal,Advanced bone age ###skeletalSkull,Broad late closing cranial sutures ;###skeletalSkull,Craniosynostosis ;###skeletalSkull,Metopic synostosis (rare) ###skeletalHands,Postaxial polydactyly ;###skeletalHands,Broad thumbs ;###skeletalHands,Syndactyly (usually fingers 3 and 4) ;###skeletalHands,Preaxial polydactyly (variable) ;###skeletalHands,Camptodactyly ###skeletalFeet,Preaxial polydactyly ;###skeletalFeet,Broad halluces ;###skeletalFeet,Syndactyly (usually toes 1 to 3) ;###skeletalFeet,Postaxial polydactyly (rare) ;###skeletalFeet,Camptodactyly ###neurologicCentralNervousSystem,Normal intelligence ;###neurologicCentralNervousSystem,Mental retardation, mild (rare) ;###neurologicCentralNervousSystem,Hydrocephaly ;###neurologicCentralNervousSystem,Agenesis of corpus callosum ###laboratoryAbnormalities,Translocation or deletions involving 7p13 (severe case reports) ###miscellaneous,Variable expressivity ###molecularBasis,Caused by mutation in the GLI-Kruppel family member GLI3 gene (GLI3, ) 2.$$$mimNumber,146510###prefix,####preferredTitle,PALLISTER-HALL SYNDROME; PHS###inheritance,Autosomal dominant ###growthHeight,Short stature ###growthOther,Intrauterine growth retardation ###headAndNeckEars,Simple auricles ;###headAndNeckEars,Absent external auditory canals ;###headAndNeckEars,Microtia ;###headAndNeckEars,Posteriorly rotated ears ###headAndNeckEyes,Microphthalmia ###headAndNeckNose,Short nose ;###headAndNeckNose,Flat nasal bridge ;###headAndNeckNose,Anteverted nares ###headAndNeckMouth,Multiple buccal frenula ;###headAndNeckMouth,Microglossia ;###headAndNeckMouth,Cleft lip and palate ###headAndNeckTeeth,Natal teeth ###cardiovascularHeart,Ventricular septal defect ;###cardiovascularHeart,Proximal aortic coarctation ###cardiovascularVascular,Patent ductus arteriosus ###respiratoryLarynx,Laryngeal cleft ;###respiratoryLarynx,Bifid epiglottis ;###respiratoryLarynx,Hypoplastic epiglottis ###respiratoryLung,Abnormal lung lobation ###chestRibsSternumClaviclesAndScapulae,Fused ribs ###abdomenGastrointestinal,Imperforate anus ###genitourinaryExternalGenitaliaMale,Micropenis ###genitourinaryInternalGenitaliaMale,Cryptorchidism ;###genitourinaryInternalGenitaliaMale,Testicular hypoplasia ###genitourinaryKidneys,Renal dysplasia ;###genitourinaryKidneys,Renal ectopia ###skeletalSpine,Hemivertebrae ###skeletalPelvis,Dislocated hips ###skeletalLimbs,Distal shortening of limbs ;###skeletalLimbs,Radial subluxation ###skeletalHands,Postaxial polydactyly ;###skeletalHands,Oligodactyly ;###skeletalHands,Short 4th metacarpals ;###skeletalHands,Syndactyly ###skeletalFeet,Syndactyly ;###skeletalFeet,Postaxial polydactyly ###skinNailsHairSkin,Midline facial capillary hemangioma ###skinNailsHairNails,Nail dysplasia ###neurologicCentralNervousSystem,Holoprosencephaly (less common) ;###neurologicCentralNervousSystem,Hypothalamic hamartoma ;###neurologicCentralNervousSystem,Pituitary aplasia or dysplasia ###endocrineFeatures,Panhypopituitarism ;###endocrineFeatures,Adrenal gland hypoplasia ;###endocrineFeatures,Thyroid dysplasia/aplasia ###miscellaneous,Variable severity ;###miscellaneous,Variable expressivity ###molecularBasis,Caused by mutations in the GLI-Kruppel family member 3 gene (GLI3, ) 3.$$$mimNumber,174200###prefix,####preferredTitle,POLYDACTYLY, POSTAXIAL, TYPE A1; PAPA1###inheritance,Autosomal dominant ###skeletalHands,Postaxial polydactyly (bilateral, sometimes extra digits are well formed and articulated) ;###skeletalHands,Preaxial polydactyly (bilateral or unilateral) ;###skeletalHands,Triphalangeal thumb (in some patients) ;###skeletalHands,Syndactyly (in some patients) ;###skeletalHands,Broad thumbs (in some patients) ###skeletalFeet,Postaxial polydactyly ;###skeletalFeet,Preaxial polydactyly ;###skeletalFeet,Syndactyly (in some patients) ###molecularBasis,Caused by mutation in the GLI-Kruppel family member GLI3 gene (GLI3, ) ",https://www.omim.org/entry/175700;https://www.omim.org/entry/241800;https://www.omim.org/entry/146510;https://www.omim.org/entry/174200;https://www.omim.org/entry/174700,.,Autosomal dominant,Het,7,42063222,T,G,.,.,strand fail,0/1:23:75,30.67,".,,............................,..,,g,gg,,gg,g",intron_variant,GLI3,2737,.,NM_000168.5(GLI3):c.1357-15A>C,NM_000168.5,intron9(14),.,.,.,.,.,0.0322,0.0409,0.0346,0.0115,.,.,.,.,.,.,0.141393442623,69/488,.,1.52,38.2,1,1.0,http://exac.broadinstitute.org/gene/ENSG00000106571,.,.,.,.,.,.,.,.,.,.,.,.,.,.,.,.,.,.,.,.,.,.,.,.,.,.,.,"NM_000168.5(GLI3):c.1357-17C>G,DM,Greig cephalopolysyndactyly syndrome,23334564",.,.,.,.,.,.,.,.,.,.,.,.,.,.,.,.,.,.,.,.,"anterior semicircular canal development (GO:0060873)|anterior/posterior pattern specification (GO:0009952)|artery development (GO:0060840)|axon guidance (GO:0007411)|branching involved in ureteric bud morphogenesis (GO:0001658)|camera-type eye morphogenesis (GO:0048593)|cell differentiation involved in kidney development (GO:0061005)|cerebral cortex radial glia guided migration (GO:0021801)|developmental growth (GO:0048589)|embryonic digestive tract development (GO:0048566)|embryonic digestive tract morphogenesis (GO:0048557)|embryonic digit morphogenesis (GO:0042733)|embryonic skeletal system morphogenesis (GO:0048704)|forebrain dorsal/ventral pattern formation (GO:0021798)|forebrain radial glial cell differentiation (GO:0021861)|frontal suture morphogenesis (GO:0060364)|heart development (GO:0007507)|hindgut morphogenesis (GO:0007442)|hippocampus development (GO:0021766)|in utero embryonic development (GO:0001701)|lambdoid suture morphogenesis (GO:0060366)|lateral ganglionic eminence cell proliferation (GO:0022018)|lateral semicircular canal development (GO:0060875)|limb morphogenesis (GO:0035108)|lung development (GO:0030324)|mammary gland specification (GO:0060594)|melanocyte differentiation (GO:0030318)|metanephros development (GO:0001656)|negative regulation of alpha-beta T cell differentiation (GO:0046639)|negative regulation of apoptotic process (GO:0043066)|negative regulation of canonical Wnt signaling pathway (GO:0090090)|negative regulation of cell proliferation (GO:0008285)|negative regulation of neuron differentiation (GO:0045665)|negative regulation of smoothened signaling pathway (GO:0045879)|negative regulation of transcription from RNA polymerase II promoter (GO:0000122)|negative regulation of transcription, DNA-templated (GO:0045892)|negative thymic T cell selection (GO:0045060)|nose morphogenesis (GO:0043585)|odontogenesis of dentin-containing tooth (GO:0042475)|oligodendrocyte differentiation (GO:0048709)|optic nerve morphogenesis (GO:0021631)|palate development (GO:0060021)|positive regulation of alpha-beta T cell differentiation (GO:0046638)|positive regulation of chondrocyte differentiation (GO:0032332)|positive regulation of neuroblast proliferation (GO:0002052)|positive regulation of osteoblast differentiation (GO:0045669)|positive regulation of protein import into nucleus (GO:0042307)|positive regulation of transcription from RNA polymerase II promoter (GO:0045944)|positive regulation of transcription, DNA-templated (GO:0045893)|protein processing (GO:0016485)|proximal/distal pattern formation (GO:0009954)|response to estrogen (GO:0043627)|sagittal suture morphogenesis (GO:0060367)|smoothened signaling pathway (GO:0007224)|smoothened signaling pathway involved in dorsal/ventral neural tube patterning (GO:0060831)|smoothened signaling pathway involved in spinal cord motor neuron cell fate specification (GO:0021776)|smoothened signaling pathway involved in ventral spinal cord interneuron specification (GO:0021775)|T cell differentiation in thymus (GO:0033077)|thymocyte apoptotic process (GO:0070242)|tongue development (GO:0043586)|transcription, DNA-templated (GO:0006351)|wound healing (GO:0042060)",cilium (GO:0005929)|cytoplasm (GO:0005737)|cytosol (GO:0005829)|nuclear speck (GO:0016607)|nucleus (GO:0005634)|primary cilium (GO:0072372)|transcriptional repressor complex (GO:0017053),beta-catenin binding (GO:0008013)|chromatin binding (GO:0003682)|histone acetyltransferase binding (GO:0035035)|histone deacetylase binding (GO:0042826)|metal ion binding (GO:0046872)|RNA polymerase II core promoter proximal region sequence-specific DNA binding (GO:0000978)|sequence-specific DNA binding transcription factor activity (GO:0003700),.,.,.,.,59,4,AX114
