,Variant_classification,Gene_classification,Comment,Difficultregion,CNV-SNV,ID,OMIM_Phenotype,Disease,Clinical_synopsis,OMIM_Link,Uniprot,Inheritance,Zygosity,CHR,POS,REF,ALT,Flank,Repeat_flag,FILTER,FORMAT,VAF,Pileup_data,Mutation_type,Gene_name,Entrez_Gene_Id,In_Key_Gene,HGVS_nomenclature,HGMD_transcript,ExonNumber,PolarChange,1000G_ASN_AF,1000G_ALL_AF,ESP6500_AC,ESP6500_AF,gnomAD_exome_ALL,gnomAD_exome_EAS,gnomAD_genome_ALL,gnomAD_genome_EAS,ExAC_EAS_HomoAlt_Count,ExAC_EAS_AC,ExAC_EAS_AF,ExAC_HomoAlt_Count,ExAC_AC,ExAC_AF,In_house_freq,In_house_count,ExAC_Link,ExAC_MisZ,ExAC_Expected,ExAC_observed,ExAC_PLI,PLI_Link,Phylop_Vertebrate_score,Phylop_Mammal_score,SIFT_score,SIFT_prediction,Polyphen2_HDIV_score,Polyphen2_HDIV_pred,Polyphen2_HVAR_score,Polyphen2_HVAR_pred,LRT_score,LRT_prediction,Mutationtatser_score,Mutationtatser_prediction,Gerp++,CADD,Rs_ID,Swiss_prot_function,Swiss_prot_disease_association,Swiss_prot_post_translational_modifications,Swiss_prot_expression,HGMD_mutation_type,HGMD_variant_class,HGMD_disease,HGMD_pubmed_ID,HGMD_indel_type,HGMD_Indel_class,HGMD_indel_disease,HGMD_indel_PMID,HGMD_nearby_alleles,Clinvar,Clinvar_Link,CosmicID,Cosmic_Occurence,Mother_zygosity,Mother_filter,Mother_format,Mother_VAF,Mother_pileup,Father_zygosity,Father_filter,Father_format,Father_VAF,Father_pileup,Recessive,Com_het,De_novo,Other_relatives,Covered,Less_20,GO_BP,GO_CC,GO_MF,KEGG_PATHWAY,PID_PATHWAY,BIOCARTA_PATHWAY,REACTOME_PATHWAY,pheno_rank,intersect_rank,CaseID
395,.,.,HGMD,.,.,AX276,.,.,.,.,.,.,Het,8,100887784,C,G,.,.,PASS,0/1:41:82,50.0,".,,GgG.Gg,G,g,,,.,gggG,gGg.,gG,,Gg,,,,,,GG,Ggg,G.,.,gGGG.gGg,,g,.g,,..G.G,GGG",missense_variant;missense_variant,VPS13B,1345,.,NM_017890.4(VPS13B):c.11959C>G(p.Pro3987Ala);NM_152564.4(VPS13B):c.11884C>G(p.Pro3962Ala),NM_017890.4,exon62(62);exon62(62),NP=>NP;NP=>NP,0.016,0.0032,.,.,0.0008,0.0114,0.0005,0.0086,0,87,0.010,0,90,0.00074,0.0122950819672,6/488,http://exac.broadinstitute.org/variant/8-100887784-C-G,-0.84,127.8,65,0.0,http://exac.broadinstitute.org/gene/ENSG00000132549,0.32145,.,0.11,T,0.044,B,0.022,B,0.001,D,1.000,D,3.75,12.03,rs201483764,.,.,.,.,.,.,.,.,.,.,.,.,"NM_017890.4(VPS13B):c.11960C>G(p.P3987R),DM?,Autism spectrum disorder,24066114",.,.,.,.,.,.,.,.,.,.,.,.,.,.,.,.,.,.,.,.,cellular metabolic process (GO:0044237)|generation of precursor metabolites and energy (GO:0006091)|respiratory electron transport chain (GO:0022904)|small molecule metabolic process (GO:0044281),integral component of membrane (GO:0016021)|mitochondrial inner membrane (GO:0005743)|mitochondrion (GO:0005739),cytochrome-c oxidase activity (GO:0004129),.,.,.,.,68,3,AX276
441,.,.,HGMD|OMIM,.,.,AX276,214150;133540;278800;211980;613761;616946;600630,"Cerebrooculofacioskeletal syndrome 1;Cockayne syndrome, type B;De Sanctis-Cacchione syndrome;Lung cancer, susceptibility to;Macular degeneration, age-related, susceptibility to, 5;Premature ovarian failure 11;UV-sensitive syndrome 1","1.$$$mimNumber,214150###prefix,####preferredTitle,CEREBROOCULOFACIOSKELETAL SYNDROME 1; COFS1###inheritance,Autosomal recessive ###growthWeight,Normal or decreased birth weight ;###growthWeight,Failure to thrive ###headAndNeckHead,Microcephaly ###headAndNeckFace,Micrognathia ;###headAndNeckFace,Sloping forehead ;###headAndNeckFace,Long philtrum ###headAndNeckEars,Large ear pinnae ;###headAndNeckEars,Sensorineural hearing loss ###headAndNeckEyes,Cataracts ;###headAndNeckEyes,Blepharophimosis ;###headAndNeckEyes,Microphthalmia ;###headAndNeckEyes,Deep-set eyes ;###headAndNeckEyes,Nystagmus ###headAndNeckNose,Prominent nasal root ###headAndNeckMouth,Upper lip overlaps lower lip ;###headAndNeckMouth,Thin lips ###chestBreasts,Widely spaced nipples ###skeletal,Arthrogryposis ;###skeletal,Osteoporosis ###skeletalSpine,Kyphoscoliosis ###skeletalPelvis,Coxa valga ;###skeletalPelvis,Shallow acetabular angle ###skeletalLimbs,Elbow flexion contracture ;###skeletalLimbs,Knee flexion contracture ###skeletalHands,Camptodactyly ###skeletalFeet,Vertical talus ;###skeletalFeet,Rocker-bottom feet ;###skeletalFeet,Longitudinal groove on soles ;###skeletalFeet,Second metatarsal posteriorly placed ###skinNailsHairHair,Hirsutism ###neurologicCentralNervousSystem,Mental retardation, profound ;###neurologicCentralNervousSystem,Lack of motor development ;###neurologicCentralNervousSystem,Lack of speech development ;###neurologicCentralNervousSystem,Optic tract and chiasm hypoplasia ;###neurologicCentralNervousSystem,Focal microgyria ;###neurologicCentralNervousSystem,Agenesis of corpus callosum ;###neurologicCentralNervousSystem,Infantile spasm ;###neurologicCentralNervousSystem,Hypotonia ;###neurologicCentralNervousSystem,Delayed myelination ;###neurologicCentralNervousSystem,Cerebellar hypoplasia ;###neurologicCentralNervousSystem,Subcortical gliosis ;###neurologicCentralNervousSystem,Third ventricle subependymal focal gliosis ###laboratoryAbnormalities,Fibroblasts show hypersensitivity to UV irradiation due to defect in transcription-coupled nucleotide excision repair (TC-NER) ###miscellaneous,Death in childhood ###molecularBasis,Caused by mutation in the excision repair cross complementing rodent repair deficiency, complementation group 6 gene (ERCC6, ) 2.$$$mimNumber,133540###prefix,####preferredTitle,COCKAYNE SYNDROME B; CSB###inheritance,Autosomal recessive ###growthOther,Intrauterine growth retardation ;###growthOther,Low birth weight ;###growthOther,Marked failure to thrive ;###growthOther,Postnatal growth retardation ;###growthOther,Cachectic dwarfism ###headAndNeckHead,Microcephaly ;###headAndNeckHead,Mandible prognathism ###headAndNeckFace,Loss of facial adipose tissue ;###headAndNeckFace,Wizened face ###headAndNeckEars,Malformed ears ;###headAndNeckEars,Sensorineural hearing loss ###headAndNeckEyes,Pigmentary retinopathy ;###headAndNeckEyes,Optic atrophy ;###headAndNeckEyes,Strabismus ;###headAndNeckEyes,Hyperopia ;###headAndNeckEyes,Corneal opacity ;###headAndNeckEyes,Decreased lacrimation ;###headAndNeckEyes,Nystagmus ;###headAndNeckEyes,Cataracts ;###headAndNeckEyes,Microphthalmos ;###headAndNeckEyes,Iris hypoplasia ;###headAndNeckEyes,Microcornea ###headAndNeckNose,Slender nose ###headAndNeckTeeth,Dental caries ;###headAndNeckTeeth,Delayed eruption of deciduous teeth ;###headAndNeckTeeth,Malocclusion ;###headAndNeckTeeth,Absent/hypoplastic teeth ###cardiovascularHeart,Cardiac arrhythmias ###cardiovascularVascular,Hypertension ###abdomenLiver,Hepatomegaly ###abdomenSpleen,Splenomegaly ###genitourinaryExternalGenitaliaMale,Micropenis ###genitourinaryInternalGenitaliaMale,Cryptorchidism ###genitourinaryKidneys,Proteinuria ;###genitourinaryKidneys,Renal failure ###skeletal,Osteoporosis ###skeletalSkull,Thickened calvarium ###skeletalSpine,Kyphosis ;###skeletalSpine,Vertebral body abnormalities ;###skeletalSpine,Intervertebral calcifications ###skeletalPelvis,Small, squared off pelvis ;###skeletalPelvis,Hypoplastic iliac wings ###skeletalLimbs,Mild to moderate joint limitation ###skeletalHands,Sclerotic ivory phalangeal epiphyses ###skinNailsHair,Precociously senile appearance ###skinNailsHairSkin,Photosensitivity ;###skinNailsHairSkin,Scarring ;###skinNailsHairSkin,Pigmentation ;###skinNailsHairSkin,Atrophy ;###skinNailsHairSkin,Anhidrosis ;###skinNailsHairSkin,Dry skin ;###skinNailsHairSkin,Decreased subcutaneous adipose tissue ###skinNailsHairHair,Thin, dry hair ###muscleSoftTissue,Decreased subcutaneous adipose tissue ###neurologicCentralNervousSystem,Mental retardation ;###neurologicCentralNervousSystem,Normal pressure hydrocephalus ;###neurologicCentralNervousSystem,Poor-absent neurologic development ;###neurologicCentralNervousSystem,Basal ganglia calcifications ;###neurologicCentralNervousSystem,Subcortical white matter calcifications ;###neurologicCentralNervousSystem,Cerebellar calcifications ;###neurologicCentralNervousSystem,Patchy demyelination of subcortical white matter ;###neurologicCentralNervousSystem,Cerebral atrophy ;###neurologicCentralNervousSystem,Seizures ###neurologicPeripheralNervousSystem,Dysmyelination ;###neurologicPeripheralNervousSystem,Ataxia ;###neurologicPeripheralNervousSystem,Tremor ;###neurologicPeripheralNervousSystem,Weakness ;###neurologicPeripheralNervousSystem,Peripheral neuropathy ;###neurologicPeripheralNervousSystem,Slowed nerve conduction velocities ###laboratoryAbnormalities,Abnormal myelination in sural nerve biopsies ;###laboratoryAbnormalities,Disturbed visual and brainstem auditory evoked responses indicative of CNS demyelination ;###laboratoryAbnormalities,Increased cellular sensitivity to UV light ###miscellaneous,Two types, type I or type A (classical Cockayne syndrome, );###miscellaneous,Characteristic face and body by age 2 years ;###miscellaneous,Death by age 6-7 years ;###miscellaneous,Death from pneumonia ###molecularBasis,Caused by mutation in the excision-repair cross-complementing group 6 gene (ERCC6, ) 3.$$$mimNumber,616946###prefix,####preferredTitle,PREMATURE OVARIAN FAILURE 11; POF11###inheritance,Autosomal dominant ###genitourinaryInternalGenitaliaFemale,Secondary amenorrhea ###endocrineFeatures,Secondary amenorrhea ;###endocrineFeatures,Elevated serum FSH###molecularBasis,Caused by mutation in the excision repair cross-complementing group-6 gene (ERCC6, ) 4.$$$mimNumber,600630###prefix,####preferredTitle,UV-SENSITIVE SYNDROME 1; UVSS1###inheritance,Autosomal recessive ###skinNailsHairSkin,Photosensitivity ;###skinNailsHairSkin,Freckling ;###skinNailsHairSkin,Telangiectasia ;###skinNailsHairSkin,Dry skin ###laboratoryAbnormalities,Cells show defective transcription-coupled nucleotide excision repair (TC-NER) after UV irradiation ;###laboratoryAbnormalities,Increased cellular sensitivity to UV light ###miscellaneous,Onset in infancy ;###miscellaneous,No predisposition to skin tumor development ;###miscellaneous,Two unrelated Japanese patients have been reported (last curated May 2012) ###molecularBasis,Caused by mutation in the excision-repair cross-complementing group 8 gene (ERCC6, )",https://www.omim.org/entry/214150;https://www.omim.org/entry/133540;https://www.omim.org/entry/278800;https://www.omim.org/entry/211980;https://www.omim.org/entry/613761;https://www.omim.org/entry/616946;https://www.omim.org/entry/600630,.,Autosomal recessive;Autosomal dominant,Het,10,50738781,T,C,.,.,PASS,0/1:11:22,50.0,".C..CCC.CCCC,..,.,c,,c",synonymous_variant,ERCC6,2074,.,NM_000124.3(ERCC6):c.528A>G(p.Arg176=),NM_000124.3,exon3(21),.,0.043,0.026,88,0.0068,0.0287,0.0472,0.0139,0.0444,9,406,0.047,152,2861,0.024,0.0922131147541,45/488,http://exac.broadinstitute.org/variant/10-50738781-T-C,-0.86,53.4,29,0.0,http://exac.broadinstitute.org/gene/ENSG00000225830,.,.,.,.,.,.,.,.,.,.,.,.,.,.,rs4253027,.,.,.,.,.,.,.,.,.,.,.,.,"NM_000124.3(ERCC6):c.526C>T(p.R176*),DM,Cockayne syndrome,25356239",.,.,.,.,.,.,.,.,.,.,.,.,.,.,.,.,.,.,.,.,"activation of JNKK activity (GO:0007256)|activation of JUN kinase activity (GO:0007257)|ATP catabolic process (GO:0006200)|base-excision repair (GO:0006284)|DNA repair (GO:0006281)|intrinsic apoptotic signaling pathway in response to DNA damage (GO:0008630)|multicellular organism growth (GO:0035264)|nucleotide-excision repair (GO:0006289)|photoreceptor cell maintenance (GO:0045494)|positive regulation of DNA-templated transcription, elongation (GO:0032786)|positive regulation of protein tyrosine kinase activity (GO:0061098)|pyrimidine dimer repair (GO:0006290)|regulation of DNA-templated transcription, elongation (GO:0032784)|response to gamma radiation (GO:0010332)|response to oxidative stress (GO:0006979)|response to superoxide (GO:0000303)|response to toxic substance (GO:0009636)|response to UV (GO:0009411)|response to UV-B (GO:0010224)|response to X-ray (GO:0010165)|transcription elongation from RNA polymerase I promoter (GO:0006362)|transcription from RNA polymerase II promoter (GO:0006366)|transcription-coupled nucleotide-excision repair (GO:0006283)",nucleolus (GO:0005730)|nucleoplasm (GO:0005654)|nucleus (GO:0005634)|transcription elongation factor complex (GO:0008023),ATP binding (GO:0005524)|chromatin binding (GO:0003682)|DNA binding (GO:0003677)|DNA-dependent ATPase activity (GO:0008094)|helicase activity (GO:0004386)|protein C-terminus binding (GO:0008022)|protein complex binding (GO:0032403)|protein N-terminus binding (GO:0047485)|protein tyrosine kinase activator activity (GO:0030296),.,.,.,.,8,1,AX276
636,.,.,HGMD|OMIM|low_frequency,.,.,AX276,102370;129600;614185;604308;616914;154700;184900;608328,"Acromicric dysplasia;Ectopia lentis, familial;Geleophysic dysplasia 2;MASS syndrome;Marfan lipodystrophy syndrome;Marfan syndrome;Stiff skin syndrome;Weill-Marchesani syndrome 2, dominant","1.$$$mimNumber,102370###prefix,####preferredTitle,ACROMICRIC DYSPLASIA; ACMICD###inheritance,Autosomal dominant ###growthHeight,Short stature, severe ###growthOther,Pseudomuscular build ###headAndNeckFace,Round face ;###headAndNeckFace,Long philtrum ;###headAndNeckFace,Prominent philtrum ;###headAndNeckFace,Mild facial anomalies ###headAndNeckEyes,Long eyelashes ;###headAndNeckEyes,Well-defined eyebrows ###headAndNeckNose,Bulbous nose ;###headAndNeckNose,Anteverted nostrils ###headAndNeckMouth,Small mouth ;###headAndNeckMouth,Thick lips ###skeletal,Delayed bone age ###skeletalSpine,Ovoid vertebral bodies ###skeletalLimbs,Cone-shaped epiphyses ;###skeletalLimbs,Internal notch of femoral head ;###skeletalLimbs,Shortened long tubular bones ###skeletalHands,Short hands ;###skeletalHands,Short, stubby metacarpals ;###skeletalHands,Short, stubby phalanges ;###skeletalHands,Second metacarpal notched proximally on radial side ;###skeletalHands,Fifth metacarpal notched on ulnar side ###skeletalFeet,Short feet ###skinNailsHairSkin,Thick skin ###skinNailsHairHair,Long eyelashes ;###skinNailsHairHair,Well-defined eyebrows ###voice,Hoarse voice ###laboratoryAbnormalities,Growth cartilage disorganized, with islands of cells and abnormal collagen arrangement ###molecularBasis,Caused by mutation in the fibrillin 1 gene (FBN1, {134797.0055]) 2.$$$mimNumber,129600###prefix,####preferredTitle,ECTOPIA LENTIS 1, ISOLATED, AUTOSOMAL DOMINANT; ECTOL1###inheritance,Autosomal dominant ###headAndNeckEyes,Ectopia lentis, isolated (congenital lens dislocation) ###molecularBasis,Caused by mutation in the fibrillin-1 gene (FBN1, ) 3.$$$mimNumber,614185###prefix,####preferredTitle,GELEOPHYSIC DYSPLASIA 2; GPHYSD2###inheritance,Autosomal dominant ###growthHeight,Short stature ###headAndNeckFace,'Happy' face ;###headAndNeckFace,Full cheeks ;###headAndNeckFace,Long philtrum ;###headAndNeckFace,Flat philtrum ###headAndNeckEyes,Hypertelorism ###headAndNeckNose,Shortened nose ###headAndNeckMouth,Thin upper lip ###cardiovascularHeart,Valvular thickening, progressive ;###cardiovascularHeart,Mitral valve stenosis ;###cardiovascularHeart,Mitral valve insufficiency ;###cardiovascularHeart,Mitral valve prolapse ;###cardiovascularHeart,Tricuspid valve stenosis ;###cardiovascularHeart,Aortic valve stenosis ;###cardiovascularHeart,Aortic valve insufficiency ###cardiovascularVascular,Pulmonary artery hypertension ###respiratoryLarynx,Laryngeal stenosis or insufficiency ###respiratoryLung,Respiratory insufficiency ###abdomenLiver,Hepatomegaly ###skeletal,Delayed bone age ;###skeletal,Decreased joint mobility ;###skeletal,Joint stiffness ###skeletalSpine,Ovoid vertebral bodies ###skeletalLimbs,Cone-shaped epiphyses ;###skeletalLimbs,Short long tubular bones ###skeletalHands,Short hands ###skeletalFeet,Short feet ;###skeletalFeet,Toe walking ###skinNailsHairSkin,Thick skin ###laboratoryAbnormalities,Lysosomal-like storage vacuoles in various tissues ###miscellaneous,Early death in some patients due to cardiorespiratory involvement ###molecularBasis,Caused by mutation in the fibrillin 1 gene (FBN1, ) 4.$$$mimNumber,616914###prefix,####preferredTitle,MARFAN LIPODYSTROPHY SYNDROME; MFLS###inheritance,Autosomal dominant ###growthHeight,Tall stature ###growthWeight,Extremely low body mass index###growthOther,Intrauterine growth retardation ###headAndNeckHead,Large head ;###headAndNeckHead,Arrested hydrocephalus ;###headAndNeckHead,Craniosynostosis (rare) ###headAndNeckFace,Progeroid appearance ;###headAndNeckFace,Prominent forehead ;###headAndNeckFace,Scaphocephaly (in some patients) ;###headAndNeckFace,Retrognathia ###headAndNeckEyes,Proptosis ;###headAndNeckEyes,Downslanting palpebral fissures ;###headAndNeckEyes,Severe myopia ;###headAndNeckEyes,Ectopia lentis (in some patients) ###headAndNeckNose,Thin nose ;###headAndNeckNose,High nasal bridge ###headAndNeckMouth,High-arched palate ;###headAndNeckMouth,Narrow palate ###cardiovascularHeart,Mild mitral valve prolapse (in some patients);###cardiovascularHeart,Dilation of aortic root (in some patients)###cardiovascularVascular,Hypertension (rare) ###chestExternalFeatures,Pectus excavatum (in some patients) ###skeletalSkull,Open anterior fontanel ;###skeletalSkull,Craniosynostosis (rare) ;###skeletalSkull,Scaphocephaly ###skeletalLimbs,Long limbs ;###skeletalLimbs,Arthrogryposis of large joints (in some patients)###skeletalHands,Arachnodactyly ;###skeletalHands,Hyperextensible digits ###skeletalFeet,Pes planus ;###skeletalFeet,Pes valgus ###skinNailsHairSkin,Easy bruisability (in some patients) ###muscleSoftTissue,Generalized lack of subcutaneous fat;###muscleSoftTissue,Extremely reduced subcutaneous fat###neurologicCentralNervousSystem,Arrested hydrocephalus ;###neurologicCentralNervousSystem,Dural ectasia (in some patients) ;###neurologicCentralNervousSystem,Normal psychomotor development ###prenatalManifestationsAmnioticFluid,Oligohydramnios (in some patients) ###prenatalManifestationsDelivery,Premature birth ###molecularBasis,Caused by mutation in the fibrillin-1 gene (FBN1, ) 5.$$$mimNumber,154700###prefix,####preferredTitle,MARFAN SYNDROME; MFS###inheritance,Autosomal dominant ###growthHeight,Mean length at birth 53 +/- 4.4 cm for males ;###growthHeight,Mean length at birth 52.5 +/- 3.5 cm for females ;###growthHeight,Mean adult height 191.3 +/- 9 cm for males ;###growthHeight,Mean adult height 175.4 +/- 8.2 cm for females ;###growthHeight,Disproportionate tall stature, upper to lower segment ratio less than 0.85 ;###growthHeight,Arm span to height > 1.05 ###growthOther,Puberty-associated peak in growth velocity is 2.4 years earlier for males and 2.2 years earlier for females ###headAndNeckHead,Dolichocephaly ###headAndNeckFace,Long, narrow face ;###headAndNeckFace,Malar hypoplasia ;###headAndNeckFace,Micrognathia ;###headAndNeckFace,Retrognathia ###headAndNeckEyes,Enophthalmos ;###headAndNeckEyes,Ectopia lentis ;###headAndNeckEyes,Myopia ;###headAndNeckEyes,Increased axial globe length ;###headAndNeckEyes,Corneal flatness ;###headAndNeckEyes,Retinal detachment ;###headAndNeckEyes,Iris hypoplasia ;###headAndNeckEyes,Early glaucoma ;###headAndNeckEyes,Early cataracts ;###headAndNeckEyes,Downslanting palpebral fissures ;###headAndNeckEyes,Trabeculodysgenesis, primary (in some patients) ;###headAndNeckEyes,Strabismus (in some patients) ;###headAndNeckEyes,Exotropia (in some patients) ;###headAndNeckEyes,Esotropia (rare) ;###headAndNeckEyes,Hypertropia (rare) ###headAndNeckMouth,High-arched palate ;###headAndNeckMouth,Narrow palate ###headAndNeckTeeth,Crowded teeth ###cardiovascularHeart,Aortic regurgitation ;###cardiovascularHeart,Mitral regurgitation ;###cardiovascularHeart,Mitral valve prolapse ;###cardiovascularHeart,Congestive heart failure ;###cardiovascularHeart,Tricuspid valve prolapse ;###cardiovascularHeart,Premature calcification of mitral annulus ###cardiovascularVascular,Aortic root dilatation ;###cardiovascularVascular,Aortic dissection ;###cardiovascularVascular,Ascending aortic aneurysm ;###cardiovascularVascular,Aneurysm of other aortic segments rare ;###cardiovascularVascular,Pulmonary artery dilatation ###respiratoryLung,Emphysema in most severe presentation ;###respiratoryLung,Pneumothorax ;###respiratoryLung,Pulmonary blebs ###chestRibsSternumClaviclesAndScapulae,Pectus excavatum ;###chestRibsSternumClaviclesAndScapulae,Pectus carinatum ;###chestRibsSternumClaviclesAndScapulae,Pectus asymmetric sternum ###abdomenExternalFeatures,Recurrent or incisional hernia ###skeletal,Premature arthritis ###skeletalSpine,Scoliosis ;###skeletalSpine,Kyphoscoliosis ;###skeletalSpine,Thoracic lordosis ;###skeletalSpine,Spondylolisthesis ;###skeletalSpine,Lumbosacral dural ectasia ###skeletalPelvis,Protrusio acetabulae ###skeletalLimbs,Long bone overgrowth (dolichostenomelia) ;###skeletalLimbs,Joint hypermobility ;###skeletalLimbs,Joint contractures ;###skeletalLimbs,Genu recurvatum ###skeletalHands,Arachnodactyly ###skeletalFeet,Pes planus ;###skeletalFeet,Long, narrow feet ;###skeletalFeet,Pes cavus ;###skeletalFeet,Hammer toes ;###skeletalFeet,Medial rotation of the medial malleolus ###skinNailsHairSkin,Striae distensae ;###skinNailsHairSkin,Decreased subcutaneous fat ###muscleSoftTissue,Decreased muscle mass ;###muscleSoftTissue,Decreased subcutaneous fat ###laboratoryAbnormalities,Decreased fibrillin-1 immunostaining in the dermis ###miscellaneous,About 25% of cases due to new mutations ###molecularBasis,Caused by mutation in the fibrillin 1 gene (FBN1, ) 6.$$$mimNumber,608328###prefix,####preferredTitle,WEILL-MARCHESANI SYNDROME 2; WMS2###inheritance,Autosomal dominant ###growthHeight,Short stature, proportionate ;###growthHeight,Adult male height 142-169 cm ;###growthHeight,Adult female height 130-157 cm ###growthOther,Muscular build ###headAndNeckHead,Brachycephaly ###headAndNeckFace,Maxillary hypoplasia ###headAndNeckEyes,Severe myopia ;###headAndNeckEyes,Glaucoma (in 80% of patients) ;###headAndNeckEyes,Ectopia lentis (84%) ;###headAndNeckEyes,Blindness ;###headAndNeckEyes,Microspherophakia (small, spherical lens) (74%) ;###headAndNeckEyes,Shallow anterior chamber ;###headAndNeckEyes,Cataract (28%) ###headAndNeckNose,Depressed nasal bridge ###headAndNeckMouth,Narrow palate ###headAndNeckTeeth,Malformed teeth ;###headAndNeckTeeth,Malaligned teeth ###cardiovascularHeart,Cardiac anomalies (13%) ;###cardiovascularHeart,Mitral valve insufficiency ;###cardiovascularHeart,Aortic valve stenosis ;###cardiovascularHeart,Pulmonary valve stenosis ;###cardiovascularHeart,Ductus arteriosus ;###cardiovascularHeart,Ventricular septal defect ###chestRibsSternumClaviclesAndScapulae,Wide ribs ###skeletal,Joint stiffness (hands, shoulder, elbows, knees, and ankles) ;###skeletal,Joint limitations ###skeletalSkull,Broad skull ;###skeletalSkull,Small shallow orbits ###skeletalSpine,Scoliosis ;###skeletalSpine,Increased lumbar lordosis ;###skeletalSpine,Narrow spinal canal ###skeletalLimbs,Thin cortices ###skeletalHands,Broad hands ;###skeletalHands,Brachydactyly ;###skeletalHands,Broad metacarpals ;###skeletalHands,Broad phalanges ###skeletalFeet,Broad metatarsals ###skinNailsHairSkin,Thick skin (74%) ###neurologicCentralNervousSystem,Mental retardation, mild (18%) ###miscellaneous,See () for a phenotypically similar autosomal recessive form###molecularBasis,Caused by mutation in the fibrillin-1 gene (FBN1, )",https://www.omim.org/entry/102370;https://www.omim.org/entry/129600;https://www.omim.org/entry/614185;https://www.omim.org/entry/604308;https://www.omim.org/entry/616914;https://www.omim.org/entry/154700;https://www.omim.org/entry/184900;https://www.omim.org/entry/608328,.,Autosomal dominant,Het,15,48720553,G,C,.,.,PASS,0/1:20:30,66.67,"C.CCC.CCCcC,,.cCCC,.ccCcC.CC.A^].",missense_variant,FBN1,2200,.,NM_000138.4(FBN1):c.6987C>G(p.Asp2329Glu),NM_000138.4,exon57(66),P-=>P-,0.005,0.0014,5,0.00038,0.0007,0.0082,0.0009,0.0111,0,60,0.0070,0,74,0.00061,0.00204918032787,1/488,http://exac.broadinstitute.org/variant/15-48720553-G-C,5.33,119.0,3,1.0,http://exac.broadinstitute.org/gene/ENSG00000166147,0.41498,0.0,0.58,T,0.653,P,0.385,B,0.000,D,1.000,D,-10.7,13.80,rs363831,.,.,.,.,NM_000138.4(FBN1):c.6987C>G(p.D2329E),DM,Thoracic aortic aneurysms and dissections,26272055,.,.,.,.,.,.,.,.,.,.,.,.,.,.,.,.,.,.,.,.,.,.,.,.,.,extracellular matrix disassembly (GO:0022617)|extracellular matrix organization (GO:0030198)|heart development (GO:0007507)|kidney development (GO:0001822)|sequestering of BMP in extracellular matrix (GO:0035582)|sequestering of TGFbeta in extracellular matrix (GO:0035583)|skeletal system development (GO:0001501),basement membrane (GO:0005604)|extracellular matrix (GO:0031012)|extracellular region (GO:0005576)|extracellular space (GO:0005615)|extracellular vesicular exosome (GO:0070062)|microfibril (GO:0001527)|proteinaceous extracellular matrix (GO:0005578),calcium ion binding (GO:0005509)|extracellular matrix structural constituent (GO:0005201),.,.,.,.,34,2,AX276
