,Variant_classification,Gene_classification,Comment,Difficultregion,CNV-SNV,ID,OMIM_Phenotype,Disease,Clinical_synopsis,OMIM_Link,Uniprot,Inheritance,Zygosity,CHR,POS,REF,ALT,Flank,Repeat_flag,FILTER,FORMAT,VAF,Pileup_data,Mutation_type,Gene_name,Entrez_Gene_Id,In_Key_Gene,HGVS_nomenclature,HGMD_transcript,ExonNumber,PolarChange,1000G_ASN_AF,1000G_ALL_AF,ESP6500_AC,ESP6500_AF,gnomAD_exome_ALL,gnomAD_exome_EAS,gnomAD_genome_ALL,gnomAD_genome_EAS,ExAC_EAS_HomoAlt_Count,ExAC_EAS_AC,ExAC_EAS_AF,ExAC_HomoAlt_Count,ExAC_AC,ExAC_AF,In_house_freq,In_house_count,ExAC_Link,ExAC_MisZ,ExAC_Expected,ExAC_observed,ExAC_PLI,PLI_Link,Phylop_Vertebrate_score,Phylop_Mammal_score,SIFT_score,SIFT_prediction,Polyphen2_HDIV_score,Polyphen2_HDIV_pred,Polyphen2_HVAR_score,Polyphen2_HVAR_pred,LRT_score,LRT_prediction,Mutationtatser_score,Mutationtatser_prediction,Gerp++,CADD,Rs_ID,Swiss_prot_function,Swiss_prot_disease_association,Swiss_prot_post_translational_modifications,Swiss_prot_expression,HGMD_mutation_type,HGMD_variant_class,HGMD_disease,HGMD_pubmed_ID,HGMD_indel_type,HGMD_Indel_class,HGMD_indel_disease,HGMD_indel_PMID,HGMD_nearby_alleles,Clinvar,Clinvar_Link,CosmicID,Cosmic_Occurence,Mother_zygosity,Mother_filter,Mother_format,Mother_VAF,Mother_pileup,Father_zygosity,Father_filter,Father_format,Father_VAF,Father_pileup,Recessive,Com_het,De_novo,Other_relatives,Covered,Less_20,GO_BP,GO_CC,GO_MF,KEGG_PATHWAY,PID_PATHWAY,BIOCARTA_PATHWAY,REACTOME_PATHWAY,pheno_rank,intersect_rank,CaseID
12,.,.,HGMD|novel|possible_comhet,Name=LowComplexity,.,CS000030,.,.,.,.,.,.,Het,19,39075698,T,C,.,.,PASS,0/1:46:78,58.97,",,c,ccCc,Cccc,c,cCcCcccc,c,,cc,c.,,CCc.C,.,cCc,,,C.c,.cCCcc,,cC,CC,c,.,c.,C^]C^]c",missense_variant;missense_variant,RYR1,11184,.,NM_001042723.1(RYR1):c.14747T>C(p.Phe4916Ser);NM_000540.2(RYR1):c.14762T>C(p.Phe4921Ser),NM_000540.2,exon101(105);exon102(106),NP=>P0;NP=>P0,.,.,.,.,.,.,.,.,.,.,.,.,.,.,0.00117785630153,1/849,.,4.44,179.9,50,0.0,http://exac.broadinstitute.org/gene/ENSG00000196218,0.55325,.,0,D,0.999,D,0.996,D,0.000,U,1.000,D,5.08,16.20,rs118192156,.,.,.,.,NM_000540.2(RYR1):c.14762T>C(p.F4921S),DM,Central core disease,16621918,.,.,.,.,"NM_000540.2(RYR1):c.14761_14762delTTinsAC,DM,Central core disease,16621918",.,.,.,.,.,.,.,.,.,.,.,.,.,.,.,.,.,.,.,.,activation of JUN kinase activity (GO:0007257)|activation of MAPKKK activity (GO:0000185)|cell proliferation (GO:0008283)|intracellular signal transduction (GO:0035556)|peptidyl-serine phosphorylation (GO:0018105)|protein autophosphorylation (GO:0046777)|protein phosphorylation (GO:0006468)|response to stress (GO:0006950),membrane (GO:0016020),ATP binding (GO:0005524)|MAP kinase kinase kinase kinase activity (GO:0008349)|protein kinase activity (GO:0004672)|protein serine/threonine kinase activity (GO:0004674)|small GTPase regulator activity (GO:0005083),.,.,.,.,4,0,CS000030
62,.,.,HGMD|OMIM,.,.,CS000030,260920;610377;175900,"Hyper-IgD syndrome;Mevalonic aciduria;Porokeratosis 3, multiple types","1.$$$mimNumber,260920###prefix,####preferredTitle,HYPER-IgD SYNDROME; HIDS###inheritance,Autosomal recessive ###headAndNeckEyes,Retinitis pigmentosa (in some patients) ;###headAndNeckEyes,Night blindness ;###headAndNeckEyes,Visual field loss ;###headAndNeckEyes,Optic disc pallor ;###headAndNeckEyes,Attenuated retinal vessels ;###headAndNeckEyes,Peripheral atrophy of retinal pigment epithelium ;###headAndNeckEyes,Intraretinal pigmentation ;###headAndNeckEyes,Decreased or undetectable rod responses on electroretinography ;###headAndNeckEyes,Reduced cone responses on electroretinography ###abdomenSpleen,Splenomegaly (in childhood) ###abdomenGastrointestinal,Abdominal pain ;###abdomenGastrointestinal,Diarrhea ;###abdomenGastrointestinal,Vomiting ###skeletalLimbs,Arthralgias ;###skeletalLimbs,Arthritis ###skinNailsHairSkin,Rash (erythematous macules or papules) ###neurologicCentralNervousSystem,Headache ###hematology,Leukocytosis (mean leukocyte count 18.7 x 10(9)/L) ;###hematology,Neutrophilia ###immunology,Elevated polyclonal IgD (equal to or greater than 100 IU/ml) ;###immunology,Elevated IgA (equal to or greater than 2.6g/L) ;###immunology,Lymphadenopathy (cervical, inguinal, axillary) ###laboratoryAbnormalities,Mildly elevated urinary mevalonic acid ;###laboratoryAbnormalities,Elevated erythrocyte sedimentation rate (mean 90mm/h) ###miscellaneous,Prodromal symptoms include nasal congestion, dry throat, severe fatigue, vertigo, and headache ;###miscellaneous,Recurrent febrile crises preceded by chills and accompanied by headache and bilateral cervical lymphadenopathy ;###miscellaneous,Febrile attacks disappear in adulthood in some patients ;###miscellaneous,Onset of symptoms less than one year ;###miscellaneous,Allelic to mevalonic aciduria ();###miscellaneous,Length of attack, 3 to 7 days ;###miscellaneous,Frequency of attack, monthly - bimonthly ###molecularBasis,Caused by mutation in the mevalonate kinase gene (MVK, ) 2.$$$mimNumber,610377###prefix,####preferredTitle,MEVALONIC ACIDURIA; MEVA###inheritance,Autosomal recessive ###growthHeight,Short stature ###growthOther,Failure to thrive ###headAndNeckHead,Microcephaly ;###headAndNeckHead,Dolichocephaly ;###headAndNeckHead,Wide, irregular fontanels ###headAndNeckFace,Triangular face ###headAndNeckEars,Low-set ears ;###headAndNeckEars,Posteriorly rotated ears ###headAndNeckEyes,Downslanting palpebral fissures ;###headAndNeckEyes,Blue sclerae ;###headAndNeckEyes,Central cataracts ;###headAndNeckEyes,Nystagmus ;###headAndNeckEyes,Nuclear cataract (in some patients) Retinal dystrophy (in some patients) ;###headAndNeckEyes,Undetectable rod and cone responses on electroretinography ;###headAndNeckEyes,Attenuation of retinal vessels ;###headAndNeckEyes,Moderate atrophy of optic disc ###abdomenLiver,Fluctuating hepatomegaly ###abdomenSpleen,Fluctuating splenomegaly ###abdomenGastrointestinal,Vomiting ;###abdomenGastrointestinal,Diarrhea ###skeletalSpine,Kyphoscoliosis (in some patients) ###skeletalLimbs,Arthralgias ###skinNailsHairSkin,Morbilliform rash ;###skinNailsHairSkin,Edema ###neurologicCentralNervousSystem,Psychomotor retardation ;###neurologicCentralNervousSystem,Hypotonia ;###neurologicCentralNervousSystem,Progressive ataxia (onset second year of life) ;###neurologicCentralNervousSystem,Developmental delay ;###neurologicCentralNervousSystem,Cerebellar atrophy ;###neurologicCentralNervousSystem,Cerebral atrophy ;###neurologicCentralNervousSystem,Agenesis of cerebellar vermis ###hematology,Normocytic hypoplastic anemia ;###hematology,Leukocytosis ;###hematology,Thrombocytopenia ###immunology,Elevated IgD ###laboratoryAbnormalities,Elevated serum creatine kinase ;###laboratoryAbnormalities,Elevated transaminases ;###laboratoryAbnormalities,Serum cholesterol low or normal ;###laboratoryAbnormalities,Elevated leukotriene E(4) ;###laboratoryAbnormalities,Decreased ubiquinone-10 ;###laboratoryAbnormalities,Elevated urinary mevalonic acid ###miscellaneous,Recurrent febrile crises with lymphadenopathy, hepatosplenomegaly, vomiting, and diarrhea ;###miscellaneous,Onset of crises in early childhood ;###miscellaneous,Febrile crises decrease with age, with ataxia becoming the predominant symptom (in some patients) ;###miscellaneous,Rash, edema, and arthralgia may occur during crisis ;###miscellaneous,Allelic to hyperimmunoglobulinemia D syndrome (HIDS, )###molecularBasis,Caused by mutation in the mevalonate kinase gene (MVK, ) 3.$$$mimNumber,175900###prefix,####preferredTitle,POROKERATOSIS 3, MULTIPLE TYPES; POROK3###inheritance,Autosomal dominant ###skinNailsHairSkin,Small, annular, anhidrotic keratotic lesions located predominantly on sun-exposed areas ;###skinNailsHairSkin,Central atrophic area with peripheral keratotic ridge ;###skinNailsHairSkin,Disseminated superficial actinic porokeratosis ;###skinNailsHairSkin,Non-actinic disseminated superficial porokeratosis ;###skinNailsHairSkin,Porokeratosis of Mibelli ;###skinNailsHairSkin,Giant plaque of porokeratosis ptychotropica ;###skinNailsHairSkin,Hyperkeratotic porokeratosis ;###skinNailsHairSkin,Widespread keratinized plaques (in some patients) ;###skinNailsHairSkin,Verrucous proliferation (in some patients) ;###skinNailsHairSkin,Linear porokeratosis (rare) ###skinNailsHairSkinHistology,Epidermal atrophy ;###skinNailsHairSkinHistology,Vertical columns of parakeratosis (cornoid lamella) overlying absent or reduced granular layer with dyskeratotic cells ;###skinNailsHairSkinHistology,Nonspecific perivascular infiltrate of chronic inflammatory cells ###skinNailsHairNails,Nail dystrophy (in some patients) ###miscellaneous,Onset of lesions usually in first through fourth decades of life, but may occur as late as the seventh decade ;###miscellaneous,Intrafamilial variability ###molecularBasis,Caused by mutation in the mevalonate kinase gene (MVK, )",https://www.omim.org/entry/260920;https://www.omim.org/entry/610377;https://www.omim.org/entry/175900,.,Autosomal recessive;Autosomal dominant,Het,12,110012660,G,A,.,.,PASS,0/1:19:47,40.43,"..AA..Aa,,a.,.,Aaa.,,AA,,A,.a,,,AaAaaaA..,,^]A",synonymous_variant;synonymous_variant,MVK,4598,.,NM_000431.2(MVK):c.33G>A(p.Pro11=);NM_001114185.1(MVK):c.33G>A(p.Pro11=),NM_000431.3,exon2(11);exon2(11),.;.,.,.,0,0,3.348e-05,0.0004,.,.,0,2,0.00034,0,3,0.000041,0.00471142520612,4/849,http://exac.broadinstitute.org/variant/12-110012660-G-A,1.13,15.0,5,0.04,http://exac.broadinstitute.org/gene/ENSG00000110921,.,.,.,.,.,.,.,.,.,.,.,.,.,.,.,.,.,.,.,.,.,.,.,.,.,.,.,"NM_000431.3(MVK):c.34G>C(p.G12R),DM,Disseminated superficial actinic porokeratosis,22983302",.,.,.,.,.,.,.,.,.,.,.,.,.,.,.,.,.,.,.,.,"cholesterol biosynthetic process (GO:0006695)|isopentenyl diphosphate biosynthetic process, mevalonate pathway (GO:0019287)|isoprenoid biosynthetic process (GO:0008299)|negative regulation of inflammatory response (GO:0050728)|small molecule metabolic process (GO:0044281)",cytosol (GO:0005829)|extracellular vesicular exosome (GO:0070062),ATP binding (GO:0005524)|identical protein binding (GO:0042802)|mevalonate kinase activity (GO:0004496),.,.,.,.,75,3,CS000030
165,.,.,OMIM|novel,.,.,CS000030,253290;601462;608930,"Multiple pterygium syndrome, lethal type;Myasthenic syndrome, congenital, 1A, slow-channel;Myasthenic syndrome, congenital, 1B, fast-channel","1.$$$mimNumber,253290###prefix,####preferredTitle,MULTIPLE PTERYGIUM SYNDROME, LETHAL TYPE; LMPS###inheritance,Autosomal recessive ###growthOther,Intrauterine growth retardation ###headAndNeckFace,Dysmorphic facies ;###headAndNeckFace,Micrognathia ###headAndNeckEars,Low-set ears ###headAndNeckEyes,Epicanthal folds ;###headAndNeckEyes,Hypertelorism ###headAndNeckNose,Flat nose ###headAndNeckMouth,Cleft lip/palate ;###headAndNeckMouth,Cleft palate ###headAndNeckNeck,Cystic hygroma ;###headAndNeckNeck,Jugular lymphatic obstruction sequence ###cardiovascularHeart,Hypoplastic heart ###respiratoryLung,Hypoplastic lungs ###chestRibsSternumClaviclesAndScapulae,Thin ribs ###skeletal,Fractures ;###skeletal,Congenital bone fusions ###skeletalSpine,Abnormal cervical curvature ;###skeletalSpine,Spinal fusion ###skeletalLimbs,Joint dislocations ;###skeletalLimbs,Flexion contractures ###skeletalHands,Microbrachydactyly ###skinNailsHairSkin,Multiple pterygia ###muscleSoftTissue,Generalized amyoplasia ###neurologicCentralNervousSystem,Early severe fetal akinesia sequence ###metabolicFeatures,Malignant hyperthermia ###prenatalManifestations,Hydrops ###prenatalManifestationsAmnioticFluid,Polyhydramnios ###miscellaneous,Lethal ###molecularBasis,Caused by mutation in the cholinergic receptor, nicotinic, alpha polypeptide-1, muscle gene (CHRNA1, );###molecularBasis,Caused by mutation in the cholinergic receptor, nicotinic, delta polypeptide gene (CHRND, );###molecularBasis,Caused by mutation in the cholinergic receptor, nicotinic, gamma polypeptide gene (CHRNG, ) 2.$$$mimNumber,601462###prefix,####preferredTitle,MYASTHENIC SYNDROME, CONGENITAL, 1A, SLOW-CHANNEL; CMS1A###inheritance,Autosomal dominant ###headAndNeckEyes,Ophthalmoplegia ;###headAndNeckEyes,Ptosis ###headAndNeckMouth,High-arched palate (in some patients) ###respiratory,Respiratory insufficiency, episodic ###abdomenGastrointestinal,Feeding difficulties ;###abdomenGastrointestinal,Dysphagia ###muscleSoftTissue,Generalized muscle weakness due to defect at the neuromuscular junction ;###muscleSoftTissue,Cervical muscle weakness ;###muscleSoftTissue,Scapular muscle weakness ;###muscleSoftTissue,Extensor finger muscle weakness ;###muscleSoftTissue,Atrophy of affected muscles, especially intrinsic hand muscles ;###muscleSoftTissue,Chronic fatigable muscles ;###muscleSoftTissue,Dysarthria ;###muscleSoftTissue,Repetitive compound muscle action potentials (CMAP) in response to single stimulus ;###muscleSoftTissue,Decremental CMAP response to repetitive nerve stimulation seen on EMG ;###muscleSoftTissue,Prolonged miniature endplate potentials (MEPP) ;###muscleSoftTissue,Prolonged miniature endplate currents (MEPC) ;###muscleSoftTissue,Increased opening duration of acetylcholine receptor (AChR)-induced ion channels ;###muscleSoftTissue,Focal degeneration of junctional folds ('honeycombed' appearance) see on muscle biopsy ;###muscleSoftTissue,Thickened endplate basal lamina seen on muscle biopsy ;###muscleSoftTissue,Decreased size of nerve terminals seen on muscle biopsy ;###muscleSoftTissue,Progressive widening of synaptic clefts that are filled with amorphous debris seen on muscle biopsy ;###muscleSoftTissue,Calcium accumulation in junctional folds seen on muscle biopsy ;###muscleSoftTissue,Secondary loss of AChR from junctional folds seen on muscle biopsy ###miscellaneous,Variable age at onset ;###miscellaneous,Usually symptomatic in adulthood with history of weakness since infancy or childhood ;###miscellaneous,Exacerbation of symptoms during or after pregnancy ;###miscellaneous,Progressive disorder due to secondary myopathy ;###miscellaneous,Poor response to acetylcholinesterase inhibitors ;###miscellaneous,Quinidine therapy may be effective ;###miscellaneous,Fluoxetine therapy may be effective ###molecularBasis,Caused by mutation in the cholinergic receptor, nicotinic, alpha polypeptide-1 gene (CHRNA1, ) 3.$$$mimNumber,608930###prefix,####preferredTitle,MYASTHENIC SYNDROME, CONGENITAL, 1B, FAST-CHANNEL; CMS1B###inheritance,Autosomal dominant ;###inheritance,Autosomal recessive ###headAndNeckFace,Facial muscle weakness ###headAndNeckEyes,Ptosis ;###headAndNeckEyes,Ophthalmoparesis ###headAndNeckNeck,Neck muscle weakness ###respiratory,Respiratory insufficiency due to muscle weakness (especially in infancy) ###abdomenGastrointestinal,Poor feeding due to muscle weakness ;###abdomenGastrointestinal,Poor suck ;###abdomenGastrointestinal,Dysphagia ###muscleSoftTissue,Hypotonia, neonatal ;###muscleSoftTissue,Generalized muscle weakness ;###muscleSoftTissue,Bulbar muscle weakness ;###muscleSoftTissue,Easy fatigability ;###muscleSoftTissue,Inability to stand or walk (in severe cases) ;###muscleSoftTissue,Gowers sign ;###muscleSoftTissue,Dysarthria ;###muscleSoftTissue,Decremental compound muscle action potential (CMAP) in response to repetitive nerve stimulation seen on EMG ;###muscleSoftTissue,Small miniature endplate potentials (MEPP) ;###muscleSoftTissue,Small miniature endplate currents (MEPC) ;###muscleSoftTissue,Shortened acetylcholine receptor (AChR)-induced ion channel opening ;###muscleSoftTissue,Decreased numbers of AChR seen on muscle biopsy ;###muscleSoftTissue,Increased numbers of endplate regions seen on muscle biopsy ;###muscleSoftTissue,Increased length of endplate regions seen on muscle biopsy ;###muscleSoftTissue,Preserved nerve terminals seen on muscle biopsy ;###muscleSoftTissue,Preserved junctional structure seen on muscle biopsy ###neurologicCentralNervousSystem,Delayed motor development due to muscle weakness ###voice,Weak cry ###miscellaneous,Onset in infancy or early childhood ;###miscellaneous,Variable severity ;###miscellaneous,Favorable response to acetylcholinesterase inhibitors ;###miscellaneous,Favorable response to 3,4-diaminopyridine ;###miscellaneous,Rare autosomal dominant inheritance has been reported ###molecularBasis,Caused by mutations in the cholinergic receptor, nicotinic, alpha polypeptide-1 gene (CHRNA1, )",https://www.omim.org/entry/253290;https://www.omim.org/entry/601462;https://www.omim.org/entry/608930,.,"Autosomal recessive;Autosomal dominant;Autosomal recessive, Autosomal dominant",Het,2,175614719,G,T,.,.,PASS,0/1:17:37,45.95,".$.T..T.T.,Tt.TT..TTtT,.T....T.T...T^]T",missense_variant;missense_variant,CHRNA1,1134,.,NM_000079.3(CHRNA1):c.957C>A(p.His319Gln);NM_001039523.2(CHRNA1):c.1032C>A(p.His344Gln),NM_000079.3,exon7(9);exon8(10),P+=>P0;P+=>P0,.,.,.,.,.,.,.,.,.,.,.,.,.,.,0.00117785630153,1/849,.,0.64,15.0,10,0.0,http://exac.broadinstitute.org/gene/ENSG00000138435,0.55325,.,0,D,1.0,D,0.999,D,0.000,D,1.000,D,3.6,16.21,.,.,.,.,.,.,.,.,.,.,.,.,.,.,.,.,.,.,.,.,.,.,.,.,.,.,.,.,.,.,.,.,.,.,cation transmembrane transport (GO:0098655)|cation transport (GO:0006812)|ion transmembrane transport (GO:0034220)|muscle cell cellular homeostasis (GO:0046716)|musculoskeletal movement (GO:0050881)|neuromuscular junction development (GO:0007528)|neuromuscular process (GO:0050905)|neuromuscular synaptic transmission (GO:0007274)|neuron cellular homeostasis (GO:0070050)|neuronal action potential (GO:0019228)|regulation of membrane potential (GO:0042391)|signal transduction (GO:0007165)|skeletal muscle contraction (GO:0003009)|skeletal muscle tissue growth (GO:0048630)|synaptic transmission (GO:0007268)|transport (GO:0006810),acetylcholine-gated channel complex (GO:0005892)|cell junction (GO:0030054)|cell surface (GO:0009986)|neuromuscular junction (GO:0031594)|plasma membrane (GO:0005886)|postsynaptic membrane (GO:0045211),acetylcholine binding (GO:0042166)|acetylcholine receptor activity (GO:0015464)|acetylcholine-activated cation-selective channel activity (GO:0004889)|ion channel activity (GO:0005216),.,.,.,.,56,1,CS000030
248,.,.,HGMD|novel|possible_comhet,Name=LowComplexity,.,CS000030,.,.,.,.,.,.,Het,19,39075697,T,A,.,.,PASS,0/1:44:76,57.89,",,a,aaAa,Aaaa,a,aAaAaaaa,a,,aa,a.,,Aa.A,.,aAa,,,A.a,.aAAaa,,A,AA,a,.,a.,A",missense_variant;missense_variant,RYR1,11184,.,NM_000540.2(RYR1):c.14761T>A(p.Phe4921Ile);NM_001042723.1(RYR1):c.14746T>A(p.Phe4916Ile),NM_000540.2,exon102(106);exon101(105),NP=>NP;NP=>NP,.,.,.,.,.,.,.,.,.,.,.,.,.,.,0.00117785630153,1/849,.,4.44,179.9,50,0.0,http://exac.broadinstitute.org/gene/ENSG00000196218,0.63290,.,0,D,0.997,D,0.994,D,0.000,U,1.000,D,4.97,17.68,.,.,.,.,.,NM_000540.2(RYR1):c.14761_14762delTTinsAC,DM,Central core disease,16621918,.,.,.,.,"NM_000540.2(RYR1):c.14762T>C(p.F4921S),DM,Central core disease,16621918",.,.,.,.,.,.,.,.,.,.,.,.,.,.,.,.,.,.,.,.,activation of JUN kinase activity (GO:0007257)|activation of MAPKKK activity (GO:0000185)|cell proliferation (GO:0008283)|intracellular signal transduction (GO:0035556)|peptidyl-serine phosphorylation (GO:0018105)|protein autophosphorylation (GO:0046777)|protein phosphorylation (GO:0006468)|response to stress (GO:0006950),membrane (GO:0016020),ATP binding (GO:0005524)|MAP kinase kinase kinase kinase activity (GO:0008349)|protein kinase activity (GO:0004672)|protein serine/threonine kinase activity (GO:0004674)|small GTPase regulator activity (GO:0005083),.,.,.,.,4,0,CS000030
399,.,.,OMIM|low_frequency,Name=GCcontent,.,CS000030,264700,"Vitamin D-dependent rickets, type I","1.$$$mimNumber,264700###prefix,####preferredTitle,VITAMIN D HYDROXYLATION-DEFICIENT RICKETS, TYPE 1A; VDDR1A###inheritance,Autosomal recessive ###growthOther,Failure to thrive ;###growthOther,Poor growth ;###growthOther,Growth retardation ###headAndNeckHead,Frontal bossing ###headAndNeckTeeth,Delayed tooth eruption ;###headAndNeckTeeth,Enamel hypoplasia ###chestRibsSternumClaviclesAndScapulae,Enlargement of the costochondral junction ;###chestRibsSternumClaviclesAndScapulae,'Bulging' of the costochondral junction ;###chestRibsSternumClaviclesAndScapulae,Deformed rib cage ###abdomenExternalFeatures,Protuberant abdomen due to muscle weakness ###skeletal,Rickets ;###skeletal,Increased fractures ;###skeletal,Bone pain ;###skeletal,Sparse bone trabeculae ;###skeletal,Thin bony cortex ###skeletalSkull,Widened cranial sutures ;###skeletalSkull,Posterior flattening of the skull ###skeletalLimbs,Delayed opacification of the epiphyses ;###skeletalLimbs,Widened, distorted epiphyses ;###skeletalLimbs,'Bulging' epiphyses ;###skeletalLimbs,Frayed, irregular metaphyses ;###skeletalLimbs,Curvatures of the femur, tibia, fibula ;###skeletalLimbs,Lower limb deformities ;###skeletalLimbs,Bowing of the legs ;###skeletalLimbs,Enlargement of the wrists ;###skeletalLimbs,Enlargement of the ankles ;###skeletalLimbs,Subperiosteal erosions due to secondary hyperparathyroidism ###muscleSoftTissue,Hypotonia ;###muscleSoftTissue,Muscle weakness ;###muscleSoftTissue,Difficulty walking ;###muscleSoftTissue,Difficulty standing ###neurologicCentralNervousSystem,Delayed motor development ;###neurologicCentralNervousSystem,Seizures due to hypocalcemia ###neurologicBehavioralPsychiatricManifestations,Irritability ###endocrineFeatures,Secondary hyperparathyroidism ###laboratoryAbnormalities,Hypocalcemia ;###laboratoryAbnormalities,Hypophosphatemia ;###laboratoryAbnormalities,Increased serum parathyroid hormone (PTH) ;###laboratoryAbnormalities,Increased serum alkaline phosphatase ;###laboratoryAbnormalities,Generalized aminoaciduria ;###laboratoryAbnormalities,Markedly decreased or absent serum 1,25-dihydroxyvitamin D3 ;###laboratoryAbnormalities,Normal serum 25-hydroxyvitamin D3 ###miscellaneous,Clinical onset within first 2 years of life ;###miscellaneous,Can be treated with physiologic levels of 1,25-dihydroxyvitamin D3 or 1-alpha-hydroxyvitamin D3 ;###miscellaneous,Increased frequency among French-Canadians from the Charlevoix-Saguenay-Lac Saint Jean area of Quebec (carrier rate 1 in 26) ###molecularBasis,Caused by mutations in the 25-hydroxyvitamin D3-1-alpha-hydroxylase gene (CYP27B1, ).",https://www.omim.org/entry/264700,.,Autosomal recessive,Het,12,58158878,T,C,.,.,PASS,0/1:43:84,51.19,",$.cc,.C,.,CCc.Ccc.Cc,cc,,c.,C.,C,Ccc,,CCc,cc.,cc,,,cc,..,c,,.C,.Ccc.cC,CCc,Cc,.c,c^]C",missense_variant,CYP27B1,1594,.,NM_000785.3(CYP27B1):c.706A>G(p.Met236Val),NM_000785.3,exon4(9),NP=>NP,.,.,0,0,1.628e-05,0.0002,3.23e-05,0.0006,0,1,0.00012,0,1,0.0000084,0.00117785630153,1/849,http://exac.broadinstitute.org/variant/12-58158878-T-C,1.91,16.8,11,0.0,http://exac.broadinstitute.org/gene/ENSG00000111012,0.80135,.,0.51,T,0.025,B,0.055,B,0.000,D,1.000,D,5.06,22.2,.,.,.,.,.,.,.,.,.,.,.,.,.,.,.,.,.,.,.,.,.,.,.,.,.,.,.,.,.,.,.,.,.,.,bone mineralization (GO:0030282)|calcitriol biosynthetic process from calciol (GO:0036378)|calcium ion homeostasis (GO:0055074)|calcium ion transport (GO:0006816)|decidualization (GO:0046697)|G1 to G0 transition (GO:0070314)|negative regulation of calcidiol 1-monooxygenase activity (GO:0010956)|negative regulation of cell growth (GO:0030308)|negative regulation of cell proliferation (GO:0008285)|positive regulation of keratinocyte differentiation (GO:0045618)|positive regulation of vitamin D 24-hydroxylase activity (GO:0010980)|positive regulation of vitamin D receptor signaling pathway (GO:0070564)|regulation of bone mineralization (GO:0030500)|response to estrogen (GO:0043627)|response to interferon-gamma (GO:0034341)|response to lipopolysaccharide (GO:0032496)|response to vitamin D (GO:0033280)|small molecule metabolic process (GO:0044281)|steroid metabolic process (GO:0008202)|vitamin D catabolic process (GO:0042369)|vitamin D metabolic process (GO:0042359)|vitamin metabolic process (GO:0006766)|xenobiotic metabolic process (GO:0006805),cytoplasm (GO:0005737)|mitochondrial outer membrane (GO:0005741)|mitochondrion (GO:0005739),calcidiol 1-monooxygenase activity (GO:0004498)|heme binding (GO:0020037)|iron ion binding (GO:0005506),.,.,.,.,70,2,CS000030
