,Variant_classification,Gene_classification,Comment,Difficultregion,CNV-SNV,ID,OMIM_Phenotype,Disease,Clinical_synopsis,OMIM_Link,Uniprot,Inheritance,Zygosity,CHR,POS,REF,ALT,Flank,Repeat_flag,FILTER,FORMAT,VAF,Pileup_data,Mutation_type,Gene_name,Entrez_Gene_Id,In_Key_Gene,HGVS_nomenclature,HGMD_transcript,ExonNumber,PolarChange,1000G_ASN_AF,1000G_ALL_AF,ESP6500_AC,ESP6500_AF,gnomAD_exome_ALL,gnomAD_exome_EAS,gnomAD_genome_ALL,gnomAD_genome_EAS,ExAC_EAS_HomoAlt_Count,ExAC_EAS_AC,ExAC_EAS_AF,ExAC_HomoAlt_Count,ExAC_AC,ExAC_AF,In_house_freq,In_house_count,ExAC_Link,ExAC_MisZ,ExAC_Expected,ExAC_observed,ExAC_PLI,PLI_Link,Phylop_Vertebrate_score,Phylop_Mammal_score,SIFT_score,SIFT_prediction,Polyphen2_HDIV_score,Polyphen2_HDIV_pred,Polyphen2_HVAR_score,Polyphen2_HVAR_pred,LRT_score,LRT_prediction,Mutationtatser_score,Mutationtatser_prediction,Gerp++,CADD,Rs_ID,Swiss_prot_function,Swiss_prot_disease_association,Swiss_prot_post_translational_modifications,Swiss_prot_expression,HGMD_mutation_type,HGMD_variant_class,HGMD_disease,HGMD_pubmed_ID,HGMD_indel_type,HGMD_Indel_class,HGMD_indel_disease,HGMD_indel_PMID,HGMD_nearby_alleles,Clinvar,Clinvar_Link,CosmicID,Cosmic_Occurence,Mother_zygosity,Mother_filter,Mother_format,Mother_VAF,Mother_pileup,Father_zygosity,Father_filter,Father_format,Father_VAF,Father_pileup,Recessive,Com_het,De_novo,Other_relatives,Covered,Less_20,GO_BP,GO_CC,GO_MF,KEGG_PATHWAY,PID_PATHWAY,BIOCARTA_PATHWAY,REACTOME_PATHWAY,pheno_rank,intersect_rank,CaseID
194,.,.,HGMD|OMIM,"Name=GCcontent,LowComplexity",.,CSS16255600102,201750;613571,Antley-Bixler syndrome with genital anomalies and disordered steroidogenesis;Disordered steroidogenesis due to cytochrome P450 oxidoreductase,"1.$$$mimNumber,201750###prefix,####preferredTitle,ANTLEY-BIXLER SYNDROME WITH GENITAL ANOMALIES AND DISORDERED STEROIDOGENESIS; ABS1###inheritance,Autosomal recessive ###growthOther,Small for gestational age ###headAndNeckHead,Brachycephaly ;###headAndNeckHead,Microcephaly ###headAndNeckFace,Frontal bossing ;###headAndNeckFace,Temporal bossing ;###headAndNeckFace,Midface hypoplasia ###headAndNeckEars,Hearing loss, conductive ;###headAndNeckEars,Simple ears ###headAndNeckEyes,Proptosis ;###headAndNeckEyes,Hypertelorism ###headAndNeckNose,Choanal stenosis ;###headAndNeckNose,Choanal atresia ;###headAndNeckNose,Depressed nasal bridge ###respiratoryLarynx,Laryngomalacia ###respiratoryAirways,Bronchomalacia ###abdomenGastrointestinal,Anteriorly places anus ###genitourinaryExternalGenitaliaMale,Micropenis ;###genitourinaryExternalGenitaliaMale,Hypospadias ;###genitourinaryExternalGenitaliaMale,Chordee ;###genitourinaryExternalGenitaliaMale,Hypoplastic scrotum ;###genitourinaryExternalGenitaliaMale,Bifid scrotum ###genitourinaryExternalGenitaliaFemale,Hypoplastic labia ;###genitourinaryExternalGenitaliaFemale,Clitoromegaly ;###genitourinaryExternalGenitaliaFemale,Fused labia ;###genitourinaryExternalGenitaliaFemale,Single urogenital orifice ###genitourinaryInternalGenitaliaMale,Cryptorchidism ###genitourinaryInternalGenitaliaFemale,Vesicovaginal fistula ;###genitourinaryInternalGenitaliaFemale,Polycystic ovary ###genitourinaryKidneys,Horseshoe kidney ###skeletalSkull,Craniosynostosis ;###skeletalSkull,Cloverleaf skull ###skeletalSpine,Hemivertebrae ;###skeletalSpine,Scoliosis ###skeletalLimbs,Elbow synostosis ;###skeletalLimbs,Ulnar bowing ;###skeletalLimbs,Radiohumeral synostosis ;###skeletalLimbs,Radioulnar synostosis ;###skeletalLimbs,Femoral bowing ;###skeletalLimbs,Femoral fractures ###skeletalHands,Camptodactyly ;###skeletalHands,Arachnodactyly ;###skeletalHands,Carpal synostosis ###skeletalFeet,Rocker-bottom feet ;###skeletalFeet,Tarsal synostosis ###neurologicCentralNervousSystem,Arnold-Chiari malformation ###endocrineFeatures,Adrenal crisis ###prenatalManifestationsAmnioticFluid,Oligohydramnios ###prenatalManifestationsPlacentaAndUmbilicalCord,Two vessel cord ###prenatalManifestationsMaternal,Maternal virilization (midpregnancy) ;###prenatalManifestationsMaternal,Low maternal serum estriol (E(3)) ###laboratoryAbnormalities,Normal baseline cortisol ;###laboratoryAbnormalities,Blunted cortisol response to adrenocorticotropic hormone (ACTH) ;###laboratoryAbnormalities,Elevated 17-hydroxyprogesterone ;###laboratoryAbnormalities,Mildly elevated ACTH ;###laboratoryAbnormalities,Elevated progesterone ;###laboratoryAbnormalities,Elevated pregnenolone ###miscellaneous,See also Antley-Bixler syndrome (ABS) with normal steroidogenesis ();###miscellaneous,Majority of POR deficiency patients have an ABS-like phenotype ;###miscellaneous,Some patients have only ambiguous genitalia or other evidence of disordered steroidogenesis ###molecularBasis,Caused by mutation in the cytochrome P450 oxidoreductase gene (POR, ) ",https://www.omim.org/entry/201750;https://www.omim.org/entry/613571,.,Autosomal recessive,Het,7,75614264,C,T,.,.,PASS,0/1:9:20,45.0,",$,,,t,Tttt,,.tt.t,",synonymous_variant,POR,5447,.,NM_000941.2(POR):c.1236C>T(p.Ser412=),NM_000941.2,exon11(16),.,0.026,0.0054,3,0.00024,0.0009,0.0117,0.0004,0.0074,0,103,0.012,0,112,0.00099,0.0130813953488,9/688,http://exac.broadinstitute.org/variant/7-75614264-C-T,-0.54,22.9,11,0.0,http://exac.broadinstitute.org/gene/ENSG00000127948,0.11812,0.0,.,.,.,.,.,.,.,.,1.000,D,-9.38,6.235,rs41301424,.,.,.,.,.,.,.,.,.,.,.,.,"NM_000941.2(POR):c.1237G>A(p.G413S),DM,POR deficiency,16467261",.,.,.,.,.,.,.,.,.,.,.,.,.,.,.,.,.,.,.,.,carnitine metabolic process (GO:0009437)|cellular organofluorine metabolic process (GO:0090346)|cellular response to follicle-stimulating hormone stimulus (GO:0071372)|cellular response to peptide hormone stimulus (GO:0071375)|demethylation (GO:0070988)|fatty acid oxidation (GO:0019395)|flavonoid metabolic process (GO:0009812)|internal peptidyl-lysine acetylation (GO:0018393)|negative regulation of apoptotic process (GO:0043066)|negative regulation of cysteine-type endopeptidase activity involved in apoptotic process (GO:0043154)|negative regulation of lipase activity (GO:0060192)|nitrate catabolic process (GO:0043602)|nitric oxide catabolic process (GO:0046210)|oxidation-reduction process (GO:0055114)|positive regulation of cholesterol biosynthetic process (GO:0045542)|positive regulation of chondrocyte differentiation (GO:0032332)|positive regulation of monooxygenase activity (GO:0032770)|positive regulation of smoothened signaling pathway (GO:0045880)|positive regulation of steroid hormone biosynthetic process (GO:0090031)|regulation of growth plate cartilage chondrocyte proliferation (GO:0003420)|response to drug (GO:0042493)|response to nutrient (GO:0007584),endoplasmic reticulum (GO:0005783)|intracellular membrane-bounded organelle (GO:0043231)|membrane (GO:0016020)|mitochondrion (GO:0005739),"cytochrome-b5 reductase activity, acting on NAD(P)H (GO:0004128)|electron carrier activity (GO:0009055)|flavin adenine dinucleotide binding (GO:0050660)|FMN binding (GO:0010181)|hydrolase activity (GO:0016787)|iron ion binding (GO:0005506)|iron-cytochrome-c reductase activity (GO:0047726)|NADP binding (GO:0050661)|NADPH-hemoprotein reductase activity (GO:0003958)|nitric oxide dioxygenase activity (GO:0008941)",.,.,.,.,69,3,CSS16255600102
204,.,.,OMIM|low_frequency,Name=SegmentalDuplications,.,CSS16255600102,148050,KBG syndrome,"1.$$$mimNumber,148050###prefix,####preferredTitle,KBG SYNDROME; KBGS###inheritance,Autosomal dominant ###growthHeight,Short stature (less than tenth percentile) ###headAndNeckHead,Microcephaly ###headAndNeckFace,Round face early in life ;###headAndNeckFace,Triangular face later in life ;###headAndNeckFace,Long philtrum ###headAndNeckEars,Large, prominent ears ###headAndNeckEyes,Hypertelorism ;###headAndNeckEyes,Telecanthus ;###headAndNeckEyes,Long palpebral fissures ;###headAndNeckEyes,Broad bushy eyebrows ###headAndNeckNose,Anteverted nares ;###headAndNeckNose,Hypoplastic alae nasi ###headAndNeckTeeth,Macrodontia ;###headAndNeckTeeth,Wide upper central incisors ;###headAndNeckTeeth,Ridged teeth ;###headAndNeckTeeth,Fused incisors ;###headAndNeckTeeth,Oligodontia ###chestRibsSternumClaviclesAndScapulae,Cervical rib fusion ;###chestRibsSternumClaviclesAndScapulae,Accessory cervical ribs ###genitourinaryInternalGenitaliaMale,Cryptorchidism ###skeletal,Delayed bone maturation ###skeletalSpine,Vertebral body fusion ;###skeletalSpine,Vertebral arch abnormalities ;###skeletalSpine,Thoracic kyphosis ###skeletalHands,Clinodactyly ;###skeletalHands,Decreased hand length ;###skeletalHands,Syndactyly ###skinNailsHairSkin,Simian crease ###skinNailsHairHair,Broad, bushy eyebrows ;###skinNailsHairHair,Low anterior hairline ;###skinNailsHairHair,Low posterior hairline ###neurologicCentralNervousSystem,Developmental delay ;###neurologicCentralNervousSystem,Mental retardation ;###neurologicCentralNervousSystem,EEG anomalies (in some patients);###neurologicCentralNervousSystem,Seizures (in some patients) ###miscellaneous,Male to female ratio 21:8 ###molecularBasis,Caused by mutation in the ankyrin repeat domain-containing protein 11 gene (ANKRD11, )",https://www.omim.org/entry/148050,.,Autosomal dominant,Het,16,89348583,A,G,.,.,PASS,0/1:22:47,46.81,",$,$,GG.,G.ggGgg.GGg,..,gGG....G,gG",missense_variant;missense_variant;missense_variant,ANKRD11,29123,.,NM_013275.5(ANKRD11):c.4367T>C(p.Leu1456Pro);NM_001256183.1(ANKRD11):c.4367T>C(p.Leu1456Pro);NM_001256182.1(ANKRD11):c.4367T>C(p.Leu1456Pro),NM_013275.5,exon9(13);exon9(13);exon10(14),NP=>NP;NP=>NP;NP=>NP,.,.,0,0,5.688e-05,0.0008,3.243e-05,0.0006,0,6,0.00069,0,6,0.000049,0.00581395348837,4/688,http://exac.broadinstitute.org/variant/16-89348583-A-G,2.76,56.0,3,1.0,http://exac.broadinstitute.org/gene/ENSG00000167522,0.14322,.,0.14,T,0.003,B,0.005,B,0.376,N,1.000,N,3.51,7.406,.,.,.,.,.,.,.,.,.,.,.,.,.,.,.,.,.,.,.,.,.,.,.,.,.,.,.,.,.,.,.,.,.,.,bone development (GO:0060348)|face morphogenesis (GO:0060325)|in utero embryonic development (GO:0001701)|multicellular organism growth (GO:0035264)|odontogenesis of dentin-containing tooth (GO:0042475)|skeletal system morphogenesis (GO:0048705)|tissue homeostasis (GO:0001894),cytoplasm (GO:0005737)|nucleus (GO:0005634)|plasma membrane (GO:0005886),.,.,.,.,.,42,2,CSS16255600102
334,.,.,OMIM|low_frequency,.,.,CSS16255600102,601884;601813;144750;607634;259770;166710;607636,"[Bone mineral density variability 1];Exudative vitreoretinopathy 4;Hyperostosis, endosteal;Osteopetrosis, autosomal dominant 1;Osteoporosis-pseudoglioma syndrome;Osteoporosis;Osteosclerosis;van Buchem disease, type 2","1.$$$mimNumber,601884###prefix,####preferredTitle,BONE MINERAL DENSITY QUANTITATIVE TRAIT LOCUS 1; BMND1###inheritance,Autosomal dominant ###skeletal,Fracture resistance ;###skeletal,Dense bones with thick cortices ;###skeletal,Elevated bone mass ###skeletalSpine,Increased spinal bone density Z(BMD) ###miscellaneous,Allelic to osteoporosis-pseudoglioma syndrome ()###molecularBasis,Caused by mutation in the low-density lipoprotein receptor-related protein 5 gene (LRP5, ) 2.$$$mimNumber,601813###prefix,####preferredTitle,EXUDATIVE VITREORETINOPATHY 4; EVR4###inheritance,Autosomal dominant ;###inheritance,Autosomal recessive ###headAndNeckEyes,Decreased visual acuity ;###headAndNeckEyes,Blindness ;###headAndNeckEyes,Falciform retinal folds ;###headAndNeckEyes,Tractional retinal detachment ;###headAndNeckEyes,Macular ectopia ;###headAndNeckEyes,Retinal exudates ;###headAndNeckEyes,Vitreous detachment ;###headAndNeckEyes,Subcapsular opacities ;###headAndNeckEyes,Peripheral retinal avascularization ;###headAndNeckEyes,Neovascularization ;###headAndNeckEyes,Vitreous hemorrhage ;###headAndNeckEyes,Horizontal pendular nystagmus ###skeletal,Decreased bone mineral density ###miscellaneous,Onset in infancy or early childhood ;###miscellaneous,Clinical variability ;###miscellaneous,Some patients may be asymptomatic ;###miscellaneous,Absence of premature birth, low birthweight, and exposure to oxygen ;###miscellaneous,Allelic disorder to osteoporosis-pseudoglioma syndrome (OPPG, );###miscellaneous,Genetic heterogeneity, see EVR1 ()###molecularBasis,Caused by mutation in the low density lipoprotein receptor-related protein-5 gene (LRP5, ) 3.$$$mimNumber,144750###prefix,####preferredTitle,ENDOSTEAL HYPEROSTOSIS, AUTOSOMAL DOMINANT###inheritance,Autosomal dominant ###growthHeight,Normal height ###headAndNeckFace,Flattened forehead (adolescence) ###headAndNeckEars,Hearing loss, sensorineural ###headAndNeckMouth,Torus palatinus ###headAndNeckTeeth,Malocclusion ;###headAndNeckTeeth,Tooth loss ###chestRibsSternumClaviclesAndScapulae,Mild rib sclerosis ;###chestRibsSternumClaviclesAndScapulae,Mild clavicular sclerosis ###skeletal,Resistance of bone to fractures ###skeletalSkull,Elongated mandible ;###skeletalSkull,Increased calvarial density ;###skeletalSkull,Increased mandibular bone density ;###skeletalSkull,Endosteal sclerosis of cranium ;###skeletalSkull,Loss of diploe ;###skeletalSkull,Increased gonial angle (AD osteosclerosis) ;###skeletalSkull,Decreased gonial angle (endosteal hyperostosis) ###skeletalSpine,Mild vertebral body sclerosis ###skeletalPelvis,Mild sclerosis ###skeletalLimbs,Thickened cortex of long bones ###skeletalHands,Metacarpal diaphyseal endosteal sclerosis ###skeletalFeet,Metatarsal diaphyseal endosteal sclerosis ###miscellaneous,Onset of disease in late childhood ;###miscellaneous,Allelic to type I osteopetrosis ()###molecularBasis,Caused by mutation in the low density lipoprotein receptor-related protein 5 gene (LRP5, ) 4.$$$mimNumber,607634###prefix,####preferredTitle,OSTEOPETROSIS, AUTOSOMAL DOMINANT 1; OPTA1###inheritance,Autosomal dominant ###headAndNeckEars,Conductive hearing loss ###skeletal,Diffuse, symmetrical osteosclerosis ;###skeletal,No increased fracture rate ###skeletalSkull,Pronounced calvarial sclerosis ;###skeletalSkull,Thickened cranial vault ###skeletalSpine,No 'rugger-jersey spine' ;###skeletalSpine,Variable sclerosis ###skeletalPelvis,No endobones ###neurologicCentralNervousSystem,Headache ###laboratoryAbnormalities,Normal serum acid phosphatase ###miscellaneous,Allelic to osteoporosis-pseudoglioma syndrome ();###miscellaneous,Progressive sclerosis with age ;###miscellaneous,Genetic heterogeneity (see ###molecularBasis,Caused by mutation in the low-density lipoprotein receptor-related protein 5 gene (LRP5, ) 5.$$$mimNumber,259770###prefix,####preferredTitle,OSTEOPOROSIS-PSEUDOGLIOMA SYNDROME; OPPG###inheritance,Autosomal recessive ###growthHeight,Short stature ###headAndNeckHead,Microcephaly ###headAndNeckEyes,Pseudoglioma ;###headAndNeckEyes,Blindness (onset in infancy) ;###headAndNeckEyes,Microphthalmia ;###headAndNeckEyes,Vitreoretinal abnormalities ;###headAndNeckEyes,Cataract ;###headAndNeckEyes,Phthisis bulbi ;###headAndNeckEyes,Absent anterior eye chamber ;###headAndNeckEyes,Iris atrophy ###cardiovascularHeart,Ventricular septal defect ###chestExternalFeatures,Barrel chest ###skeletal,Spontaneous fracture ;###skeletal,Osteoporosis (onset in childhood) ###skeletalSkull,Intraocular calcification ###skeletalSpine,Kyphoscoliosis ;###skeletalSpine,Platyspondyly ###skeletalLimbs,Hyperextensible joints ;###skeletalLimbs,Narrow diaphyses ;###skeletalLimbs,Wide metaphyses ;###skeletalLimbs,Long bone deformities ###neurologicCentralNervousSystem,Normal intelligence in most cases ;###neurologicCentralNervousSystem,Mental retardation, mild ;###neurologicCentralNervousSystem,Hypotonia ###miscellaneous,Onset of bone fragility in childhood ###molecularBasis,Caused by mutations in the low density lipoprotein receptor-related protein-5 gene (LRP5, ) 6.$$$mimNumber,607636###prefix,####preferredTitle,VAN BUCHEM DISEASE, TYPE 2###inheritance,Autosomal dominant ###skeletalSkull,Enlarged mandible ;###skeletalSkull,Increased calvarial thickness ;###skeletalSkull,Cranial osteosclerosis ###skeletalLimbs,Thickened cortices of long bones ###laboratoryAbnormalities,Normal alkaline phosphatase ###miscellaneous,Allelic to type I osteopetrosis ()###molecularBasis,Caused by mutation in the low-density lipoprotein receptor-related protein 5 gene (LRP5, )",https://www.omim.org/entry/601884;https://www.omim.org/entry/601813;https://www.omim.org/entry/144750;https://www.omim.org/entry/607634;https://www.omim.org/entry/259770;https://www.omim.org/entry/166710;https://www.omim.org/entry/607636,.,"Autosomal dominant;Autosomal recessive, Autosomal dominant;Autosomal recessive",Het,11,68181438,G,A,.,.,PASS,0/1:14:26,53.85,".AA,aa..AAAa,.a.A,^]a",missense_variant,LRP5,4041,.,NM_002335.2(LRP5):c.2785G>A(p.Ala929Thr),NM_002335.3,exon12(23),NP=>P0,.,.,1,0.000077,2.529e-05,5.835e-05,.,.,0,1,0.00012,0,2,0.000017,0.00145348837209,1/688,http://exac.broadinstitute.org/variant/11-68181438-G-A,3.28,44.9,6,1.0,http://exac.broadinstitute.org/gene/ENSG00000162337,0.55218,0.0,0.01,D,0.708,P,0.109,B,0.008,U,0.999,D,4.11,16.18,rs372374697,.,.,.,.,.,.,.,.,.,.,.,.,.,.,.,.,.,.,.,.,.,.,.,.,.,.,.,.,.,.,.,.,.,"adipose tissue development (GO:0060612)|anatomical structure regression (GO:0060033)|anterior/posterior pattern specification (GO:0009952)|apoptotic process involved in patterning of blood vessels (GO:1902262)|bone marrow development (GO:0048539)|bone morphogenesis (GO:0060349)|bone remodeling (GO:0046849)|branching involved in mammary gland duct morphogenesis (GO:0060444)|canonical Wnt signaling pathway (GO:0060070)|cell migration involved in gastrulation (GO:0042074)|cell-cell signaling involved in mammary gland development (GO:0060764)|cholesterol homeostasis (GO:0042632)|cholesterol metabolic process (GO:0008203)|embryonic camera-type eye morphogenesis (GO:0048596)|embryonic digit morphogenesis (GO:0042733)|embryonic limb morphogenesis (GO:0030326)|embryonic retina morphogenesis in camera-type eye (GO:0060059)|endocytosis (GO:0006897)|extracellular matrix-cell signaling (GO:0035426)|gastrulation with mouth forming second (GO:0001702)|glucose catabolic process (GO:0006007)|negative regulation of osteoblast differentiation (GO:0045668)|negative regulation of protein serine/threonine kinase activity (GO:0071901)|osteoblast development (GO:0002076)|positive regulation of cell proliferation (GO:0008284)|positive regulation of fat cell differentiation (GO:0045600)|positive regulation of mesenchymal cell proliferation (GO:0002053)|positive regulation of mitosis (GO:0045840)|positive regulation of osteoblast proliferation (GO:0033690)|positive regulation of sequence-specific DNA binding transcription factor activity (GO:0051091)|positive regulation of transcription from RNA polymerase II promoter (GO:0045944)|positive regulation of transcription, DNA-templated (GO:0045893)|regulation of apoptotic process (GO:0042981)|regulation of blood pressure (GO:0008217)|regulation of bone remodeling (GO:0046850)|regulation of canonical Wnt signaling pathway (GO:0060828)|regulation of insulin secretion involved in cellular response to glucose stimulus (GO:0061178)|response to peptide hormone (GO:0043434)|retina morphogenesis in camera-type eye (GO:0060042)|retinal blood vessel morphogenesis (GO:0061304)|somatic stem cell maintenance (GO:0035019)|Wnt signaling pathway (GO:0016055)|Wnt signaling pathway involved in dorsal/ventral axis specification (GO:0044332)",endoplasmic reticulum (GO:0005783)|integral component of membrane (GO:0016021)|mitochondrion (GO:0005739)|plasma membrane (GO:0005886)|receptor complex (GO:0043235),coreceptor activity (GO:0015026)|Wnt-activated receptor activity (GO:0042813)|Wnt-protein binding (GO:0017147),.,.,.,.,88,5,CSS16255600102
