,Variant_classification,Gene_classification,Comment,Difficultregion,CNV-SNV,ID,OMIM_Phenotype,Disease,Clinical_synopsis,OMIM_Link,Uniprot,Inheritance,Zygosity,CHR,POS,REF,ALT,Flank,Repeat_flag,FILTER,FORMAT,VAF,Pileup_data,Mutation_type,Gene_name,Entrez_Gene_Id,In_Key_Gene,HGVS_nomenclature,HGMD_transcript,ExonNumber,PolarChange,1000G_ASN_AF,1000G_ALL_AF,ESP6500_AC,ESP6500_AF,gnomAD_exome_ALL,gnomAD_exome_EAS,gnomAD_genome_ALL,gnomAD_genome_EAS,ExAC_EAS_HomoAlt_Count,ExAC_EAS_AC,ExAC_EAS_AF,ExAC_HomoAlt_Count,ExAC_AC,ExAC_AF,In_house_freq,In_house_count,ExAC_Link,ExAC_MisZ,ExAC_Expected,ExAC_observed,ExAC_PLI,PLI_Link,Phylop_Vertebrate_score,Phylop_Mammal_score,SIFT_score,SIFT_prediction,Polyphen2_HDIV_score,Polyphen2_HDIV_pred,Polyphen2_HVAR_score,Polyphen2_HVAR_pred,LRT_score,LRT_prediction,Mutationtatser_score,Mutationtatser_prediction,Gerp++,CADD,Rs_ID,Swiss_prot_function,Swiss_prot_disease_association,Swiss_prot_post_translational_modifications,Swiss_prot_expression,HGMD_mutation_type,HGMD_variant_class,HGMD_disease,HGMD_pubmed_ID,HGMD_indel_type,HGMD_Indel_class,HGMD_indel_disease,HGMD_indel_PMID,HGMD_nearby_alleles,Clinvar,Clinvar_Link,CosmicID,Cosmic_Occurence,Mother_zygosity,Mother_filter,Mother_format,Mother_VAF,Mother_pileup,Father_zygosity,Father_filter,Father_format,Father_VAF,Father_pileup,Recessive,Com_het,De_novo,Other_relatives,Covered,Less_20,GO_BP,GO_CC,GO_MF,KEGG_PATHWAY,PID_PATHWAY,BIOCARTA_PATHWAY,REACTOME_PATHWAY,pheno_rank,intersect_rank,CaseID
15,.,.,OMIM|low_frequency,Name=LowComplexity,.,CSS17029200102,309520;300895;305450,"Lujan-Fryns syndrome;Ohdo syndrome, X-linked;Opitz-Kaveggia syndrome","1.$$$mimNumber,309520###prefix,####preferredTitle,LUJAN-FRYNS SYNDROME###inheritance,X-linked recessive ###growthHeight,Tall stature ###growthOther,Marfanoid habitus ###headAndNeckHead,Macrocephaly ###headAndNeckFace,Prominent forehead ;###headAndNeckFace,Long face ;###headAndNeckFace,Narrow face ;###headAndNeckFace,Maxillary hypoplasia ;###headAndNeckFace,Micrognathia ;###headAndNeckFace,Short philtrum ;###headAndNeckFace,Deep philtrum ###headAndNeckEars,Low-set ears ;###headAndNeckEars,Abnormally folded helix ###headAndNeckNose,Long nose ;###headAndNeckNose,High nasal bridge ;###headAndNeckNose,Narrow nasal bridge ###headAndNeckMouth,High-arched palate ;###headAndNeckMouth,Thin upper lip ;###headAndNeckMouth,Open mouth ###headAndNeckTeeth,Double row of teeth ;###headAndNeckTeeth,Crowded teeth ###cardiovascularHeart,Atrial septal defect ;###cardiovascularHeart,Ventricular septal defect ###cardiovascularVascular,Ascending aortic aneurysm ###chestExternalFeatures,Pectus excavatum ###genitourinaryInternalGenitaliaMale,Borderline to large testes ###skeletal,Joint laxity ;###skeletal,Joint contractures ###skeletalSkull,Small mandible ###skeletalHands,Long fingers ;###skeletalHands,Thin fingers ;###skeletalHands,Broad thumbs ###neurologicCentralNervousSystem,Mental retardation, mild to moderate ;###neurologicCentralNervousSystem,Hypotonia, generalized ;###neurologicCentralNervousSystem,Seizures ;###neurologicCentralNervousSystem,Agenesis of the corpus callosum ###neurologicBehavioralPsychiatricManifestations,Aggressive behavior ;###neurologicBehavioralPsychiatricManifestations,Autistic-like behavior ;###neurologicBehavioralPsychiatricManifestations,Poor social interactions ;###neurologicBehavioralPsychiatricManifestations,Hyperactivity ;###neurologicBehavioralPsychiatricManifestations,Emotional instability ;###neurologicBehavioralPsychiatricManifestations,Obsessive compulsive disorder ;###neurologicBehavioralPsychiatricManifestations,Poor impulse control ;###neurologicBehavioralPsychiatricManifestations,Low frustration tolerance ;###neurologicBehavioralPsychiatricManifestations,Psychosis ###voice,Hypernasal voice ###miscellaneous,Allelic disorder to Opitz-Kaveggia syndrome ()###molecularBasis,Caused by mutation in the S. cerevisiae homolog of mediator of RNA polymerase II transcription, subunit 12 gene (MED12, ) 2.$$$mimNumber,300895###prefix,####preferredTitle,OHDO SYNDROME, X-LINKED; OHDOX###inheritance,X-linked recessive ###growthWeight,Low weight ###headAndNeckFace,Coarse facial features ###headAndNeckEars,Deafness ###headAndNeckEyes,Blepharophimosis ;###headAndNeckEyes,Ptosis ###headAndNeckNose,Wide nasal bridge ;###headAndNeckNose,Depressed nasal bridge ;###headAndNeckNose,Large nose ;###headAndNeckNose,Bulbous nose ###headAndNeckMouth,Long philtrum ;###headAndNeckMouth,Flat philtrum ;###headAndNeckMouth,Thin vermilion ;###headAndNeckMouth,Microstomia ;###headAndNeckMouth,Micrognathia ###abdomenGastrointestinal,Feeding problems ###genitourinaryInternalGenitaliaMale,Cryptorchidism ;###genitourinaryInternalGenitaliaMale,Scrotal hypoplasia ###skeletalLimbs,Joint hyperextensibility ###skeletalHands,Clinodactyly ###skeletalFeet,Overriding 3rd toes ###skinNailsHairSkin,Cafe-au-lait spots ###neurologicCentralNervousSystem,Developmental delay ;###neurologicCentralNervousSystem,Mental retardation ###molecularBasis,Caused by mutation in the homolog of the S. cerevisiae mediator of RNA polymerase II transcription, subunit 12 (MED12, ) 3.$$$mimNumber,305450###prefix,####preferredTitle,OPITZ-KAVEGGIA SYNDROME; OKS###inheritance,X-linked recessive ###growthHeight,Short stature ###headAndNeckHead,Macrocephaly ;###headAndNeckHead,Large anterior fontanel ;###headAndNeckHead,Plagiocephaly ###headAndNeckFace,Prominent forehead ;###headAndNeckFace,Frontal hair upsweep ;###headAndNeckFace,Micrognathia ;###headAndNeckFace,Long philtrum ###headAndNeckEars,Small ears ;###headAndNeckEars,Sensorineural hearing loss ###headAndNeckEyes,Strabismus ;###headAndNeckEyes,Hypertelorism ;###headAndNeckEyes,Epicanthal folds ;###headAndNeckEyes,Downward slanting palpebral fissures ;###headAndNeckEyes,Medial eyebrow flare ###headAndNeckNose,Prominent nose ###headAndNeckMouth,Prominent lower lip ;###headAndNeckMouth,Narrow palate ;###headAndNeckMouth,Cleft lip ;###headAndNeckMouth,Cleft palate ;###headAndNeckMouth,Large mouth ###headAndNeckTeeth,Dental crowding ###headAndNeckNeck,Short neck ###respiratoryNasopharynx,Choanal atresia ###abdomenExternalFeatures,Umbilical hernia ###abdomenGastrointestinal,Anal stenosis ;###abdomenGastrointestinal,Imperforate anus ;###abdomenGastrointestinal,Anteriorly placed anus ;###abdomenGastrointestinal,Constipation ;###abdomenGastrointestinal,Pyloric stenosis ;###abdomenGastrointestinal,Malrotation ###genitourinaryExternalGenitaliaMale,Hypospadias ###genitourinaryInternalGenitaliaMale,Cryptorchidism ;###genitourinaryInternalGenitaliaMale,Inguinal hernia ###skeletalSkull,Delayed closure of anterior fontanel ###skeletalSpine,Lumbar hyperlordosis ###skeletalLimbs,Joint hyperlaxity (infancy) ;###skeletalLimbs,Joint contractures ###skeletalHands,Broad thumbs ;###skeletalHands,Clinodactyly ;###skeletalHands,Camptodactyly ;###skeletalHands,Syndactyly ;###skeletalHands,Single transverse palmar crease ;###skeletalHands,Persistent fetal fingertip pads ###skeletalFeet,Broad halluces ###skinNailsHairSkin,Facial wrinkling ;###skinNailsHairSkin,Sacral dimple ;###skinNailsHairSkin,Perianal skin tags ;###skinNailsHairSkin,Single transverse palmar crease ;###skinNailsHairSkin,Persistent fetal fingertip pads ###skinNailsHairHair,Frontal hair upsweep ;###skinNailsHairHair,Fine hair ;###skinNailsHairHair,Sparse hair ###neurologicCentralNervousSystem,Global developmental delay ;###neurologicCentralNervousSystem,Mental retardation ;###neurologicCentralNervousSystem,Neonatal hypotonia ;###neurologicCentralNervousSystem,Seizures ;###neurologicCentralNervousSystem,Hydrocephalus ;###neurologicCentralNervousSystem,Agenesis of corpus callosum ;###neurologicCentralNervousSystem,Heterotopia ###neurologicBehavioralPsychiatricManifestations,Attention deficit disorder ;###neurologicBehavioralPsychiatricManifestations,Hyperactivity ;###neurologicBehavioralPsychiatricManifestations,Friendly, sociable personality ###voice,High-pitched voice ###molecularBasis,Caused by mutation in the homolog of S. cerevisiae mediator of RNA polymerase II transcription, subunit 12 gene (MED12, )",https://www.omim.org/entry/309520;https://www.omim.org/entry/300895;https://www.omim.org/entry/305450,.,X-linked recessive,Het,X,70361097,-,CAG,.,Name=693:(CAG)n:Simple_repeat,PASS,0/1:75:140,53.57,"....,....,.....+3CAG.,.+3CAG,+3cag...+3CAG.+3CAG,.+3CAG.,,+3cag,,+3cag.+3CAG..+3CAG,+3cag..+3CAG.,+3cag..+3CAG,.+3CAG.+3CAG...,+3cag.+3CAG.+3CAG.+3CAG..,...+3CAG.+3CAG.+3CAG..+3CAG...+3CAG,+3cag.,+3cag,+3cag,.+3CAG.,+3cag,.+3CAG,,..+3CAG.+3CAG.+3CAG,+3cag,+3cag.+3CAG.+3CAG.+3CAG....+3CAG.+3CAG,+3cag.,+3cag,.,.+3CAG.+3CAG,,,.,+3cag.+3CAG.+3CAG,+3cag,..+3CAG..+3CAG..+3CAG,+3cag.+3CAG,,.+3CAG.,+3cag..+3CAG.,+3cag,+3cag....+3CAG,,..,.+3CAG.-3CAG,.+3CAG.+3CAG.+3CAG,.,+3cag..+3CAG,",inframe_insertion,MED12,9968,.,NM_005120.2(MED12):c.6306_6308dupGCA(p.Gln2115dup),NM_005120.2,exon43(45),.,.,.,.,.,5.658e-05,0.0001,.,.,0,0,0,0,2,0.00013,.,.,http://exac.broadinstitute.org/variant/X-70361097-A-ACAG,6.64,56.2,0,1.0,http://exac.broadinstitute.org/gene/ENSG00000184634,.,.,.,.,.,.,.,.,.,.,.,.,.,.,.,.,.,.,.,.,.,.,.,.,.,.,.,.,.,.,"COSM3686249,COSM3686250",1(large_intestine),.,.,.,.,.,.,.,.,.,.,.,.,.,.,.,.,"androgen receptor signaling pathway (GO:0030521)|axis elongation involved in somitogenesis (GO:0090245)|canonical Wnt signaling pathway (GO:0060070)|gene expression (GO:0010467)|heart development (GO:0007507)|intracellular steroid hormone receptor signaling pathway (GO:0030518)|negative regulation of Wnt signaling pathway (GO:0030178)|neural tube closure (GO:0001843)|oligodendrocyte development (GO:0014003)|positive regulation of transcription from RNA polymerase II promoter (GO:0045944)|positive regulation of transcription, DNA-templated (GO:0045893)|Schwann cell development (GO:0014044)|stem cell maintenance (GO:0019827)|transcription initiation from RNA polymerase II promoter (GO:0006367)|Wnt signaling pathway, planar cell polarity pathway (GO:0060071)",mediator complex (GO:0016592)|membrane (GO:0016020)|nucleoplasm (GO:0005654)|nucleus (GO:0005634),chromatin binding (GO:0003682)|ligand-dependent nuclear receptor transcription coactivator activity (GO:0030374)|protein C-terminus binding (GO:0008022)|protein domain specific binding (GO:0019904)|receptor activity (GO:0004872)|RNA polymerase II distal enhancer sequence-specific DNA binding (GO:0000980)|RNA polymerase II transcription cofactor activity (GO:0001104)|RNA polymerase II transcription factor binding transcription factor activity involved in positive regulation of transcription (GO:0001190)|thyroid hormone receptor binding (GO:0046966)|transcription coactivator activity (GO:0003713)|transcription cofactor activity (GO:0003712)|vitamin D receptor binding (GO:0042809),.,.,.,.,55,4,CSS17029200102
74,.,.,OMIM|truncating|novel,.,.,CSS17029200102,112600;235200,"Brachydactyly, type A2;HFE hemochromatosis, modifier of","1.$$$mimNumber,112600###prefix,####preferredTitle,BRACHYDACTYLY, TYPE A2; BDA2###inheritance,Autosomal dominant ###skeletalHands,Brachydactyly ;###skeletalHands,Medially deviated index finger ;###skeletalHands,Short index finger ;###skeletalHands,Variable fifth finger clinodactyly ;###skeletalHands,Hypoplastic/aplastic middle phalanx (2nd finger) ;###skeletalHands,Hypoplastic middle phalanx (5th finger) ###skeletalFeet,Short, broad laterally deviated halluces ;###skeletalFeet,Medially deviated second toe ;###skeletalFeet,Syndactyly (2-3) ###molecularBasis,Caused by mutation in the bone morphogenetic protein receptor, type 1B gene (BMPR1B, );###molecularBasis,Caused by mutation in the growth/differentiation factor 5 gene (GD5, );###molecularBasis,Caused by mutation in the bone morphogenetic protein 2 gene (BMP2, ) 2.$$$mimNumber,235200###prefix,####preferredTitle,HEMOCHROMATOSIS, TYPE 1; HFE1###inheritance,Autosomal recessive ###cardiovascularHeart,Cardiomyopathy ;###cardiovascularHeart,Congestive heart failure ;###cardiovascularHeart,Arrhythmia ;###cardiovascularHeart,Cardiomegaly ###respiratoryLung,Pleural effusion ###abdomen,Abdominal pain ;###abdomen,Ascites ###abdomenLiver,Cirrhosis ;###abdomenLiver,Hepatomegaly ;###abdomenLiver,Hepatocellular carcinoma ###abdomenSpleen,Splenomegaly ###genitourinaryExternalGenitaliaMale,Impotence ;###genitourinaryExternalGenitaliaMale,Testicular atrophy ;###genitourinaryExternalGenitaliaMale,Azoospermia ###genitourinaryInternalGenitaliaFemale,Amenorrhea ###skeletal,Arthropathy ;###skeletal,Osteoporosis ###skinNailsHairSkin,Hyperpigmentation ;###skinNailsHairSkin,Telangiectases ###skinNailsHairHair,Alopecia ###endocrineFeatures,Diabetes mellitus ;###endocrineFeatures,Hypogonadotropic hypogonadism ;###endocrineFeatures,Abnormal glucose tolerance ###laboratoryAbnormalities,Increased transaminases ;###laboratoryAbnormalities,Increased serum iron ;###laboratoryAbnormalities,Increased transferrin saturation (>60%) ;###laboratoryAbnormalities,Increased serum ferritin ;###laboratoryAbnormalities,Increased hepatic parenchymal cell stainable iron ###miscellaneous,Affects between 1 in 200 to 1 in 400 individuals of northern European descent ###molecularBasis,Caused by mutation in the hereditary hemochromatosis gene (HFE, )",https://www.omim.org/entry/112600;https://www.omim.org/entry/235200,.,Autosomal dominant;Autosomal recessive,Het,20,6759311,A,-,.,.,PASS,0/1:38:82,46.34,",$.$.$..,-1a.-1A.-1A..-1A.,.-1A.-1A.-1A.-1A,.-1A,-1a,.-1A.,,,-1a.-1A,-1a,.,-1a....-1A,-1a,-1a...,-1a,-1a,-1a,-1a,..,.-1A.-1A..,-1a.-1A.,,,..,,,-1a.-1A.-1A.,-1a..-1A.-1A..,..-1A,-1a.,-1a.,-1a,^g.-1A",frameshift_variant,BMP2,650,.,NM_001200.2(BMP2):c.766delA(p.Ser256AlafsTer5),NM_001200.2,exon3(3),.,.,.,.,.,.,.,.,.,.,.,.,.,.,.,.,.,.,1.47,8.6,0,0.94,http://exac.broadinstitute.org/gene/ENSG00000125845,.,.,.,.,.,.,.,.,.,.,.,.,.,.,.,.,.,.,.,.,.,.,.,.,.,.,.,.,.,.,.,.,.,.,.,.,.,.,.,.,.,.,.,.,.,.,.,.,"activation of MAPK activity (GO:0000187)|atrioventricular valve morphogenesis (GO:0003181)|BMP signaling pathway (GO:0030509)|BMP signaling pathway involved in heart induction (GO:0003130)|bone mineralization (GO:0030282)|bone mineralization involved in bone maturation (GO:0035630)|branching involved in ureteric bud morphogenesis (GO:0001658)|cardiac epithelial to mesenchymal transition (GO:0060317)|cardiac muscle cell differentiation (GO:0055007)|cardiac muscle tissue morphogenesis (GO:0055008)|cardiocyte differentiation (GO:0035051)|cell fate commitment (GO:0045165)|cell-cell signaling (GO:0007267)|cellular response to BMP stimulus (GO:0071773)|cellular response to organic cyclic compound (GO:0071407)|chondrocyte differentiation (GO:0002062)|corticotropin hormone secreting cell differentiation (GO:0060128)|embryo development (GO:0009790)|embryonic heart tube anterior/posterior pattern specification (GO:0035054)|endocardial cushion morphogenesis (GO:0003203)|epithelial to mesenchymal transition (GO:0001837)|extracellular matrix organization (GO:0030198)|growth (GO:0040007)|heart development (GO:0007507)|in utero embryonic development (GO:0001701)|inflammatory response (GO:0006954)|inner ear development (GO:0048839)|mesenchymal cell differentiation (GO:0048762)|mesenchymal cell proliferation involved in ureteric bud development (GO:0072138)|mesenchyme development (GO:0060485)|negative regulation of aldosterone biosynthetic process (GO:0032348)|negative regulation of calcium-independent cell-cell adhesion (GO:0051042)|negative regulation of canonical Wnt signaling pathway (GO:0090090)|negative regulation of cardiac muscle cell differentiation (GO:2000726)|negative regulation of cell cycle (GO:0045786)|negative regulation of cell proliferation (GO:0008285)|negative regulation of cortisol biosynthetic process (GO:2000065)|negative regulation of insulin-like growth factor receptor signaling pathway (GO:0043569)|negative regulation of steroid biosynthetic process (GO:0010894)|negative regulation of transcription from RNA polymerase II promoter (GO:0000122)|negative regulation of transcription, DNA-templated (GO:0045892)|negative regulation of Wnt signaling pathway involved in heart development (GO:0003308)|Notch signaling pathway (GO:0007219)|odontogenesis of dentin-containing tooth (GO:0042475)|organ morphogenesis (GO:0009887)|osteoblast differentiation (GO:0001649)|pathway-restricted SMAD protein phosphorylation (GO:0060389)|pericardium development (GO:0060039)|positive regulation of apoptotic process (GO:0043065)|positive regulation of astrocyte differentiation (GO:0048711)|positive regulation of bone mineralization (GO:0030501)|positive regulation of cartilage development (GO:0061036)|positive regulation of cell migration (GO:0030335)|positive regulation of endothelial cell proliferation (GO:0001938)|positive regulation of epithelial to mesenchymal transition (GO:0010718)|positive regulation of ERK1 and ERK2 cascade (GO:0070374)|positive regulation of fat cell differentiation (GO:0045600)|positive regulation of gene expression (GO:0010628)|positive regulation of MAPK cascade (GO:0043410)|positive regulation of neuron differentiation (GO:0045666)|positive regulation of odontogenesis (GO:0042482)|positive regulation of ossification (GO:0045778)|positive regulation of osteoblast differentiation (GO:0045669)|positive regulation of osteoblast proliferation (GO:0033690)|positive regulation of p38MAPK cascade (GO:1900745)|positive regulation of pathway-restricted SMAD protein phosphorylation (GO:0010862)|positive regulation of phosphatase activity (GO:0010922)|positive regulation of protein phosphorylation (GO:0001934)|positive regulation of transcription from RNA polymerase II promoter (GO:0045944)|positive regulation of transcription from RNA polymerase II promoter involved in cellular response to chemical stimulus (GO:1901522)|positive regulation of transcription, DNA-templated (GO:0045893)|positive regulation of Wnt signaling pathway (GO:0030177)|positive regulation of Wnt signaling pathway by BMP signaling pathway (GO:0060804)|protein destabilization (GO:0031648)|protein phosphorylation (GO:0006468)|proteoglycan metabolic process (GO:0006029)|regulation of odontogenesis of dentin-containing tooth (GO:0042487)|regulation of transcription, DNA-templated (GO:0006355)|response to hypoxia (GO:0001666)|skeletal system development (GO:0001501)|SMAD protein signal transduction (GO:0060395)|telencephalon development (GO:0021537)|telencephalon regionalization (GO:0021978)|thyroid-stimulating hormone-secreting cell differentiation (GO:0060129)",cell surface (GO:0009986)|extracellular region (GO:0005576)|extracellular space (GO:0005615),BMP receptor binding (GO:0070700)|phosphatase activator activity (GO:0019211)|protein heterodimerization activity (GO:0046982)|receptor binding (GO:0005102)|retinol dehydrogenase activity (GO:0004745)|SMAD binding (GO:0046332),.,.,.,.,43,2,CSS17029200102
138,.,.,OMIM|low_frequency,.,.,CSS17029200102,147920,Kabuki syndrome 1,"1.$$$mimNumber,147920###prefix,####preferredTitle,KABUKI SYNDROME 1; KABUK1###inheritance,Autosomal dominant ###growthOther,Postnatal growth retardation ###headAndNeckHead,Microcephaly ###headAndNeckFace,Trapezoid philtrum ###headAndNeckEars,Large prominent ears ;###headAndNeckEars,Recurrent otitis media in infancy ;###headAndNeckEars,Posteriorly rotated ears ;###headAndNeckEars,Hearing loss ;###headAndNeckEars,Preauricular pit ###headAndNeckEyes,Long palpebral fissures ;###headAndNeckEyes,Eversion of lateral third of lower eyelids ;###headAndNeckEyes,Thick eyelashes ;###headAndNeckEyes,Ptosis ;###headAndNeckEyes,Blue sclerae ;###headAndNeckEyes,Broad, arched eyebrows ;###headAndNeckEyes,Sparse eyebrows ###headAndNeckNose,Depressed nasal tip ;###headAndNeckNose,Short nasal columella ###headAndNeckMouth,Cleft palate ;###headAndNeckMouth,High-arched palate ###cardiovascularHeart,Congenital heart defect ;###cardiovascularHeart,Ventricular septal defect ;###cardiovascularHeart,Atrial septal defect ###cardiovascularVascular,Coarctation of aorta ###respiratoryLung,Aspiration pneumonia ###abdomenGastrointestinal,Feeding difficulties ;###abdomenGastrointestinal,Malabsorption ;###abdomenGastrointestinal,Intestinal malrotation ;###abdomenGastrointestinal,Anal stenosis ;###abdomenGastrointestinal,Imperforate anus ;###abdomenGastrointestinal,Anoperineal fistula ###genitourinaryExternalGenitaliaMale,Small penis ###genitourinaryInternalGenitaliaMale,Cryptorchidism ###genitourinaryKidneys,Crossed fused renal ectopia ;###genitourinaryKidneys,Single fused kidneys ###genitourinaryUreters,Ureteropelvic junction obstruction ###skeletalSpine,Scoliosis ;###skeletalSpine,Vertebral anomalies ###skeletalPelvis,Congenital hip dislocations ###skeletalLimbs,Joint hyperextensibility ###skeletalHands,Short fifth finger ;###skeletalHands,Increased digital ulnar loop and hypothenar loop patterns ;###skeletalHands,Absent digital triradius c and/or d ;###skeletalHands,Persistence of fingerpads ###skinNailsHairSkin,Cafe au lait spots ###skinNailsHairHair,Hirsutism ###neurologicCentralNervousSystem,Mental retardation ;###neurologicCentralNervousSystem,Seizures ;###neurologicCentralNervousSystem,Developmental delay ;###neurologicCentralNervousSystem,Hypotonia ###endocrineFeatures,Congenital hypothyroidism ;###endocrineFeatures,Premature thelarche ###hematology,Idiopathic thrombocytopenic purpura ;###hematology,Hemolytic anemia ###miscellaneous,Increased susceptibility to infections ;###miscellaneous,Majority of cases are sporadic ###molecularBasis,Caused by mutation in the myeloid/lymphoid or mixed lineage leukemia 2 gene (MLL2, )",https://www.omim.org/entry/147920,.,Autosomal dominant,Het,12,49448792,A,C,.,.,PASS,0/1:66:128,51.56,".$cC$..,,,cC.CCcc..Cc.,CC,ccc,C.Cc.C.Cccc,.c.C.,,C,c,..c,C,,...c,cC,cc.CcCC,ccc,cC.,,,.c,..c,cc,C..CCcCCcccc..Ccc,Ccc,.^].",missense_variant,KMT2D,8085,.,NM_003482.3(KMT2D):c.67T>G(p.Ser23Ala),NM_003482.3,exon2(54),P0=>NP,.,.,0,0,6.094e-05,0.0008,6.465e-05,0.0012,0,11,0.0013,0,12,0.00010,.,.,http://exac.broadinstitute.org/variant/12-49448792-A-C,3.1,137.6,11,1.0,http://exac.broadinstitute.org/gene/ENSG00000167548,0.22289,.,0,D,0.001,B,0.005,B,.,.,1.000,N,3.96,9.914,.,.,.,.,.,.,.,.,.,.,.,.,.,.,.,.,.,.,.,.,.,.,.,.,.,.,.,.,.,.,.,.,.,.,"chromatin silencing (GO:0006342)|histone H3-K4 methylation (GO:0051568)|oocyte growth (GO:0001555)|oogenesis (GO:0048477)|positive regulation of cell proliferation (GO:0008284)|positive regulation of intracellular estrogen receptor signaling pathway (GO:0033148)|positive regulation of transcription from RNA polymerase II promoter (GO:0045944)|regulation of transcription, DNA-templated (GO:0006355)|response to estrogen (GO:0043627)|transcription, DNA-templated (GO:0006351)",histone methyltransferase complex (GO:0035097)|nucleus (GO:0005634),DNA binding (GO:0003677)|histone-lysine N-methyltransferase activity (GO:0018024)|transcription regulatory region DNA binding (GO:0044212)|zinc ion binding (GO:0008270),.,.,.,.,75,5,CSS17029200102
