,Variant_classification,Gene_classification,Comment,Difficultregion,CNV-SNV,ID,OMIM_Phenotype,Disease,Clinical_synopsis,OMIM_Link,Uniprot,Inheritance,Zygosity,CHR,POS,REF,ALT,Flank,Repeat_flag,FILTER,FORMAT,VAF,Pileup_data,Mutation_type,Gene_name,Entrez_Gene_Id,In_Key_Gene,HGVS_nomenclature,HGMD_transcript,ExonNumber,PolarChange,1000G_ASN_AF,1000G_ALL_AF,ESP6500_AC,ESP6500_AF,gnomAD_exome_ALL,gnomAD_exome_EAS,gnomAD_genome_ALL,gnomAD_genome_EAS,ExAC_EAS_HomoAlt_Count,ExAC_EAS_AC,ExAC_EAS_AF,ExAC_HomoAlt_Count,ExAC_AC,ExAC_AF,In_house_freq,In_house_count,ExAC_Link,ExAC_MisZ,ExAC_Expected,ExAC_observed,ExAC_PLI,PLI_Link,Phylop_Vertebrate_score,Phylop_Mammal_score,SIFT_score,SIFT_prediction,Polyphen2_HDIV_score,Polyphen2_HDIV_pred,Polyphen2_HVAR_score,Polyphen2_HVAR_pred,LRT_score,LRT_prediction,Mutationtatser_score,Mutationtatser_prediction,Gerp++,CADD,Rs_ID,Swiss_prot_function,Swiss_prot_disease_association,Swiss_prot_post_translational_modifications,Swiss_prot_expression,HGMD_mutation_type,HGMD_variant_class,HGMD_disease,HGMD_pubmed_ID,HGMD_indel_type,HGMD_Indel_class,HGMD_indel_disease,HGMD_indel_PMID,HGMD_nearby_alleles,Clinvar,Clinvar_Link,CosmicID,Cosmic_Occurence,Mother_zygosity,Mother_filter,Mother_format,Mother_VAF,Mother_pileup,Father_zygosity,Father_filter,Father_format,Father_VAF,Father_pileup,Recessive,Com_het,De_novo,Other_relatives,Covered,Less_20,GO_BP,GO_CC,GO_MF,KEGG_PATHWAY,PID_PATHWAY,BIOCARTA_PATHWAY,REACTOME_PATHWAY,pheno_rank,intersect_rank,CaseID
8,.,.,HGMD|OMIM|low_frequency,Name=GCcontent,.,CSS16084800102,253000,Mucopolysaccharidosis IVA,"1.$$$mimNumber,253000###prefix,####preferredTitle,MUCOPOLYSACCHARIDOSIS, TYPE IVA; MPS4A###inheritance,Autosomal recessive ###growthHeight,Adult height 82 to 115 cm ;###growthHeight,Short-trunked dwarfism ###headAndNeckFace,Mildly coarse facial features ;###headAndNeckFace,Prognathism ###headAndNeckEars,Hearing loss ###headAndNeckEyes,Corneal opacities ###headAndNeckMouth,Broad mouth ###headAndNeckTeeth,Widely spaced teeth ;###headAndNeckTeeth,Grayish enamel ;###headAndNeckTeeth,Frequent caries ###cardiovascularHeart,Valvular heart disease ###respiratoryNasopharynx,Frequent upper respiratory tract infections ###respiratoryLung,Restrictive lung disease ###chestRibsSternumClaviclesAndScapulae,Flaring of rib cage ;###chestRibsSternumClaviclesAndScapulae,Prominent sternum ###abdomenExternalFeatures,Inguinal hernia ###abdomenLiver,Mild hepatomegaly ###skeletal,Osteoporosis ###skeletalSpine,Platyspondyly ;###skeletalSpine,Odontoid hypoplasia ;###skeletalSpine,Cervical subluxation ;###skeletalSpine,Kyphosis ;###skeletalSpine,Ovoid vertebral bodies ;###skeletalSpine,Hyperlordosis ;###skeletalSpine,Scoliosis ###skeletalPelvis,Coxa valga ;###skeletalPelvis,Constricted iliac wings ###skeletalLimbs,Joint laxity ;###skeletalLimbs,Genu valgum ;###skeletalLimbs,Ulnar deviation of the wrist ;###skeletalLimbs,Epiphyseal deformities of tubular bones ;###skeletalLimbs,Widened metaphyses ###skeletalHands,Pointed proximal second through fifth metacarpals ###neurologicCentralNervousSystem,Normal intelligence ;###neurologicCentralNervousSystem,Cervical myelopathy ###laboratoryAbnormalities,N-acetylgalactosamine-6-sulfatase deficiency in fibroblasts and leukocytes ;###laboratoryAbnormalities,Keratan sulfate excretion in urine that decreases with age ;###laboratoryAbnormalities,Chondroitin 6-sulfate excretion in urine ###miscellaneous,Appear normal at birth ;###miscellaneous,Onset between 1-3 years ###molecularBasis,Caused by mutations in the galactosamine-6-sulfatase gene (GALNS, ).",https://www.omim.org/entry/253000,.,Autosomal recessive,Het,16,88898456,T,A,.,.,PASS,0/1:41:80,51.25,"A....aA.AAA,.A,,,AAAAA.A.a,.aAAA.A..AA.aA.....A.....a.^],",missense_variant,GALNS,2588,.,NM_000512.4(GALNS):c.952A>T(p.Met318Leu),NM_000512.4,exon9(14),NP=>NP,0.001,0.0002,0,0,7.329e-05,0.0010,3.245e-05,0.0006,0,7,0.00082,0,8,0.000067,0.00145348837209,1/688,http://exac.broadinstitute.org/variant/16-88898456-T-A,-0.6,17.7,8,0.0,http://exac.broadinstitute.org/gene/ENSG00000141012,0.49997,.,0.13,T,0.008,B,0.015,B,0.000,D,1.000,D,-0.036,15.28,.,.,.,.,.,.,.,.,.,NM_000512.4(GALNS):c.951dupG,DM,Mucopolysaccharidosis IVa,22976768,"NM_000512.4(GALNS):c.953T>G(p.M318R),DM,Mucopolysaccharidosis IVa,7795586",.,.,.,.,.,.,.,.,.,.,.,.,.,.,.,.,.,.,.,.,carbohydrate metabolic process (GO:0005975)|glycosaminoglycan metabolic process (GO:0030203)|keratan sulfate catabolic process (GO:0042340)|keratan sulfate metabolic process (GO:0042339)|small molecule metabolic process (GO:0044281),extracellular vesicular exosome (GO:0070062)|lysosomal lumen (GO:0043202),metal ion binding (GO:0046872)|N-acetylgalactosamine-4-sulfatase activity (GO:0003943)|N-acetylgalactosamine-6-sulfatase activity (GO:0043890)|sulfuric ester hydrolase activity (GO:0008484),.,.,.,.,22,2,CSS16084800102
154,.,.,OMIM|low_frequency,.,.,CSS16084800102,252500;252600,Mucolipidosis II alpha/beta;Mucolipidosis III alpha/beta,"1.$$$mimNumber,252500###prefix,####preferredTitle,MUCOLIPIDOSIS II ALPHA/BETA###inheritance,Autosomal recessive ###growthHeight,Birth length less than normal ;###growthHeight,Deceleration of linear growth during first year ###growthWeight,Birth weight less than normal ###growthOther,Progressive failure to thrive ;###growthOther,Hurler-like body configuration ;###growthOther,Marked growth retardation ###headAndNeckFace,High, narrow forehead ;###headAndNeckFace,Long philtrum ;###headAndNeckFace,Coarse facial features ###headAndNeckEars,Recurrent episodes of otitis media ;###headAndNeckEars,Thick, firm earlobes ###headAndNeckEyes,Thin eyebrows ;###headAndNeckEyes,Puffy eyelids ;###headAndNeckEyes,Epicanthal folds ;###headAndNeckEyes,Clear to faintly hazy corneas ;###headAndNeckEyes,Increased corneal diameter ;###headAndNeckEyes,Corneal opacities on slit-lamp examination ###headAndNeckNose,Low nasal bridge ;###headAndNeckNose,Anteverted nostrils ###headAndNeckMouth,Progressive alveolar ridge hypertropy ;###headAndNeckMouth,Macroglossia ###cardiovascularHeart,Congestive heart failure ;###cardiovascularHeart,Hypertrophic cardiomyopathy ;###cardiovascularHeart,Cardiomegaly ;###cardiovascularHeart,Cardiac murmur ;###cardiovascularHeart,Aortic insufficiency ###respiratoryAirways,Recurrent bronchitis ###respiratoryLung,Recurrent pneumonia ###chestExternalFeatures,Widely spaced nipples ###chestRibsSternumClaviclesAndScapulae,Scapular hypoplasia ;###chestRibsSternumClaviclesAndScapulae,Broad, spatulate-appearing ribs ###abdomenExternalFeatures,Diastasis recti ;###abdomenExternalFeatures,Abdominal protuberance ;###abdomenExternalFeatures,Umbilical hernia ###abdomenLiver,Hepatomegaly ###abdomenSpleen,Minimal splenomegaly ###genitourinaryExternalGenitaliaMale,Inguinal hernia ###skeletal,Moderate joint limitation ;###skeletal,Osteopenia in early infancy ;###skeletal,Pathologic fractures ###skeletalSkull,Thickened cranium ;###skeletalSkull,Normal enlarged sella turcica ###skeletalSpine,Dorsolumbar kyphosis ;###skeletalSpine,Atlantoaxial dislocation ;###skeletalSpine,Ovoid vertebral bodies ;###skeletalSpine,Narrowness of interpediculate distances in lower thoracic regions ;###skeletalSpine,Hypoplastic odontoid process ;###skeletalSpine,Beaking of vertebral bodies T12-L3 ;###skeletalSpine,Lumbar gibbus ###skeletalPelvis,Flared iliac wings ;###skeletalPelvis,Horizontal acetabular roofs ;###skeletalPelvis,Supra-acetabular constriction ;###skeletalPelvis,Hip dislocation ;###skeletalPelvis,Irregular contours of pubis and ischium ###skeletalLimbs,Cortical bone erosion (especially proximal femora) ;###skeletalLimbs,Long bone shortening ;###skeletalLimbs,Widened metaphyses ;###skeletalLimbs,Varus deformity of humeral neck ;###skeletalLimbs,Tilted distal ends of radius and ulna ###skeletalHands,Broadening of wrist ;###skeletalHands,Brachyphalangia ;###skeletalHands,Hypoplasia of carpal bones ;###skeletalHands,Conical bullet-shaped distal ends of phalanges ;###skeletalHands,Claw-hand deformities ###skeletalFeet,Talipes equinovarus ###skinNailsHairSkin,Thick, relatively tight skin ;###skinNailsHairSkin,Cavernous hemangioma ###neurologicCentralNervousSystem,Severe psychomotor retardation ;###neurologicCentralNervousSystem,Developmental delay ;###neurologicCentralNervousSystem,Myelopathy ;###neurologicCentralNervousSystem,Neonatal hypotonia ###voice,Hoarse voice ###laboratoryAbnormalities,Normal to mildly increased mucopolysacchariduria ;###laboratoryAbnormalities,Increased serum beta-hexosaminidase (10-20x) ;###laboratoryAbnormalities,Increased serum iduronate sulfatase (10-20x) ;###laboratoryAbnormalities,Increased serum arylsulfatase A (10-20x) ;###laboratoryAbnormalities,Deficiency of N-acetylglucosamine-1-phosphotransferase ;###laboratoryAbnormalities,Inclusion bodies (membrane-bound vacuoles) in fibroblasts ###miscellaneous,Death in childhood ;###miscellaneous,Death often secondary to pneumonia or congestive heart failure ;###miscellaneous,Carrier rate of 1 in 39 in the Saguenay-Lac-Saint-Jean region of Quebec ###molecularBasis,Caused by mutation in the N-acetylglucosamine-1-phosphotransferase, alpha/beta subunits gene (GNPTAB, ) 2.$$$mimNumber,252600###prefix,####preferredTitle,MUCOLIPIDOSIS III ALPHA/BETA###inheritance,Autosomal recessive ###growthHeight,Short stature ###headAndNeckFace,Mildly coarse facies ###headAndNeckEyes,Corneal clouding ;###headAndNeckEyes,Mild retinopathy ;###headAndNeckEyes,Hyperopic astigmatism ###cardiovascularHeart,Aortic insufficiency ###chestRibsSternumClaviclesAndScapulae,Short, thick clavicles ;###chestRibsSternumClaviclesAndScapulae,Wide, slightly short ribs ###skeletal,Dysostosis multiplex ###skeletalSkull,Premature closure of cranial sutures ;###skeletalSkull,J-shaped sella turcica ;###skeletalSkull,Mandibular prognathism ###skeletalSpine,Scoliosis ;###skeletalSpine,Absence of dens ;###skeletalSpine,Vertebral beaking ###skeletalPelvis,Flaring of iliac wings ;###skeletalPelvis,Shallow acetabular fossae ###skeletalLimbs,Shoulder stiffness ;###skeletalLimbs,Broad metaphyses ;###skeletalLimbs,Short long bones ###skeletalHands,Hand stiffness ;###skeletalHands,Claw-hand deformities ;###skeletalHands,Carpal tunnel syndrome ;###skeletalHands,Soft tissue swelling of interphalangeal joints ;###skeletalHands,Small, irregular carpal bones ###skinNailsHairSkin,Skin thickening ###neurologicCentralNervousSystem,Learning disabilities ;###neurologicCentralNervousSystem,Mental retardation ###laboratoryAbnormalities,No mucopolysacchariduria ;###laboratoryAbnormalities,Increased serum beta-hexosaminidase (10-20x) ;###laboratoryAbnormalities,Increased serum iduronate sulfatase (10-20x) ;###laboratoryAbnormalities,Increased serum aryl-sulfatase A (10-20x) ;###laboratoryAbnormalities,Deficiency of N-acetylglucosamine-1-phosphotransferase ###miscellaneous,Symptoms noted at 2-3 years ;###miscellaneous,Allelic to mucolipidosis II ()###molecularBasis,Caused by mutation in the N-acetylglucosamine-1-phosphotransferase, alpha/beta subunits gene (GNPTAB, )",https://www.omim.org/entry/252500;https://www.omim.org/entry/252600,.,Autosomal recessive,Het,12,102158945,G,T,.,.,PASS,0/1:31:68,45.59,",$tT..,tt.,T..T,Tt,ttTt.T,t.t,tt,.T..TT...TT,tt..",missense_variant,GNPTAB,79158,.,NM_024312.4(GNPTAB):c.1750C>A(p.Pro584Thr),NM_024312.4,exon13(21),NP=>P0,0.006,0.0012,0,0,0.0006,0.0083,0.0004,0.0074,0,77,0.0089,0,77,0.00063,0.0174418604651,12/688,http://exac.broadinstitute.org/variant/12-102158945-G-T,0.59,43.1,17,0.0,http://exac.broadinstitute.org/gene/ENSG00000111670,0.55539,.,0.2,T,0.868,P,0.4,B,0.000,D,1.000,D,5.96,16.24,rs201829728,.,.,.,.,.,.,.,.,.,.,.,.,.,.,.,.,.,.,.,.,.,.,.,.,.,.,.,.,.,.,.,.,.,carbohydrate phosphorylation (GO:0046835)|cell differentiation (GO:0030154)|lysosome organization (GO:0007040)|protein secretion (GO:0009306),Golgi apparatus (GO:0005794)|Golgi membrane (GO:0000139)|integral component of membrane (GO:0016021)|nucleus (GO:0005634),calcium ion binding (GO:0005509)|UDP-N-acetylglucosamine-lysosomal-enzyme N-acetylglucosaminephosphotransferase activity (GO:0003976),.,.,.,.,16,1,CSS16084800102
294,.,.,OMIM|low_frequency,.,.,CSS16084800102,236200,"Homocystinuria, B6-responsive and nonresponsive types;Thrombosis, hyperhomocysteinemic","1.$$$mimNumber,236200###prefix,####preferredTitle,HOMOCYSTINURIA DUE TO CYSTATHIONINE BETA-SYNTHASE DEFICIENCY###inheritance,Autosomal recessive ###growthHeight,Normal to tall stature ###growthOther,Occasional failure to thrive in infancy ###headAndNeckEyes,Ectopia lentis ;###headAndNeckEyes,Myopia ;###headAndNeckEyes,Glaucoma ###headAndNeckMouth,High-arched palate ###headAndNeckTeeth,Crowded teeth ###cardiovascularHeart,Myocardial infarction ;###cardiovascularHeart,Mitral valve prolapse ###chestRibsSternumClaviclesAndScapulae,Pectus excavatum ;###chestRibsSternumClaviclesAndScapulae,Pectus carinatum ###abdomenExternalFeatures,Inguinal hernia ###abdomenLiver,Fatty changes in liver ###abdomenPancreas,Pancreatitis ###skeletal,Generalized osteoporosis ###skeletalSpine,Biconcave 'codfish' vertebrae ;###skeletalSpine,Kyphoscoliosis ###skeletalLimbs,Dolichostenomelia ;###skeletalLimbs,Arachnodactyly ;###skeletalLimbs,Limited joint mobility ###skinNailsHairSkin,Hypopigmentation ;###skinNailsHairSkin,Malar flush ;###skinNailsHairSkin,Livedo reticularis ###skinNailsHairHair,Hypopigmentation ;###skinNailsHairHair,Fine, brittle hair ###neurologicCentralNervousSystem,Seizures ;###neurologicCentralNervousSystem,Mental retardation ;###neurologicCentralNervousSystem,Cerebrovascular accident ###neurologicBehavioralPsychiatricManifestations,Psychiatric disorders ;###neurologicBehavioralPsychiatricManifestations,Depression ;###neurologicBehavioralPsychiatricManifestations,Personality disorder ###hematology,Thromboembolism (25%) ###laboratoryAbnormalities,Homocystinuria ;###laboratoryAbnormalities,Methioninuria ;###laboratoryAbnormalities,Cystathionine beta-synthase deficiency ###miscellaneous,Fifty-percent of individuals responsive to pyridoxine (vitamin B6) ;###miscellaneous,Pyridoxine responsive individuals often have milder manifestations than those not responsive ;###miscellaneous,Management of homocystinuria includes low methionine, cystine supplemented diet for pyridoxine nonresponders and pyridoxine supplementation for pyridoxine responders ;###miscellaneous,Treatment with betaine, especially for pyridoxine nonresponders ;###miscellaneous,Thromboembolism is the most common cause of death ;###miscellaneous,Frequency between 1 in 58,000 to 1 in 1,000,000 ###molecularBasis,Caused by mutation in the cystathionine beta-synthase gene (CBS, ) 2.$$$mimNumber,236200###prefix,####preferredTitle,HOMOCYSTINURIA DUE TO CYSTATHIONINE BETA-SYNTHASE DEFICIENCY###inheritance,Autosomal recessive ###growthHeight,Normal to tall stature ###growthOther,Occasional failure to thrive in infancy ###headAndNeckEyes,Ectopia lentis ;###headAndNeckEyes,Myopia ;###headAndNeckEyes,Glaucoma ###headAndNeckMouth,High-arched palate ###headAndNeckTeeth,Crowded teeth ###cardiovascularHeart,Myocardial infarction ;###cardiovascularHeart,Mitral valve prolapse ###chestRibsSternumClaviclesAndScapulae,Pectus excavatum ;###chestRibsSternumClaviclesAndScapulae,Pectus carinatum ###abdomenExternalFeatures,Inguinal hernia ###abdomenLiver,Fatty changes in liver ###abdomenPancreas,Pancreatitis ###skeletal,Generalized osteoporosis ###skeletalSpine,Biconcave 'codfish' vertebrae ;###skeletalSpine,Kyphoscoliosis ###skeletalLimbs,Dolichostenomelia ;###skeletalLimbs,Arachnodactyly ;###skeletalLimbs,Limited joint mobility ###skinNailsHairSkin,Hypopigmentation ;###skinNailsHairSkin,Malar flush ;###skinNailsHairSkin,Livedo reticularis ###skinNailsHairHair,Hypopigmentation ;###skinNailsHairHair,Fine, brittle hair ###neurologicCentralNervousSystem,Seizures ;###neurologicCentralNervousSystem,Mental retardation ;###neurologicCentralNervousSystem,Cerebrovascular accident ###neurologicBehavioralPsychiatricManifestations,Psychiatric disorders ;###neurologicBehavioralPsychiatricManifestations,Depression ;###neurologicBehavioralPsychiatricManifestations,Personality disorder ###hematology,Thromboembolism (25%) ###laboratoryAbnormalities,Homocystinuria ;###laboratoryAbnormalities,Methioninuria ;###laboratoryAbnormalities,Cystathionine beta-synthase deficiency ###miscellaneous,Fifty-percent of individuals responsive to pyridoxine (vitamin B6) ;###miscellaneous,Pyridoxine responsive individuals often have milder manifestations than those not responsive ;###miscellaneous,Management of homocystinuria includes low methionine, cystine supplemented diet for pyridoxine nonresponders and pyridoxine supplementation for pyridoxine responders ;###miscellaneous,Treatment with betaine, especially for pyridoxine nonresponders ;###miscellaneous,Thromboembolism is the most common cause of death ;###miscellaneous,Frequency between 1 in 58,000 to 1 in 1,000,000 ###molecularBasis,Caused by mutation in the cystathionine beta-synthase gene (CBS, )",https://www.omim.org/entry/236200,.,Autosomal recessive,Het,21,44488720,T,A,.,.,PASS,0/1:25:48,52.08,"a$a$a,a,.a,,,aaA.,Aa.aaaaAA.A,A.,.,,A,..A.aa",missense_variant;missense_variant;missense_variant,CBS,875,.,NM_000071.2(CBS):c.215A>T(p.Lys72Ile);NM_001178008.1(CBS):c.215A>T(p.Lys72Ile);NM_001178009.1(CBS):c.215A>T(p.Lys72Ile),NM_000071.2,exon4(17);exon4(17);exon4(18),P+=>NP;P+=>NP;P+=>NP,0.0099,0.0022,2,0.00015,0.0006,0.0071,0.0006,0.0099,0,66,0.0077,0,75,0.00062,0.0145348837209,10/688,http://exac.broadinstitute.org/variant/21-44488720-T-A,1.38,18.8,7,0.01,http://exac.broadinstitute.org/gene/ENSG00000160200,0.32606,2.33E-4,0.22,T,0.0,B,0.002,B,0.276,N,1.000,D,3.62,12.14,rs192232907,.,.,.,.,.,.,.,.,.,.,.,.,.,.,.,.,.,.,.,.,.,.,.,.,.,.,.,.,.,.,.,.,.,cellular nitrogen compound metabolic process (GO:0034641)|cysteine biosynthetic process from serine (GO:0006535)|cysteine biosynthetic process via cystathionine (GO:0019343)|homocysteine catabolic process (GO:0043418)|homocysteine metabolic process (GO:0050667)|hydrogen sulfide biosynthetic process (GO:0070814)|L-cysteine catabolic process (GO:0019448)|L-serine catabolic process (GO:0006565)|L-serine metabolic process (GO:0006563)|small molecule metabolic process (GO:0044281)|sulfur amino acid metabolic process (GO:0000096)|transsulfuration (GO:0019346),cytosol (GO:0005829)|nucleus (GO:0005634),adenyl nucleotide binding (GO:0030554)|cystathionine beta-synthase activity (GO:0004122)|enzyme binding (GO:0019899)|heme binding (GO:0020037)|identical protein binding (GO:0042802)|metal ion binding (GO:0046872)|modified amino acid binding (GO:0072341)|protein homodimerization activity (GO:0042803)|pyridoxal phosphate binding (GO:0030170)|ubiquitin protein ligase binding (GO:0031625),.,.,.,.,80,4,CSS16084800102
