,Variant_classification,Gene_classification,Comment,Difficultregion,CNV-SNV,ID,OMIM_Phenotype,Disease,Clinical_synopsis,OMIM_Link,Uniprot,Inheritance,Zygosity,CHR,POS,REF,ALT,Flank,Repeat_flag,FILTER,FORMAT,VAF,Pileup_data,Mutation_type,Gene_name,Entrez_Gene_Id,In_Key_Gene,HGVS_nomenclature,HGMD_transcript,ExonNumber,PolarChange,1000G_ASN_AF,1000G_ALL_AF,ESP6500_AC,ESP6500_AF,gnomAD_exome_ALL,gnomAD_exome_EAS,gnomAD_genome_ALL,gnomAD_genome_EAS,ExAC_EAS_HomoAlt_Count,ExAC_EAS_AC,ExAC_EAS_AF,ExAC_HomoAlt_Count,ExAC_AC,ExAC_AF,In_house_freq,In_house_count,ExAC_Link,ExAC_MisZ,ExAC_Expected,ExAC_observed,ExAC_PLI,PLI_Link,Phylop_Vertebrate_score,Phylop_Mammal_score,SIFT_score,SIFT_prediction,Polyphen2_HDIV_score,Polyphen2_HDIV_pred,Polyphen2_HVAR_score,Polyphen2_HVAR_pred,LRT_score,LRT_prediction,Mutationtatser_score,Mutationtatser_prediction,Gerp++,CADD,Rs_ID,Swiss_prot_function,Swiss_prot_disease_association,Swiss_prot_post_translational_modifications,Swiss_prot_expression,HGMD_mutation_type,HGMD_variant_class,HGMD_disease,HGMD_pubmed_ID,HGMD_indel_type,HGMD_Indel_class,HGMD_indel_disease,HGMD_indel_PMID,HGMD_nearby_alleles,Clinvar,Clinvar_Link,CosmicID,Cosmic_Occurence,Mother_zygosity,Mother_filter,Mother_format,Mother_VAF,Mother_pileup,Father_zygosity,Father_filter,Father_format,Father_VAF,Father_pileup,Recessive,Com_het,De_novo,Other_relatives,Covered,Less_20,GO_BP,GO_CC,GO_MF,KEGG_PATHWAY,PID_PATHWAY,BIOCARTA_PATHWAY,REACTOME_PATHWAY,pheno_rank,intersect_rank,CaseID
84,.,.,OMIM|novel|possible_comhet,.,.,CSS16108700102,147920,Kabuki syndrome 1,"1.$$$mimNumber,147920###prefix,####preferredTitle,KABUKI SYNDROME 1; KABUK1###inheritance,Autosomal dominant ###growthOther,Postnatal growth retardation ###headAndNeckHead,Microcephaly ###headAndNeckFace,Trapezoid philtrum ###headAndNeckEars,Large prominent ears ;###headAndNeckEars,Recurrent otitis media in infancy ;###headAndNeckEars,Posteriorly rotated ears ;###headAndNeckEars,Hearing loss ;###headAndNeckEars,Preauricular pit ###headAndNeckEyes,Long palpebral fissures ;###headAndNeckEyes,Eversion of lateral third of lower eyelids ;###headAndNeckEyes,Thick eyelashes ;###headAndNeckEyes,Ptosis ;###headAndNeckEyes,Blue sclerae ;###headAndNeckEyes,Broad, arched eyebrows ;###headAndNeckEyes,Sparse eyebrows ###headAndNeckNose,Depressed nasal tip ;###headAndNeckNose,Short nasal columella ###headAndNeckMouth,Cleft palate ;###headAndNeckMouth,High-arched palate ###cardiovascularHeart,Congenital heart defect ;###cardiovascularHeart,Ventricular septal defect ;###cardiovascularHeart,Atrial septal defect ###cardiovascularVascular,Coarctation of aorta ###respiratoryLung,Aspiration pneumonia ###abdomenGastrointestinal,Feeding difficulties ;###abdomenGastrointestinal,Malabsorption ;###abdomenGastrointestinal,Intestinal malrotation ;###abdomenGastrointestinal,Anal stenosis ;###abdomenGastrointestinal,Imperforate anus ;###abdomenGastrointestinal,Anoperineal fistula ###genitourinaryExternalGenitaliaMale,Small penis ###genitourinaryInternalGenitaliaMale,Cryptorchidism ###genitourinaryKidneys,Crossed fused renal ectopia ;###genitourinaryKidneys,Single fused kidneys ###genitourinaryUreters,Ureteropelvic junction obstruction ###skeletalSpine,Scoliosis ;###skeletalSpine,Vertebral anomalies ###skeletalPelvis,Congenital hip dislocations ###skeletalLimbs,Joint hyperextensibility ###skeletalHands,Short fifth finger ;###skeletalHands,Increased digital ulnar loop and hypothenar loop patterns ;###skeletalHands,Absent digital triradius c and/or d ;###skeletalHands,Persistence of fingerpads ###skinNailsHairSkin,Cafe au lait spots ###skinNailsHairHair,Hirsutism ###neurologicCentralNervousSystem,Mental retardation ;###neurologicCentralNervousSystem,Seizures ;###neurologicCentralNervousSystem,Developmental delay ;###neurologicCentralNervousSystem,Hypotonia ###endocrineFeatures,Congenital hypothyroidism ;###endocrineFeatures,Premature thelarche ###hematology,Idiopathic thrombocytopenic purpura ;###hematology,Hemolytic anemia ###miscellaneous,Increased susceptibility to infections ;###miscellaneous,Majority of cases are sporadic ###molecularBasis,Caused by mutation in the myeloid/lymphoid or mixed lineage leukemia 2 gene (MLL2, )",https://www.omim.org/entry/147920,.,Autosomal dominant,Het,12,49445715,G,A,.,.,PASS,0/1:43:71,60.56,"A.a,$,Aa.,AAaaA.AA.,..a.,.aa,AA,,.,.aaAAaAA,AAaAaaaa,^].",missense_variant,KMT2D,8085,.,NM_003482.3(KMT2D):c.1751C>T(p.Pro584Leu),NM_003482.3,exon10(54),NP=>NP,.,.,.,.,.,.,.,.,.,.,.,.,.,.,0.00145348837209,1/688,.,3.1,137.6,11,1.0,http://exac.broadinstitute.org/gene/ENSG00000167548,0.18206,.,0,D,0.0,B,0.001,B,.,.,0.612,D,2.01,8.815,.,.,.,.,.,.,.,.,.,.,.,.,.,.,.,.,.,.,.,.,.,.,.,.,.,.,.,.,.,.,.,.,.,.,"chromatin silencing (GO:0006342)|histone H3-K4 methylation (GO:0051568)|oocyte growth (GO:0001555)|oogenesis (GO:0048477)|positive regulation of cell proliferation (GO:0008284)|positive regulation of intracellular estrogen receptor signaling pathway (GO:0033148)|positive regulation of transcription from RNA polymerase II promoter (GO:0045944)|regulation of transcription, DNA-templated (GO:0006355)|response to estrogen (GO:0043627)|transcription, DNA-templated (GO:0006351)",histone methyltransferase complex (GO:0035097)|nucleus (GO:0005634),DNA binding (GO:0003677)|histone-lysine N-methyltransferase activity (GO:0018024)|transcription regulatory region DNA binding (GO:0044212)|zinc ion binding (GO:0008270),.,.,.,.,49,3,CSS16108700102
176,.,.,OMIM|low_frequency,Name=GCcontent,.,CSS16108700102,224410;255800,"Dyssegmental dysplasia, Silverman-Handmaker type;Schwartz-Jampel syndrome, type 1","1.$$$mimNumber,224410###prefix,####preferredTitle,DYSSEGMENTAL DYSPLASIA, SILVERMAN-HANDMAKER TYPE; DDSH###inheritance,Autosomal recessive ###growthOther,Short-limbed dwarfism ###headAndNeckHead,Occipital skull defect ###headAndNeckFace,Flat face ###headAndNeckEars,Posteriorly rotated ears ###headAndNeckNose,Wide nasal bridge ###headAndNeckMouth,Small mouth ;###headAndNeckMouth,Micrognathia ###respiratoryLung,Pulmonary hypoplasia ###chestExternalFeatures,Small chest ###abdomenExternalFeatures,Two vessel cord ###genitourinaryInternalGenitaliaMale,Cryptorchidism ###skeletal,Chondroosseous morphology notable for short, irregular chondrocyte columns, large, unfused calcospherites, perichondral bone overgrowth and patchy, mucoid degeneration of resting cartilage ###skeletalSpine,Dyssegmental dysplasia ;###skeletalSpine,Anisospondyly ###skeletalLimbs,Short, bent long bones ###skeletalFeet,Talipes equinovarus ###miscellaneous,Neonatal lethal ###molecularBasis,Caused by mutation in the perlecan gene (HSPG2, ) 2.$$$mimNumber,255800###prefix,####preferredTitle,SCHWARTZ-JAMPEL SYNDROME, TYPE 1; SJS1###inheritance,Autosomal recessive ###growthHeight,Short stature (postnatal onset) ###headAndNeckFace,Normal face at birth ;###headAndNeckFace,Sad, fixed facies ;###headAndNeckFace,Low hairline ;###headAndNeckFace,Flat face ;###headAndNeckFace,Full cheeks ###headAndNeckEars,Low-set ears ;###headAndNeckEars,Overfolded helices ###headAndNeckEyes,Narrow palpebral fissures ;###headAndNeckEyes,Blepharophimosis ;###headAndNeckEyes,Myopia ;###headAndNeckEyes,Cataract ;###headAndNeckEyes,Microcornea ;###headAndNeckEyes,Long eyelashes in irregular rows ;###headAndNeckEyes,Ptosis ###headAndNeckMouth,Small mouth ;###headAndNeckMouth,Pursed lips ###headAndNeckNeck,Short neck ###chestRibsSternumClaviclesAndScapulae,Pectus carinatum ###abdomenExternalFeatures,Umbilical hernia ###genitourinaryExternalGenitaliaMale,Inguinal hernia ###genitourinaryInternalGenitaliaMale,Small testes ###skeletal,Osteoporosis ;###skeletal,Delayed bone age ###skeletalSkull,Small mandible ###skeletalSpine,Platyspondyly ;###skeletalSpine,Kyphosis ;###skeletalSpine,Kyphoscoliosis ;###skeletalSpine,Lumbar lordosis ;###skeletalSpine,Coronal cleft vertebrae ###skeletalPelvis,Hip contracture ;###skeletalPelvis,Fragmentation of femoral epiphyses ;###skeletalPelvis,Flattened femoral epiphyses ;###skeletalPelvis,Coxa vara ;###skeletalPelvis,Coxa valga ;###skeletalPelvis,Congenital hip dislocation ###skeletalLimbs,Widened metaphyses ;###skeletalLimbs,Slender diaphysis ;###skeletalLimbs,Anterior bowing of long bones ;###skeletalLimbs,Elbow, knee, shoulder contractures ###skeletalHands,Wrist contractures ;###skeletalHands,Finger contractures ###skeletalFeet,Toe contractures ;###skeletalFeet,Talipes equinovarus ;###skeletalFeet,Pes planus ###skinNailsHairHair,Low hairline ;###skinNailsHairHair,Generalized hirsutism ###muscleSoftTissue,Myotonia ;###muscleSoftTissue,Muscular hypertrophy ;###muscleSoftTissue,Muscle weakness ;###muscleSoftTissue,Muscle wasting ;###muscleSoftTissue,EMG - repetitive muscle discharges ###neurologicCentralNervousSystem,Hyporeflexia ;###neurologicCentralNervousSystem,Mental retardation (25%) ###voice,Small, high-pitched voice ###miscellaneous,Progressive disease with onset in infancy ;###miscellaneous,Contractures most severe by midadolescence ;###miscellaneous,Anesthesia complications include difficult intubation secondary to microstomia and risk of malignant hyperthermia ###molecularBasis,Caused by mutation in the perlecan gene (HSPG2, )",https://www.omim.org/entry/224410;https://www.omim.org/entry/255800,.,Autosomal recessive,Het,1,22150672,G,A,.,.,PASS,0/1:94:202,46.53,".$,$a$,$AA.a,,..,a.,,..,,Aaaa.aAa.aA.aa.AAAAa..AA....,Aa,aA..aAA,a..,a..A.A,a,AAaa,.,.A.aaAAAaaA,.aAA.,A.A...AAA.a......AAaA,AA..A..A.,A,,.A,AA,,..^].",missense_variant,HSPG2,3339,.,NM_005529.5(HSPG2):c.12841C>T(p.Arg4281Cys),NM_005529.6,exon95(97),P+=>P0,.,.,0,0,3.664e-05,0.0005,.,.,0,6,0.00070,0,6,0.000051,0.00581395348837,4/688,http://exac.broadinstitute.org/variant/1-22150672-G-A,0.87,154.7,42,0.0,http://exac.broadinstitute.org/gene/ENSG00000142798,0.62955,.,0.15,T,0.99,D,0.523,P,0.042,U,1.000,D,3.91,17.63,.,.,.,.,.,.,.,.,.,.,.,.,.,.,.,.,.,.,.,.,.,.,.,.,.,.,.,.,.,.,.,.,.,.,"angiogenesis (GO:0001525)|brain development (GO:0007420)|carbohydrate metabolic process (GO:0005975)|cardiac muscle tissue development (GO:0048738)|cartilage development involved in endochondral bone morphogenesis (GO:0060351)|chondrocyte differentiation (GO:0002062)|chondroitin sulfate metabolic process (GO:0030204)|embryonic skeletal system morphogenesis (GO:0048704)|endochondral ossification (GO:0001958)|extracellular matrix disassembly (GO:0022617)|extracellular matrix organization (GO:0030198)|glycosaminoglycan biosynthetic process (GO:0006024)|glycosaminoglycan catabolic process (GO:0006027)|glycosaminoglycan metabolic process (GO:0030203)|lipoprotein metabolic process (GO:0042157)|phototransduction, visible light (GO:0007603)|protein localization (GO:0008104)|retinoid metabolic process (GO:0001523)|small molecule metabolic process (GO:0044281)",basal lamina (GO:0005605)|extracellular matrix (GO:0031012)|extracellular region (GO:0005576)|extracellular space (GO:0005615)|extracellular vesicular exosome (GO:0070062)|focal adhesion (GO:0005925)|Golgi lumen (GO:0005796)|lysosomal lumen (GO:0043202)|plasma membrane (GO:0005886),metal ion binding (GO:0046872)|protein C-terminus binding (GO:0008022),.,.,.,.,5,1,CSS16108700102
223,.,.,HGMD|OMIM,Name=SegmentalDuplications,.,CSS16108700102,101800;160980;255960;610489,"Acrodysostosis 1, with or without hormone resistance;Adrenocortical tumor, somatic (3);Carney complex, type 1;Myxoma, intracardiac;Pigmented nodular adrenocortical disease, primary, 1","1.$$$mimNumber,101800###prefix,####preferredTitle,ACRODYSOSTOSIS 1 WITH OR WITHOUT HORMONE RESISTANCE; ACRDYS1###inheritance,Autosomal dominant ###growthHeight,Short stature ;###growthHeight,Brachymelic dwarfism (upper limbs greater than lower limbs) ###growthOther,Growth retardation, mild to moderate, prenatal onset ###headAndNeckHead,Brachycephaly ###headAndNeckFace,Hypoplastic maxilla ;###headAndNeckFace,Prognathism ###headAndNeckEars,Hearing loss ###headAndNeckEyes,Epicanthal folds ;###headAndNeckEyes,Hypertelorism ;###headAndNeckEyes,Optic atrophy ;###headAndNeckEyes,Strabismus ;###headAndNeckEyes,Blue eyes (Japanese patients) ###headAndNeckNose,Low nasal bridge ;###headAndNeckNose,Broad, upturned nose ;###headAndNeckNose,Dimpled nasal tip ###headAndNeckTeeth,Malocclusion ;###headAndNeckTeeth,Delayed tooth eruption ;###headAndNeckTeeth,Hypodontia ###genitourinaryInternalGenitaliaMale,Cryptorchidism ###skeletal,Advanced bone age ;###skeletal,Epiphyseal stippling in neonates (lumbosacral and cervical bodies, carpus, tarsus, proximal humerus, terminal phalanges, knees, hips) ###skeletalSkull,Calvarial hyperostosis ;###skeletalSkull,Hypoplastic maxilla ###skeletalSpine,Spinal canal stenosis ;###skeletalSpine,Scoliosis ;###skeletalSpine,Narrow interpediculate distances ;###skeletalSpine,Small vertebrae ###skeletalLimbs,Radial head dislocation ###skeletalHands,Short, broad hands ;###skeletalHands,Short metacarpals ;###skeletalHands,Short phalanges ;###skeletalHands,Cone-shaped epiphyses ###skeletalFeet,Large halluces ;###skeletalFeet,Short metatarsals ###skinNailsHairSkin,Dorsal hand wrinkling ;###skinNailsHairSkin,Pigmented nevi ###neurologicCentralNervousSystem,Mental retardation (IQ 24-85) (variable) ;###neurologicCentralNervousSystem,Hydrocephalus ###endocrineFeatures,Multiple hormone resistance ;###endocrineFeatures,Irregular menses ;###endocrineFeatures,Hypogonadism ###laboratoryAbnormalities,Increased serum parathyroid hormone ;###laboratoryAbnormalities,Low or normal serum calcium ;###laboratoryAbnormalities,Normal or increased serum phosphate ;###laboratoryAbnormalities,Increased urinary cAMP excretion ;###laboratoryAbnormalities,Increased serum thyrotropin ;###laboratoryAbnormalities,Increased serum calcitonin ###miscellaneous,Epiphyseal stippling is gone by 8 months of age ;###miscellaneous,Majority of cases are sporadic ;###miscellaneous,Associated with advanced paternal age ;###miscellaneous,Not all patients have facial dysmorphism ###molecularBasis,Caused by mutation in the cAMP-dependent regulatory subunit 1 of protein kinase A gene (PRKAR1A, ) 2.$$$mimNumber,160980###prefix,####preferredTitle,CARNEY COMPLEX, TYPE 1; CNC1###inheritance,Autosomal dominant ###headAndNeckEyes,Conjunctival and scleral pigmentation ;###headAndNeckEyes,Eyelid myxoma ###cardiovascularHeart,Atrial myxoma ;###cardiovascularHeart,Ventricular myxoma ;###cardiovascularHeart,Congestive heart failure ###skinNailsHairSkin,Profuse pigmented skin lesions ;###skinNailsHairSkin,Nevi ;###skinNailsHairSkin,Ephelides ;###skinNailsHairSkin,Centrofacial/mucosal lentigines ;###skinNailsHairSkin,Blue nevi ###skinNailsHairHair,Hirsuitism ;###skinNailsHairHair,Red Hair ###endocrineFeatures,Pigmented micronodular adrenal dysplasia ;###endocrineFeatures,Cushing disease ;###endocrineFeatures,Acromegaly ;###endocrineFeatures,Thyroid follicular hyperplasia ###neoplasia,Myxoid subcutaneous tumors ;###neoplasia,Primary adrenocortical nodular hyperplasia ;###neoplasia,Testicular Sertoli cell tumor, calcified ;###neoplasia,Pituitary adenoma ;###neoplasia,Mammary ductal fibroadenoma ;###neoplasia,Schwannoma ;###neoplasia,Psammomatous melanotic schwannomas ;###neoplasia,Thyroid carcinoma ;###neoplasia,Pheochromocytoma ###miscellaneous,Genetic heterogeneity (see CNC2, ###molecularBasis,Caused by mutation in the cAMP-dependent protein kinase, regulatory, type I, alpha gene (PRKAR1A, ) 3.$$$mimNumber,255960###prefix,####preferredTitle,MYXOMA, INTRACARDIAC###inheritance,Autosomal dominant ###cardiovascularHeart,Left atrial myxoma ;###cardiovascularHeart,Right atrial myxoma ;###cardiovascularHeart,Pulmonic valve myxoma ;###cardiovascularHeart,Bacterial endocarditis susceptible###molecularBasis,Caused by mutation in the protein kinase, cAMP-dependent, regulatory, type I, alpha gene (PRKAR1A, ) 4.$$$mimNumber,610489###prefix,####preferredTitle,PIGMENTED NODULAR ADRENOCORTICAL DISEASE, PRIMARY, 1; PPNAD1###inheritance,Autosomal dominant ###growthWeight,Truncal obesity ###headAndNeckFace,Round face ###cardiovascularVascular,Hypertension ###skeletal,Decreased bone mineral density ;###skeletal,Osteoporosis ###skeletalSpine,Kyphosis ###skinNailsHairSkin,Thin skin ;###skinNailsHairSkin,Striae ;###skinNailsHairSkin,Easy bruising ###neurologicCentralNervousSystem,Cognitive decline ###neurologicBehavioralPsychiatricManifestations,Mood changes ;###neurologicBehavioralPsychiatricManifestations,Depression ;###neurologicBehavioralPsychiatricManifestations,Agitation ;###neurologicBehavioralPsychiatricManifestations,Anxiety ;###neurologicBehavioralPsychiatricManifestations,Psychosis ###endocrineFeatures,Cushing syndrome ;###endocrineFeatures,Pigmented micronodular adrenocortical disease ;###endocrineFeatures,ACTH-independent hypercortisolemia ;###endocrineFeatures,Adrenal glands may be normal, atrophic, or slightly enlarged ###laboratoryAbnormalities,Increased serum cortisol ;###laboratoryAbnormalities,Paradoxical increased cortisol secretion on dexamethasone suppression test ;###laboratoryAbnormalities,Decreased serum ACTH ###miscellaneous,Onset in childhood or young adulthood ;###miscellaneous,Manifestations of Cushing syndrome may be mild ;###miscellaneous,Genetic heterogeneity, see PPNAD2 ();###miscellaneous,Usually a manifestation of the Carney complex (CNC1, )###molecularBasis,Caused by mutation in the cAMP-dependent protein kinase, regulatory, type I, alpha gene (PRKAR1A, )",https://www.omim.org/entry/101800;https://www.omim.org/entry/160980;https://www.omim.org/entry/255960;https://www.omim.org/entry/610489,.,Autosomal dominant,Het,17,66522023,C,T,.,.,strand fail|low coverage,0/1:3:9,33.33,"..t.T,",synonymous_variant;synonymous_variant;synonymous_variant;synonymous_variant;synonymous_variant;synonymous_variant,PRKAR1A,5573,.,NM_212471.2(PRKAR1A):c.678C>T(p.Ile226=);NM_212472.2(PRKAR1A):c.678C>T(p.Ile226=);NM_002734.4(PRKAR1A):c.678C>T(p.Ile226=);NM_001278433.1(PRKAR1A):c.678C>T(p.Ile226=);NM_001276290.1(PRKAR1A):c.678C>T(p.Ile226=);NM_001276289.1(PRKAR1A):c.678C>T(p.Ile226=),NM_002734.4,exon7(11);exon7(11);exon7(11);exon6(10);exon6(10);exon8(12),.;.;.;.;.;.,0.003,0.0006,0,0,0.0007,0.0101,0.0006,0.0111,0,86,0.010,0,87,0.00072,0.015988372093,11/688,http://exac.broadinstitute.org/variant/17-66522023-C-T,3.51,20.4,0,1.0,http://exac.broadinstitute.org/gene/ENSG00000108946,.,.,.,.,.,.,.,.,.,.,.,.,.,.,rs200592054,.,.,.,.,.,.,.,.,NM_002734.4(PRKAR1A):c.679delG,DM,Carney complex,19293268,.,.,.,.,.,.,.,.,.,.,.,.,.,.,.,.,.,.,.,.,.,activation of phospholipase C activity (GO:0007202)|activation of protein kinase A activity (GO:0034199)|blood coagulation (GO:0007596)|cardiac muscle cell proliferation (GO:0060038)|cellular response to glucagon stimulus (GO:0071377)|energy reserve metabolic process (GO:0006112)|epidermal growth factor receptor signaling pathway (GO:0007173)|female meiotic division (GO:0007143)|fibroblast growth factor receptor signaling pathway (GO:0008543)|innate immune response (GO:0045087)|intracellular signal transduction (GO:0035556)|mesoderm formation (GO:0001707)|negative regulation of cAMP-dependent protein kinase activity (GO:2000480)|negative regulation of meiosis (GO:0045835)|neurotrophin TRK receptor signaling pathway (GO:0048011)|regulation of insulin secretion (GO:0050796)|regulation of transcription from RNA polymerase II promoter (GO:0006357)|sarcomere organization (GO:0045214)|signal transduction (GO:0007165)|small molecule metabolic process (GO:0044281)|transmembrane transport (GO:0055085)|water transport (GO:0006833),AMP-activated protein kinase complex (GO:0031588)|cAMP-dependent protein kinase complex (GO:0005952)|cytosol (GO:0005829)|membrane (GO:0016020)|neuromuscular junction (GO:0031594)|plasma membrane (GO:0005886)|protein complex (GO:0043234),cAMP binding (GO:0030552)|cAMP-dependent protein kinase inhibitor activity (GO:0004862)|cAMP-dependent protein kinase regulator activity (GO:0008603)|protein kinase A catalytic subunit binding (GO:0034236)|ubiquitin protein ligase binding (GO:0031625),.,.,.,.,71,5,CSS16108700102
