,Variant_classification,Gene_classification,Comment,Difficultregion,CNV-SNV,ID,OMIM_Phenotype,Disease,Clinical_synopsis,OMIM_Link,Uniprot,Inheritance,Zygosity,CHR,POS,REF,ALT,Flank,Repeat_flag,FILTER,FORMAT,VAF,Pileup_data,Mutation_type,Gene_name,Entrez_Gene_Id,In_Key_Gene,HGVS_nomenclature,HGMD_transcript,ExonNumber,PolarChange,1000G_ASN_AF,1000G_ALL_AF,ESP6500_AC,ESP6500_AF,gnomAD_exome_ALL,gnomAD_exome_EAS,gnomAD_genome_ALL,gnomAD_genome_EAS,ExAC_EAS_HomoAlt_Count,ExAC_EAS_AC,ExAC_EAS_AF,ExAC_HomoAlt_Count,ExAC_AC,ExAC_AF,In_house_freq,In_house_count,ExAC_Link,ExAC_MisZ,ExAC_Expected,ExAC_observed,ExAC_PLI,PLI_Link,Phylop_Vertebrate_score,Phylop_Mammal_score,SIFT_score,SIFT_prediction,Polyphen2_HDIV_score,Polyphen2_HDIV_pred,Polyphen2_HVAR_score,Polyphen2_HVAR_pred,LRT_score,LRT_prediction,Mutationtatser_score,Mutationtatser_prediction,Gerp++,CADD,Rs_ID,Swiss_prot_function,Swiss_prot_disease_association,Swiss_prot_post_translational_modifications,Swiss_prot_expression,HGMD_mutation_type,HGMD_variant_class,HGMD_disease,HGMD_pubmed_ID,HGMD_indel_type,HGMD_Indel_class,HGMD_indel_disease,HGMD_indel_PMID,HGMD_nearby_alleles,Clinvar,Clinvar_Link,CosmicID,Cosmic_Occurence,Mother_zygosity,Mother_filter,Mother_format,Mother_VAF,Mother_pileup,Father_zygosity,Father_filter,Father_format,Father_VAF,Father_pileup,Recessive,Com_het,De_novo,Other_relatives,Covered,Less_20,GO_BP,GO_CC,GO_MF,KEGG_PATHWAY,PID_PATHWAY,BIOCARTA_PATHWAY,REACTOME_PATHWAY,pheno_rank,intersect_rank,CaseID
26,.,.,OMIM|low_frequency,.,.,CSS16209900102,108720;108721;112310;150250;272460,"Atelosteogenesis, type I;Atelosteogenesis, type III;Boomerang dysplasia;Larsen syndrome;Spondylocarpotarsal synostosis syndrome","1.$$$mimNumber,108720###prefix,####preferredTitle,ATELOSTEOGENESIS, TYPE I; AO1###inheritance,Autosomal dominant ###growthHeight,Short-limbed dwarfism ###headAndNeckFace,Frontal bossing ;###headAndNeckFace,Micrognathia ;###headAndNeckFace,Midface hypoplasia ###headAndNeckEyes,Prominent globes ;###headAndNeckEyes,Edematous eyelids ###headAndNeckNose,Depressed nasal bridge ;###headAndNeckNose,Hypoplastic nose ###headAndNeckMouth,Cleft palate ###headAndNeckNeck,Short neck ###respiratoryLarynx,Laryngeal stenosis ###chestExternalFeatures,Narrow thoracic cage ###chestRibsSternumClaviclesAndScapulae,11 pairs of ribs ###genitourinaryInternalGenitaliaMale,Cryptorchidism ###skeletalSpine,Fused cervical vertebrae ;###skeletalSpine,Abnormal segmentation ;###skeletalSpine,Thoracic platyspondyly ;###skeletalSpine,Coronal clefts ;###skeletalSpine,Sagittal clefts ###skeletalLimbs,Rhizomelic limb shortening ;###skeletalLimbs,Elbow dislocation ;###skeletalLimbs,Short humeri with proximal clubbing and distal tapering ;###skeletalLimbs,Short, bowed radius ;###skeletalLimbs,Absent-hypoplastic ulnae ;###skeletalLimbs,Short femora with proximal clubbing and distal tapering ;###skeletalLimbs,Short, bowed tibiae ;###skeletalLimbs,Absent-hypoplastic fibulae ###skeletalHands,Brachydactyly ;###skeletalHands,Poor ossifications of metacarpal and proximal, middle phalanges ;###skeletalHands,Well-ossified distal phalanges ;###skeletalHands,Short metacarpals ###skeletalFeet,Talipes equinovarus ;###skeletalFeet,Short metatarsals ###neurologicCentralNervousSystem,Encephalocele ###prenatalManifestationsAmnioticFluid,Polyhydramnios ###prenatalManifestationsDelivery,Stillborn ;###prenatalManifestationsDelivery,Premature delivery ###laboratoryAbnormalities,Giant cells (degenerating chondrocytes) in resting zone of epiphyseal cartilage ###miscellaneous,De novo mutation ;###miscellaneous,All cases have been stillborn or immediate neonatal death ###molecularBasis,Mutation in the filamin B gene (FLNB, ) 2.$$$mimNumber,108721###prefix,####preferredTitle,ATELOSTEOGENESIS, TYPE III; AO3###inheritance,Autosomal dominant ###headAndNeckFace,Frontal bossing ;###headAndNeckFace,Midface hypoplasia ;###headAndNeckFace,Micrognathia ###headAndNeckNose,Flat nasal bridge ###headAndNeckMouth,Cleft palate ###headAndNeckNeck,Short neck ###skeletalSkull,Hypoplastic maxilla ;###skeletalSkull,Hypoplastic mandible ;###skeletalSkull,Prominent occiput ###skeletalSpine,Scoliosis ;###skeletalSpine,Cervical spine segmentation defects ;###skeletalSpine,Cervical kyphosis ###skeletalPelvis,Rounded iliac bones with shortened sacrosciatic notches ;###skeletalPelvis,Vertical, block-like ischia ;###skeletalPelvis,Flat acetabular roofs ;###skeletalPelvis,Horizontal sacrum ###skeletalLimbs,Rhizomelic shortening ;###skeletalLimbs,Elbow dislocations ;###skeletalLimbs,Club-shaped humeri with early proximal epiphyseal ossification ;###skeletalLimbs,Club-shaped femora ;###skeletalLimbs,Knee dislocations ;###skeletalLimbs,Radial bowing ;###skeletalLimbs,Tibial bowing ###skeletalHands,Hitchhiker thumb ;###skeletalHands,Tombstone-shaped proximal phalanges ;###skeletalHands,Widened distal phalanges ;###skeletalHands,Bifid digits ###skeletalFeet,Hitchhiker halluces ;###skeletalFeet,Talipes equinovarus ;###skeletalFeet,Widened gap first and second toe ###molecularBasis,Caused by mutation in the filamin B gene (FLNB, ) 3.$$$mimNumber,150250###prefix,####preferredTitle,LARSEN SYNDROME; LRS###inheritance,Autosomal dominant ###growthHeight,Short stature (final adult height less than 152cm) ###growthOther,Prenatal growth deficiency ###headAndNeckFace,Flat face ;###headAndNeckFace,Prominent forehead ###headAndNeckEars,Hearing loss, conductive ;###headAndNeckEars,Malformations of the auditory ossicles ###headAndNeckEyes,Hypertelorism ;###headAndNeckEyes,Anterior corneal lens opacities ###headAndNeckNose,Depressed nasal bridge ###headAndNeckMouth,Cleft palate ;###headAndNeckMouth,Cleft lip ###headAndNeckTeeth,Hypodontia ###cardiovascularHeart,Aortic dilatation ;###cardiovascularHeart,Atrial septal defect ;###cardiovascularHeart,Ventricular septal defect ###respiratoryAirways,Tracheal stenosis ;###respiratoryAirways,Tracheomalacia ;###respiratoryAirways,Bronchomalacia ###chestExternalFeatures,Pectus excavatum ;###chestExternalFeatures,Pectus carinatum ###genitourinaryInternalGenitaliaMale,Cryptorchidism ###skeletalSkull,Flattened frontal bone ;###skeletalSkull,Small skull base ;###skeletalSkull,Shallow orbits ###skeletalSpine,Cervical vertebrae hypoplasia ;###skeletalSpine,Subluxation or fusion of the cervical vertebrae ;###skeletalSpine,Cervical kyphosis ;###skeletalSpine,Scoliosis ;###skeletalSpine,Wedged vertebrae ;###skeletalSpine,Spondylolysis ;###skeletalSpine,Spina bifida occulta ###skeletalPelvis,Dislocation of the hip ###skeletalLimbs,Joint laxity ;###skeletalLimbs,Dislocations of the elbows ;###skeletalLimbs,Dislocations of the wrists ;###skeletalLimbs,Dislocations of the knees ;###skeletalLimbs,Dysplastic epiphyseal centers ###skeletalHands,Cylindric fingers ;###skeletalHands,Spatulate thumbs ;###skeletalHands,Short metacarpals ;###skeletalHands,Supernumerary carpal bones ;###skeletalHands,Multiple carpal ossification centers ###skeletalFeet,Talipes equinovalgus ;###skeletalFeet,Talipes equinovarus ;###skeletalFeet,Short metatarsals ;###skeletalFeet,Supernumerary tarsal bones ;###skeletalFeet,Delayed coalescence of calcaneal ossification centers ###skinNailsHairNails,Short nails ###neurologicCentralNervousSystem,Mental retardation ;###neurologicCentralNervousSystem,Spinal cord compression ###miscellaneous,Intrafamilial variation ;###miscellaneous,Autosomal recessive inheritance () has also been suggested;###miscellaneous,Joint dislocations become less frequent with age ###molecularBasis,Caused by mutation in the filamin B gene (FLNB, ) 4.$$$mimNumber,272460###prefix,####preferredTitle,SPONDYLOCARPOTARSAL SYNOSTOSIS SYNDROME; SCT###inheritance,Autosomal recessive ###growthHeight,Short stature, disproportionate (short trunk) ###headAndNeckFace,Round, broad face ###headAndNeckEars,Sensorineural hearing loss ;###headAndNeckEars,Mixed hearing loss ;###headAndNeckEars,Preauricular skin tag ###headAndNeckEyes,Hypertelorism ;###headAndNeckEyes,Cataract ;###headAndNeckEyes,Rarefaction of retinal pigmentation ;###headAndNeckEyes,Narrowing of retinal vessels ###headAndNeckNose,Short nose ;###headAndNeckNose,Anteverted nares ;###headAndNeckNose,Broad, square nasal tip ###headAndNeckMouth,Cleft palate ###headAndNeckTeeth,Enamel hypoplasia ###headAndNeckNeck,Short neck ###respiratoryLung,Restrictive lung disease ###genitourinaryKidneys,Renal cysts ###skeletal,Delayed bone age ###skeletalSpine,Abnormal spinal segmentation ;###skeletalSpine,Block vertebrae ;###skeletalSpine,Scoliosis ;###skeletalSpine,Lordosis ;###skeletalSpine,Odontoid hypoplasia ;###skeletalSpine,C2-C3 subluxation ;###skeletalSpine,Unilateral unsegmented bar ;###skeletalSpine,Fusion of vertebral bodies ###skeletalPelvis,Bilateral proximal femoral epiphyseal dysplasia ###skeletalLimbs,Decreased range of motion at elbows ###skeletalHands,Carpal synostosis (especially capitate-hamate and lunate-triquetrum) ;###skeletalHands,Fifth finger clinodactyly ###skeletalFeet,Tarsal synostosis ;###skeletalFeet,Pes planus ###molecularBasis,Caused by mutation in the beta filamin B gene (FLNB, )",https://www.omim.org/entry/108720;https://www.omim.org/entry/108721;https://www.omim.org/entry/112310;https://www.omim.org/entry/150250;https://www.omim.org/entry/272460,.,Autosomal dominant;Autosomal recessive,Het,3,58139266,G,A,.,.,PASS,0/1:25:44,56.82,"aA.AAAA.,aa,aA.,.Aa,.,aA,A,.aAa",missense_variant;missense_variant;missense_variant;missense_variant,FLNB,2317,.,NM_001164317.1(FLNB):c.6625G>A(p.Gly2209Ser);NM_001457.3(FLNB):c.6532G>A(p.Gly2178Ser);NM_001164318.1(FLNB):c.6499G>A(p.Gly2167Ser);NM_001164319.1(FLNB):c.6460G>A(p.Gly2154Ser),NM_001457.3,exon40(47);exon39(46);exon39(46);exon38(45),P0=>P0;P0=>P0;P0=>P0;P0=>P0,.,.,0,0,8.127e-06,0,3.229e-05,0,0,0,0,0,1,0.0000083,0.00145348837209,1/688,http://exac.broadinstitute.org/variant/3-58139266-G-A,2.14,77.8,21,0.0,http://exac.broadinstitute.org/gene/ENSG00000136068,0.95923,.,0,D,1.0,D,1.0,D,0.000,D,1.000,D,5.9,34,.,.,.,.,.,.,.,.,.,.,.,.,.,.,.,.,.,.,.,.,.,.,.,.,.,.,.,.,.,.,.,.,.,.,actin cytoskeleton organization (GO:0030036)|cell differentiation (GO:0030154)|cytokine-mediated signaling pathway (GO:0019221)|cytoskeletal anchoring at plasma membrane (GO:0007016)|signal transduction (GO:0007165)|skeletal muscle tissue development (GO:0007519),actin cytoskeleton (GO:0015629)|cytoplasm (GO:0005737)|cytosol (GO:0005829)|extracellular vesicular exosome (GO:0070062)|focal adhesion (GO:0005925)|integral component of membrane (GO:0016021)|plasma membrane (GO:0005886)|stress fiber (GO:0001725),actin binding (GO:0003779)|identical protein binding (GO:0042802)|poly(A) RNA binding (GO:0044822),.,.,.,.,6,0,CSS16209900102
94,.,.,HGMD|OMIM,.,.,CSS16209900102,253000,Mucopolysaccharidosis IVA,"1.$$$mimNumber,253000###prefix,####preferredTitle,MUCOPOLYSACCHARIDOSIS, TYPE IVA; MPS4A###inheritance,Autosomal recessive ###growthHeight,Adult height 82 to 115 cm ;###growthHeight,Short-trunked dwarfism ###headAndNeckFace,Mildly coarse facial features ;###headAndNeckFace,Prognathism ###headAndNeckEars,Hearing loss ###headAndNeckEyes,Corneal opacities ###headAndNeckMouth,Broad mouth ###headAndNeckTeeth,Widely spaced teeth ;###headAndNeckTeeth,Grayish enamel ;###headAndNeckTeeth,Frequent caries ###cardiovascularHeart,Valvular heart disease ###respiratoryNasopharynx,Frequent upper respiratory tract infections ###respiratoryLung,Restrictive lung disease ###chestRibsSternumClaviclesAndScapulae,Flaring of rib cage ;###chestRibsSternumClaviclesAndScapulae,Prominent sternum ###abdomenExternalFeatures,Inguinal hernia ###abdomenLiver,Mild hepatomegaly ###skeletal,Osteoporosis ###skeletalSpine,Platyspondyly ;###skeletalSpine,Odontoid hypoplasia ;###skeletalSpine,Cervical subluxation ;###skeletalSpine,Kyphosis ;###skeletalSpine,Ovoid vertebral bodies ;###skeletalSpine,Hyperlordosis ;###skeletalSpine,Scoliosis ###skeletalPelvis,Coxa valga ;###skeletalPelvis,Constricted iliac wings ###skeletalLimbs,Joint laxity ;###skeletalLimbs,Genu valgum ;###skeletalLimbs,Ulnar deviation of the wrist ;###skeletalLimbs,Epiphyseal deformities of tubular bones ;###skeletalLimbs,Widened metaphyses ###skeletalHands,Pointed proximal second through fifth metacarpals ###neurologicCentralNervousSystem,Normal intelligence ;###neurologicCentralNervousSystem,Cervical myelopathy ###laboratoryAbnormalities,N-acetylgalactosamine-6-sulfatase deficiency in fibroblasts and leukocytes ;###laboratoryAbnormalities,Keratan sulfate excretion in urine that decreases with age ;###laboratoryAbnormalities,Chondroitin 6-sulfate excretion in urine ###miscellaneous,Appear normal at birth ;###miscellaneous,Onset between 1-3 years ###molecularBasis,Caused by mutations in the galactosamine-6-sulfatase gene (GALNS, ).",https://www.omim.org/entry/253000,.,Autosomal recessive,Het,16,88904086,A,G,.,.,strand fail|low coverage,0/1:6:16,37.5,"GG.,G,....",synonymous_variant,GALNS,2588,.,NM_000512.4(GALNS):c.510T>C(p.Tyr170=),NM_000512.4,exon5(14),.,0.027,0.045,468,0.036,0.0457,0.0356,0.0316,0.0278,6,315,0.037,159,5520,0.046,0.0610465116279,42/688,http://exac.broadinstitute.org/variant/16-88904086-A-G,-0.6,17.7,8,0.0,http://exac.broadinstitute.org/gene/ENSG00000141012,.,.,.,.,.,.,.,.,.,.,.,.,.,.,rs3743544,.,.,.,.,.,.,.,.,.,.,.,.,"NM_000512.4(GALNS):c.512A>C(p.D171A),DM,Mucopolysaccharidosis IVa,10814710",93180,https://www.ncbi.nlm.nih.gov/clinvar/variation/93180,.,.,.,.,.,.,.,.,.,.,.,.,.,.,.,.,.,.,carbohydrate metabolic process (GO:0005975)|glycosaminoglycan metabolic process (GO:0030203)|keratan sulfate catabolic process (GO:0042340)|keratan sulfate metabolic process (GO:0042339)|small molecule metabolic process (GO:0044281),extracellular vesicular exosome (GO:0070062)|lysosomal lumen (GO:0043202),metal ion binding (GO:0046872)|N-acetylgalactosamine-4-sulfatase activity (GO:0003943)|N-acetylgalactosamine-6-sulfatase activity (GO:0043890)|sulfuric ester hydrolase activity (GO:0008484),.,.,.,.,32,2,CSS16209900102
347,.,.,HGMD|OMIM,Name=GCcontent,.,CSS16209900102,175700;241800;146510;174200;174700,"Greig cephalopolysyndactyly syndrome;Hypothalamic hamartomas, somatic;Pallister-Hall syndrome;Polydactyly, postaxial, types A1 and B;Polydactyly, preaxial, type IV","1.$$$mimNumber,175700###prefix,####preferredTitle,GREIG CEPHALOPOLYSYNDACTYLY SYNDROME; GCPS###inheritance,Autosomal dominant ###headAndNeckHead,Macrocephaly ;###headAndNeckHead,Scaphocephaly ;###headAndNeckHead,Trigonocephaly ###headAndNeckFace,High forehead ;###headAndNeckFace,Frontal bossing ###headAndNeckEyes,Hypertelorism ;###headAndNeckEyes,Downslanting palpebral fissures ###headAndNeckNose,Broad nasal root ###abdomenExternalFeatures,Umbilical hernia ###genitourinaryExternalGenitaliaMale,Inguinal hernia ###skeletal,Advanced bone age ###skeletalSkull,Broad late closing cranial sutures ;###skeletalSkull,Craniosynostosis ;###skeletalSkull,Metopic synostosis (rare) ###skeletalHands,Postaxial polydactyly ;###skeletalHands,Broad thumbs ;###skeletalHands,Syndactyly (usually fingers 3 and 4) ;###skeletalHands,Preaxial polydactyly (variable) ;###skeletalHands,Camptodactyly ###skeletalFeet,Preaxial polydactyly ;###skeletalFeet,Broad halluces ;###skeletalFeet,Syndactyly (usually toes 1 to 3) ;###skeletalFeet,Postaxial polydactyly (rare) ;###skeletalFeet,Camptodactyly ###neurologicCentralNervousSystem,Normal intelligence ;###neurologicCentralNervousSystem,Mental retardation, mild (rare) ;###neurologicCentralNervousSystem,Hydrocephaly ;###neurologicCentralNervousSystem,Agenesis of corpus callosum ###laboratoryAbnormalities,Translocation or deletions involving 7p13 (severe case reports) ###miscellaneous,Variable expressivity ###molecularBasis,Caused by mutation in the GLI-Kruppel family member GLI3 gene (GLI3, ) 2.$$$mimNumber,146510###prefix,####preferredTitle,PALLISTER-HALL SYNDROME; PHS###inheritance,Autosomal dominant ###growthHeight,Short stature ###growthOther,Intrauterine growth retardation ###headAndNeckEars,Simple auricles ;###headAndNeckEars,Absent external auditory canals ;###headAndNeckEars,Microtia ;###headAndNeckEars,Posteriorly rotated ears ###headAndNeckEyes,Microphthalmia ###headAndNeckNose,Short nose ;###headAndNeckNose,Flat nasal bridge ;###headAndNeckNose,Anteverted nares ###headAndNeckMouth,Multiple buccal frenula ;###headAndNeckMouth,Microglossia ;###headAndNeckMouth,Cleft lip and palate ###headAndNeckTeeth,Natal teeth ###cardiovascularHeart,Ventricular septal defect ;###cardiovascularHeart,Proximal aortic coarctation ###cardiovascularVascular,Patent ductus arteriosus ###respiratoryLarynx,Laryngeal cleft ;###respiratoryLarynx,Bifid epiglottis ;###respiratoryLarynx,Hypoplastic epiglottis ###respiratoryLung,Abnormal lung lobation ###chestRibsSternumClaviclesAndScapulae,Fused ribs ###abdomenGastrointestinal,Imperforate anus ###genitourinaryExternalGenitaliaMale,Micropenis ###genitourinaryInternalGenitaliaMale,Cryptorchidism ;###genitourinaryInternalGenitaliaMale,Testicular hypoplasia ###genitourinaryKidneys,Renal dysplasia ;###genitourinaryKidneys,Renal ectopia ###skeletalSpine,Hemivertebrae ###skeletalPelvis,Dislocated hips ###skeletalLimbs,Distal shortening of limbs ;###skeletalLimbs,Radial subluxation ###skeletalHands,Postaxial polydactyly ;###skeletalHands,Oligodactyly ;###skeletalHands,Short 4th metacarpals ;###skeletalHands,Syndactyly ###skeletalFeet,Syndactyly ;###skeletalFeet,Postaxial polydactyly ###skinNailsHairSkin,Midline facial capillary hemangioma ###skinNailsHairNails,Nail dysplasia ###neurologicCentralNervousSystem,Holoprosencephaly (less common) ;###neurologicCentralNervousSystem,Hypothalamic hamartoma ;###neurologicCentralNervousSystem,Pituitary aplasia or dysplasia ###endocrineFeatures,Panhypopituitarism ;###endocrineFeatures,Adrenal gland hypoplasia ;###endocrineFeatures,Thyroid dysplasia/aplasia ###miscellaneous,Variable severity ;###miscellaneous,Variable expressivity ###molecularBasis,Caused by mutations in the GLI-Kruppel family member 3 gene (GLI3, ) 3.$$$mimNumber,174200###prefix,####preferredTitle,POLYDACTYLY, POSTAXIAL, TYPE A1; PAPA1###inheritance,Autosomal dominant ###skeletalHands,Postaxial polydactyly (bilateral, sometimes extra digits are well formed and articulated) ;###skeletalHands,Preaxial polydactyly (bilateral or unilateral) ;###skeletalHands,Triphalangeal thumb (in some patients) ;###skeletalHands,Syndactyly (in some patients) ;###skeletalHands,Broad thumbs (in some patients) ###skeletalFeet,Postaxial polydactyly ;###skeletalFeet,Preaxial polydactyly ;###skeletalFeet,Syndactyly (in some patients) ###molecularBasis,Caused by mutation in the GLI-Kruppel family member GLI3 gene (GLI3, ) ",https://www.omim.org/entry/175700;https://www.omim.org/entry/241800;https://www.omim.org/entry/146510;https://www.omim.org/entry/174200;https://www.omim.org/entry/174700,.,Autosomal dominant,Het,7,42005656,G,A,.,.,low coverage,0/1:10:19,52.63,"a.,..AA.AAAAA",synonymous_variant,GLI3,2737,.,NM_000168.5(GLI3):c.3015C>T(p.Ala1005=),NM_000168.5,exon15(15),.,0.011,0.0024,0,0,0.0010,0.0127,0.0009,0.0173,0,83,0.019,0,87,0.0013,0.0290697674419,20/688,http://exac.broadinstitute.org/variant/7-42005656-G-A,1.52,38.2,1,1.0,http://exac.broadinstitute.org/gene/ENSG00000106571,.,.,.,.,.,.,.,.,.,.,.,.,.,.,rs200965852,.,.,.,.,.,.,.,.,.,.,.,.,"NM_000168.5(GLI3):c.3016dupA,DM,Pallister-Hall syndrome,23950073",.,.,COSM3785692,1(pancreas),.,.,.,.,.,.,.,.,.,.,.,.,.,.,.,.,"anterior semicircular canal development (GO:0060873)|anterior/posterior pattern specification (GO:0009952)|artery development (GO:0060840)|axon guidance (GO:0007411)|branching involved in ureteric bud morphogenesis (GO:0001658)|camera-type eye morphogenesis (GO:0048593)|cell differentiation involved in kidney development (GO:0061005)|cerebral cortex radial glia guided migration (GO:0021801)|developmental growth (GO:0048589)|embryonic digestive tract development (GO:0048566)|embryonic digestive tract morphogenesis (GO:0048557)|embryonic digit morphogenesis (GO:0042733)|embryonic skeletal system morphogenesis (GO:0048704)|forebrain dorsal/ventral pattern formation (GO:0021798)|forebrain radial glial cell differentiation (GO:0021861)|frontal suture morphogenesis (GO:0060364)|heart development (GO:0007507)|hindgut morphogenesis (GO:0007442)|hippocampus development (GO:0021766)|in utero embryonic development (GO:0001701)|lambdoid suture morphogenesis (GO:0060366)|lateral ganglionic eminence cell proliferation (GO:0022018)|lateral semicircular canal development (GO:0060875)|limb morphogenesis (GO:0035108)|lung development (GO:0030324)|mammary gland specification (GO:0060594)|melanocyte differentiation (GO:0030318)|metanephros development (GO:0001656)|negative regulation of alpha-beta T cell differentiation (GO:0046639)|negative regulation of apoptotic process (GO:0043066)|negative regulation of canonical Wnt signaling pathway (GO:0090090)|negative regulation of cell proliferation (GO:0008285)|negative regulation of neuron differentiation (GO:0045665)|negative regulation of smoothened signaling pathway (GO:0045879)|negative regulation of transcription from RNA polymerase II promoter (GO:0000122)|negative regulation of transcription, DNA-templated (GO:0045892)|negative thymic T cell selection (GO:0045060)|nose morphogenesis (GO:0043585)|odontogenesis of dentin-containing tooth (GO:0042475)|oligodendrocyte differentiation (GO:0048709)|optic nerve morphogenesis (GO:0021631)|palate development (GO:0060021)|positive regulation of alpha-beta T cell differentiation (GO:0046638)|positive regulation of chondrocyte differentiation (GO:0032332)|positive regulation of neuroblast proliferation (GO:0002052)|positive regulation of osteoblast differentiation (GO:0045669)|positive regulation of protein import into nucleus (GO:0042307)|positive regulation of transcription from RNA polymerase II promoter (GO:0045944)|positive regulation of transcription, DNA-templated (GO:0045893)|protein processing (GO:0016485)|proximal/distal pattern formation (GO:0009954)|response to estrogen (GO:0043627)|sagittal suture morphogenesis (GO:0060367)|smoothened signaling pathway (GO:0007224)|smoothened signaling pathway involved in dorsal/ventral neural tube patterning (GO:0060831)|smoothened signaling pathway involved in spinal cord motor neuron cell fate specification (GO:0021776)|smoothened signaling pathway involved in ventral spinal cord interneuron specification (GO:0021775)|T cell differentiation in thymus (GO:0033077)|thymocyte apoptotic process (GO:0070242)|tongue development (GO:0043586)|transcription, DNA-templated (GO:0006351)|wound healing (GO:0042060)",cilium (GO:0005929)|cytoplasm (GO:0005737)|cytosol (GO:0005829)|nuclear speck (GO:0016607)|nucleus (GO:0005634)|primary cilium (GO:0072372)|transcriptional repressor complex (GO:0017053),beta-catenin binding (GO:0008013)|chromatin binding (GO:0003682)|histone acetyltransferase binding (GO:0035035)|histone deacetylase binding (GO:0042826)|metal ion binding (GO:0046872)|RNA polymerase II core promoter proximal region sequence-specific DNA binding (GO:0000978)|sequence-specific DNA binding transcription factor activity (GO:0003700),.,.,.,.,89,3,CSS16209900102
