,Variant_classification,Gene_classification,Comment,Difficultregion,CNV-SNV,ID,OMIM_Phenotype,Disease,Clinical_synopsis,OMIM_Link,Uniprot,Inheritance,Zygosity,CHR,POS,REF,ALT,Flank,Repeat_flag,FILTER,FORMAT,VAF,Pileup_data,Mutation_type,Gene_name,Entrez_Gene_Id,In_Key_Gene,HGVS_nomenclature,HGMD_transcript,ExonNumber,PolarChange,1000G_ASN_AF,1000G_ALL_AF,ESP6500_AC,ESP6500_AF,gnomAD_exome_ALL,gnomAD_exome_EAS,gnomAD_genome_ALL,gnomAD_genome_EAS,ExAC_EAS_HomoAlt_Count,ExAC_EAS_AC,ExAC_EAS_AF,ExAC_HomoAlt_Count,ExAC_AC,ExAC_AF,In_house_freq,In_house_count,ExAC_Link,ExAC_MisZ,ExAC_Expected,ExAC_observed,ExAC_PLI,PLI_Link,Phylop_Vertebrate_score,Phylop_Mammal_score,SIFT_score,SIFT_prediction,Polyphen2_HDIV_score,Polyphen2_HDIV_pred,Polyphen2_HVAR_score,Polyphen2_HVAR_pred,LRT_score,LRT_prediction,Mutationtatser_score,Mutationtatser_prediction,Gerp++,CADD,Rs_ID,Swiss_prot_function,Swiss_prot_disease_association,Swiss_prot_post_translational_modifications,Swiss_prot_expression,HGMD_mutation_type,HGMD_variant_class,HGMD_disease,HGMD_pubmed_ID,HGMD_indel_type,HGMD_Indel_class,HGMD_indel_disease,HGMD_indel_PMID,HGMD_nearby_alleles,Clinvar,Clinvar_Link,CosmicID,Cosmic_Occurence,Mother_zygosity,Mother_filter,Mother_format,Mother_VAF,Mother_pileup,Father_zygosity,Father_filter,Father_format,Father_VAF,Father_pileup,Recessive,Com_het,De_novo,Other_relatives,Covered,Less_20,GO_BP,GO_CC,GO_MF,KEGG_PATHWAY,PID_PATHWAY,BIOCARTA_PATHWAY,REACTOME_PATHWAY,pheno_rank,intersect_rank,CaseID
4,.,.,HGMD|OMIM|truncating|novel,Name=GCcontent,.,CSS16106000102,122600,Spondylocostal dysostosis 5,"1.$$$mimNumber,122600###prefix,####preferredTitle,SPONDYLOCOSTAL DYSOSTOSIS 5; SCDO5###inheritance,Autosomal recessive ;###inheritance,Autosomal dominant ###growthHeight,Short stature, disproportionate (short trunk) ###headAndNeckNeck,Short neck (in some patients) ###chestRibsSternumClaviclesAndScapulae,Pectus carinatum (in some patients) ;###chestRibsSternumClaviclesAndScapulae,Rib abnormalities ;###chestRibsSternumClaviclesAndScapulae,Fused ribs ;###chestRibsSternumClaviclesAndScapulae,Extra ribs ;###chestRibsSternumClaviclesAndScapulae,Missing ribs ###skeletalSpine,Scoliosis ;###skeletalSpine,Hemivertebrae ;###skeletalSpine,Butterfly vertebrae ;###skeletalSpine,Fused vertebrae ;###skeletalSpine,Syringomyelia (in some patients) ###miscellaneous,Intrafamilial variability of features;###miscellaneous,A risk haplotype () in addition to a null mutation is present in most patients###molecularBasis,Caused by mutation in the T-box 6 gene (TBX6, )",https://www.omim.org/entry/122600,.,"Autosomal recessive, Autosomal dominant",Het,16,30097677,CT,-,.,.,PASS,0/1:20:36,55.56,".$,$,-2ct.-2CT,-2ct,,,-2ct,-2ct.-2CT,-2ct,-2ct,-2ct,-2ct,-2ct,..,-2ct,,,.,..-2CT..-2CT,",frameshift_variant,TBX6,6911,.,NM_004608.3(TBX6):c.1179_1180delAG(p.Gly395LeufsTer91),NM_004608.3,exon9(9),.,.,.,.,.,.,.,.,.,.,.,.,.,.,.,0.00290697674419,2/688,.,0.14,14.0,5,0.03,http://exac.broadinstitute.org/gene/ENSG00000149922,.,.,.,.,.,.,.,.,.,.,.,.,.,.,.,.,.,.,.,.,.,.,.,.,.,.,.,"NM_004608.3(TBX6):c.1179_1180delAG,DM,Scoliosis,25564734",.,.,.,.,.,.,.,.,.,.,.,.,.,.,.,.,.,.,.,.,anatomical structure morphogenesis (GO:0009653)|cell fate specification (GO:0001708)|mesoderm development (GO:0007498)|mesoderm formation (GO:0001707)|negative regulation of neuron maturation (GO:0014043)|negative regulation of neuron projection development (GO:0010977)|negative regulation of transcription from RNA polymerase II promoter (GO:0000122)|positive regulation of transcription from RNA polymerase II promoter (GO:0045944)|signal transduction involved in regulation of gene expression (GO:0023019)|somite rostral/caudal axis specification (GO:0032525),nucleus (GO:0005634),DNA binding (GO:0003677)|RNA polymerase II activating transcription factor binding (GO:0001102)|RNA polymerase II transcription factor binding (GO:0001085)|RNA polymerase II transcription factor binding transcription factor activity involved in negative regulation of transcription (GO:0001191)|sequence-specific DNA binding transcription factor activity (GO:0003700),.,.,.,.,0,0,CSS16106000102
150,.,.,OMIM|novel|lowVAF,Name=SegmentalDuplications,.,CSS16106000102,613848;610504,"Osteogenesis imperfecta, type X;Preterm premature rupture of the membranes, susceptibility to","1.$$$mimNumber,613848###prefix,####preferredTitle,OSTEOGENESIS IMPERFECTA, TYPE X; OI10###inheritance,Autosomal recessive ###growthHeight,Short stature ###growthWeight,Weight less than 5th centile ###headAndNeckHead,Macrocephaly, relative ;###headAndNeckHead,Bitemporal narrowing ;###headAndNeckHead,Open anterior fontanel ;###headAndNeckHead,High forehead ;###headAndNeckHead,Prominent forehead ###headAndNeckFace,Triangular face ;###headAndNeckFace,Midface hypoplasia ###headAndNeckEyes,Blue sclera (patient A) ;###headAndNeckEyes,Shallow orbits (patient A) ###headAndNeckMouth,Micrognathia ###headAndNeckTeeth,Dentinogenesis imperfecta (patient A) ###respiratoryLung,Chronic lung disease (patient A) ###chestRibsSternumClaviclesAndScapulae,Thin ribs ;###chestRibsSternumClaviclesAndScapulae,Broad ribs ###abdomenGastrointestinal,Pyloric stenosis (patient A) ###genitourinaryInternalGenitaliaMale,Inguinal hernia, bilateral (patient A)###genitourinaryKidneys,Renal stones, bilateral (patient A)###skeletal,Bone fractures, multiple ;###skeletal,Osteopenia, generalized ;###skeletal,Bone deformities, multiple ###skeletalSpine,Platyspondyly ;###skeletalSpine,Vertebral compression fractures ;###skeletalSpine,Scoliosis ###skeletalLimbs,Short limbs, relative ;###skeletalLimbs,Bowing of long bones ;###skeletalLimbs,Genu valgum ;###skeletalLimbs,Joint laxity, generalized ###neurologicCentralNervousSystem,Hypotonia, generalized (patient A) ###voice,High-pitched voice (patient A) ###miscellaneous,Based on 2 sibs and an unrelated patient (patient A) (last curated October 2016)###molecularBasis,Caused by mutation in the serpin peptidase inhibitor, clade H, member 1 (SERPINH1, ) ",https://www.omim.org/entry/613848;https://www.omim.org/entry/610504,.,Autosomal recessive,Het,11,75280190,G,A,.,.,PASS,0/1:15:60,25.0,"a$....,..a.,a.,.aA.A.,Aaa.A,,,.......a,.a",missense_variant;missense_variant,SERPINH1,871,.,NM_001235.3(SERPINH1):c.928G>A(p.Val310Met);NM_001207014.1(SERPINH1):c.928G>A(p.Val310Met),NM_001235.3,exon4(5);exon5(6),NP=>NP;NP=>NP,.,.,.,.,.,.,.,.,.,.,.,.,.,.,0.00290697674419,2/688,.,0.49,10.2,3,0.17,http://exac.broadinstitute.org/gene/ENSG00000149257,0.58126,.,0.02,D,0.967,D,0.67,P,0.023,N,1.000,N,5.54,16.71,.,.,.,.,.,.,.,.,.,.,.,.,.,.,.,.,.,.,.,.,.,.,.,.,.,.,.,.,.,.,.,.,.,.,chondrocyte development involved in endochondral bone morphogenesis (GO:0003433)|collagen biosynthetic process (GO:0032964)|collagen fibril organization (GO:0030199)|extracellular matrix organization (GO:0030198)|negative regulation of endopeptidase activity (GO:0010951)|protein maturation (GO:0051604)|regulation of proteolysis (GO:0030162)|response to unfolded protein (GO:0006986),endoplasmic reticulum (GO:0005783)|endoplasmic reticulum lumen (GO:0005788)|endoplasmic reticulum-Golgi intermediate compartment (GO:0005793)|extracellular space (GO:0005615)|extracellular vesicular exosome (GO:0070062),collagen binding (GO:0005518)|poly(A) RNA binding (GO:0044822)|serine-type endopeptidase inhibitor activity (GO:0004867),.,.,.,.,44,2,CSS16106000102
369,.,.,HGMD|OMIM,.,.,CSS16106000102,605462;109400;610828,"Basal cell carcinoma, somatic;Basal cell nevus syndrome;Holoprosencephaly 7","1.$$$mimNumber,109400###prefix,####preferredTitle,BASAL CELL NEVUS SYNDROME; BCNS###inheritance,Autosomal dominant ###headAndNeckFace,Broad facies ;###headAndNeckFace,Frontal and biparietal bossing ;###headAndNeckFace,Mild mandibular prognathism ;###headAndNeckFace,Odontogenic keratocysts of jaws ###headAndNeckEyes,Strabismus ;###headAndNeckEyes,Lateral displacement of the inner canthi ;###headAndNeckEyes,Hypertelorism ;###headAndNeckEyes,Subconjunctival epithelial cysts ;###headAndNeckEyes,Iris coloboma ;###headAndNeckEyes,Glaucoma ;###headAndNeckEyes,Medullated (myelinated) retinal nerve fibers ###headAndNeckNose,Broad nasal root ###headAndNeckMouth,Cleft lip ;###headAndNeckMouth,Cleft palate ###cardiovascularHeart,Cardiac fibroma ###respiratoryLung,Congenital lung cyst ###chestRibsSternumClaviclesAndScapulae,Bifid ribs ;###chestRibsSternumClaviclesAndScapulae,Synostotic ribs ;###chestRibsSternumClaviclesAndScapulae,Hypoplastic ribs ###abdomenGastrointestinal,Lymphomesenteric cysts, often calcified ;###abdomenGastrointestinal,Hamartomatous stomach polyps ###genitourinaryInternalGenitaliaFemale,Ovarian fibromata ;###genitourinaryInternalGenitaliaFemale,Ovarian carcinoma ###skeletalSpine,Scoliosis ;###skeletalSpine,Kyphoscoliosis ;###skeletalSpine,Abnormal cervical vertebrae ###skeletalLimbs,Brachydactyly ;###skeletalLimbs,Short 4th metacarpal ;###skeletalLimbs,Short thumb terminal phalanx ###skinNailsHairSkin,Basal cell nevi ;###skinNailsHairSkin,Basal cell carcinoma ;###skinNailsHairSkin,Pits of palms and soles ###neurologicCentralNervousSystem,Mental retardation (less common) ;###neurologicCentralNervousSystem,Calicification of the falx cerebri ;###neurologicCentralNervousSystem,Medulloblastoma ###miscellaneous,Paternal age effect ;###miscellaneous,Abnormal sensitivity to therapeutic radiation ###molecularBasis,Caused by mutation in the human homolog of the Drosophila 'patched' gene 1 (PTCH1, );###molecularBasis,Caused by mutation in the human homolog of the Drosophila 'patched' gene 2 (PTCH2, );###molecularBasis,Caused by mutation in the human homolog of the Drosophila suppressor of fused gene (SUFU, ) 2.$$$mimNumber,610828###prefix,####preferredTitle,HOLOPROSENCEPHALY 7; HPE7###inheritance,Autosomal dominant ###headAndNeckHead,Macrocephaly ###headAndNeckFace,Midface hypoplasia ;###headAndNeckFace,Hypoplastic premaxilla###headAndNeckEyes,Upslanting palpebral fissures ;###headAndNeckEyes,Hypotelorism ###headAndNeckNose,Hypoplastic nose (in 1 patient) ;###headAndNeckNose,Flattened alae;###headAndNeckNose,Flattened nasal tip ###headAndNeckMouth,Cleft lip ;###headAndNeckMouth,Cleft palate ###headAndNeckTeeth,Single central maxillary incisor ###abdomenExternalFeatures,Omphalocele (in 1 patient) ###neurologicCentralNervousSystem,Holoprosencephaly, semilobar or alobar;###neurologicCentralNervousSystem,Hydrocephalus ;###neurologicCentralNervousSystem,Agenesis of corpus callosum ;###neurologicCentralNervousSystem,Developmental delay ;###neurologicCentralNervousSystem,Seizures ###endocrineFeatures,Panhypopituitarism ###miscellaneous,Incomplete penetrance ###molecularBasis,Caused by mutation in the patched 1 gene (PTCH1, )",https://www.omim.org/entry/605462;https://www.omim.org/entry/109400;https://www.omim.org/entry/610828,.,Autosomal dominant,Het,9,98231084,T,C,.,.,PASS,0/1:43:67,64.18,".,CC.,c,,C.cCCC.CCCCC.c.CC..Cc.CcCC.CCCCC.",synonymous_variant;synonymous_variant;synonymous_variant;synonymous_variant;synonymous_variant;synonymous_variant;synonymous_variant,PTCH1,5727,.,NM_001083604.1(PTCH1):c.1746A>G(p.Ser582=);NM_001083602.1(PTCH1):c.2001A>G(p.Ser667=);NM_001083603.1(PTCH1):c.2196A>G(p.Ser732=);NM_000264.3(PTCH1):c.2199A>G(p.Ser733=);NM_001083607.1(PTCH1):c.1746A>G(p.Ser582=);NM_001083605.1(PTCH1):c.1746A>G(p.Ser582=);NM_001083606.1(PTCH1):c.1746A>G(p.Ser582=),NM_000264.3,exon14(24);exon14(24);exon14(24);exon14(24);exon14(24);exon14(24);exon14(24),.;.;.;.;.;.;.,0.028,0.014,139,0.011,0.0145,0.0288,0.0114,0.0290,7,229,0.026,21,1767,0.015,0.0799418604651,55/688,http://exac.broadinstitute.org/variant/9-98231084-T-C,2.86,42.3,1,1.0,http://exac.broadinstitute.org/gene/ENSG00000185920,.,.,.,.,.,.,.,.,.,.,.,.,.,.,rs2227970,.,.,.,.,.,.,.,.,NM_000264.3(PTCH1):c.2197_2198delTC,DM,Nevoid basal cell carcinoma syndrome,8981943,.,132699,https://www.ncbi.nlm.nih.gov/clinvar/variation/132699,.,.,.,.,.,.,.,.,.,.,.,.,.,.,.,.,.,.,brain development (GO:0007420)|branching involved in ureteric bud morphogenesis (GO:0001658)|cell differentiation involved in kidney development (GO:0061005)|cell proliferation involved in metanephros development (GO:0072203)|cellular response to cholesterol (GO:0071397)|dorsal/ventral pattern formation (GO:0009953)|embryonic limb morphogenesis (GO:0030326)|embryonic organ development (GO:0048568)|epidermis development (GO:0008544)|glucose homeostasis (GO:0042593)|heart morphogenesis (GO:0003007)|hindlimb morphogenesis (GO:0035137)|in utero embryonic development (GO:0001701)|keratinocyte proliferation (GO:0043616)|limb morphogenesis (GO:0035108)|mammary gland duct morphogenesis (GO:0060603)|mammary gland epithelial cell differentiation (GO:0060644)|negative regulation of cell division (GO:0051782)|negative regulation of epithelial cell proliferation (GO:0050680)|negative regulation of multicellular organism growth (GO:0040015)|negative regulation of osteoblast differentiation (GO:0045668)|negative regulation of sequence-specific DNA binding transcription factor activity (GO:0043433)|negative regulation of smoothened signaling pathway (GO:0045879)|negative regulation of transcription from RNA polymerase II promoter (GO:0000122)|neural plate axis specification (GO:0021997)|neural tube closure (GO:0001843)|neural tube patterning (GO:0021532)|organ morphogenesis (GO:0009887)|pharyngeal system development (GO:0060037)|positive regulation of cholesterol efflux (GO:0010875)|protein processing (GO:0016485)|protein targeting to plasma membrane (GO:0072661)|regulation of mitotic cell cycle (GO:0007346)|regulation of protein localization (GO:0032880)|regulation of smoothened signaling pathway (GO:0008589)|renal system development (GO:0072001)|response to chlorate (GO:0010157)|response to drug (GO:0042493)|response to estradiol (GO:0032355)|response to mechanical stimulus (GO:0009612)|response to retinoic acid (GO:0032526)|smoothened signaling pathway (GO:0007224)|smoothened signaling pathway involved in dorsal/ventral neural tube patterning (GO:0060831)|somite development (GO:0061053)|spinal cord motor neuron differentiation (GO:0021522),axonal growth cone (GO:0044295)|caveola (GO:0005901)|dendritic growth cone (GO:0044294)|integral component of membrane (GO:0016021)|intracellular membrane-bounded organelle (GO:0043231)|midbody (GO:0030496)|perinuclear region of cytoplasm (GO:0048471)|plasma membrane (GO:0005886)|postsynaptic density (GO:0014069)|primary cilium (GO:0072372),cholesterol binding (GO:0015485)|cyclin binding (GO:0030332)|hedgehog family protein binding (GO:0097108)|hedgehog receptor activity (GO:0008158)|heparin binding (GO:0008201)|smoothened binding (GO:0005119),.,.,.,.,4,1,CSS16106000102
620,.,.,HGMD|OMIM|low_frequency,.,.,CSS16106000102,175700;241800;146510;174200;174700,"Greig cephalopolysyndactyly syndrome;Hypothalamic hamartomas, somatic;Pallister-Hall syndrome;Polydactyly, postaxial, types A1 and B;Polydactyly, preaxial, type IV","1.$$$mimNumber,175700###prefix,####preferredTitle,GREIG CEPHALOPOLYSYNDACTYLY SYNDROME; GCPS###inheritance,Autosomal dominant ###headAndNeckHead,Macrocephaly ;###headAndNeckHead,Scaphocephaly ;###headAndNeckHead,Trigonocephaly ###headAndNeckFace,High forehead ;###headAndNeckFace,Frontal bossing ###headAndNeckEyes,Hypertelorism ;###headAndNeckEyes,Downslanting palpebral fissures ###headAndNeckNose,Broad nasal root ###abdomenExternalFeatures,Umbilical hernia ###genitourinaryExternalGenitaliaMale,Inguinal hernia ###skeletal,Advanced bone age ###skeletalSkull,Broad late closing cranial sutures ;###skeletalSkull,Craniosynostosis ;###skeletalSkull,Metopic synostosis (rare) ###skeletalHands,Postaxial polydactyly ;###skeletalHands,Broad thumbs ;###skeletalHands,Syndactyly (usually fingers 3 and 4) ;###skeletalHands,Preaxial polydactyly (variable) ;###skeletalHands,Camptodactyly ###skeletalFeet,Preaxial polydactyly ;###skeletalFeet,Broad halluces ;###skeletalFeet,Syndactyly (usually toes 1 to 3) ;###skeletalFeet,Postaxial polydactyly (rare) ;###skeletalFeet,Camptodactyly ###neurologicCentralNervousSystem,Normal intelligence ;###neurologicCentralNervousSystem,Mental retardation, mild (rare) ;###neurologicCentralNervousSystem,Hydrocephaly ;###neurologicCentralNervousSystem,Agenesis of corpus callosum ###laboratoryAbnormalities,Translocation or deletions involving 7p13 (severe case reports) ###miscellaneous,Variable expressivity ###molecularBasis,Caused by mutation in the GLI-Kruppel family member GLI3 gene (GLI3, ) 2.$$$mimNumber,146510###prefix,####preferredTitle,PALLISTER-HALL SYNDROME; PHS###inheritance,Autosomal dominant ###growthHeight,Short stature ###growthOther,Intrauterine growth retardation ###headAndNeckEars,Simple auricles ;###headAndNeckEars,Absent external auditory canals ;###headAndNeckEars,Microtia ;###headAndNeckEars,Posteriorly rotated ears ###headAndNeckEyes,Microphthalmia ###headAndNeckNose,Short nose ;###headAndNeckNose,Flat nasal bridge ;###headAndNeckNose,Anteverted nares ###headAndNeckMouth,Multiple buccal frenula ;###headAndNeckMouth,Microglossia ;###headAndNeckMouth,Cleft lip and palate ###headAndNeckTeeth,Natal teeth ###cardiovascularHeart,Ventricular septal defect ;###cardiovascularHeart,Proximal aortic coarctation ###cardiovascularVascular,Patent ductus arteriosus ###respiratoryLarynx,Laryngeal cleft ;###respiratoryLarynx,Bifid epiglottis ;###respiratoryLarynx,Hypoplastic epiglottis ###respiratoryLung,Abnormal lung lobation ###chestRibsSternumClaviclesAndScapulae,Fused ribs ###abdomenGastrointestinal,Imperforate anus ###genitourinaryExternalGenitaliaMale,Micropenis ###genitourinaryInternalGenitaliaMale,Cryptorchidism ;###genitourinaryInternalGenitaliaMale,Testicular hypoplasia ###genitourinaryKidneys,Renal dysplasia ;###genitourinaryKidneys,Renal ectopia ###skeletalSpine,Hemivertebrae ###skeletalPelvis,Dislocated hips ###skeletalLimbs,Distal shortening of limbs ;###skeletalLimbs,Radial subluxation ###skeletalHands,Postaxial polydactyly ;###skeletalHands,Oligodactyly ;###skeletalHands,Short 4th metacarpals ;###skeletalHands,Syndactyly ###skeletalFeet,Syndactyly ;###skeletalFeet,Postaxial polydactyly ###skinNailsHairSkin,Midline facial capillary hemangioma ###skinNailsHairNails,Nail dysplasia ###neurologicCentralNervousSystem,Holoprosencephaly (less common) ;###neurologicCentralNervousSystem,Hypothalamic hamartoma ;###neurologicCentralNervousSystem,Pituitary aplasia or dysplasia ###endocrineFeatures,Panhypopituitarism ;###endocrineFeatures,Adrenal gland hypoplasia ;###endocrineFeatures,Thyroid dysplasia/aplasia ###miscellaneous,Variable severity ;###miscellaneous,Variable expressivity ###molecularBasis,Caused by mutations in the GLI-Kruppel family member 3 gene (GLI3, ) 3.$$$mimNumber,174200###prefix,####preferredTitle,POLYDACTYLY, POSTAXIAL, TYPE A1; PAPA1###inheritance,Autosomal dominant ###skeletalHands,Postaxial polydactyly (bilateral, sometimes extra digits are well formed and articulated) ;###skeletalHands,Preaxial polydactyly (bilateral or unilateral) ;###skeletalHands,Triphalangeal thumb (in some patients) ;###skeletalHands,Syndactyly (in some patients) ;###skeletalHands,Broad thumbs (in some patients) ###skeletalFeet,Postaxial polydactyly ;###skeletalFeet,Preaxial polydactyly ;###skeletalFeet,Syndactyly (in some patients) ###molecularBasis,Caused by mutation in the GLI-Kruppel family member GLI3 gene (GLI3, ) ",https://www.omim.org/entry/175700;https://www.omim.org/entry/241800;https://www.omim.org/entry/146510;https://www.omim.org/entry/174200;https://www.omim.org/entry/174700,.,Autosomal dominant,Het,7,42079730,G,A,.,.,PASS,0/1:39:76,51.32,"A..a.,aAa,.AA.,A.aaAA..AAA..AA.AA.,.AAa.,A..,AA..A",missense_variant,GLI3,2737,.,NM_000168.5(GLI3):c.935C>T(p.Thr312Met),NM_000168.5,exon7(15),P0=>NP,.,.,0,0,1.625e-05,0.0002,6.457e-05,0.0012,0,3,0.00035,0,4,0.000033,0.00290697674419,2/688,http://exac.broadinstitute.org/variant/7-42079730-G-A,1.52,38.2,1,1.0,http://exac.broadinstitute.org/gene/ENSG00000106571,0.71603,.,0,D,0.999,D,0.915,D,0.000,D,1.000,D,5.76,19.55,.,.,.,.,.,.,.,.,.,.,.,.,.,"NM_000168.5(GLI3):c.931delA,DM,Greig cephalopolysyndactyly syndrome,10441342",.,.,COSM1089682,"1(endometrium),1(large_intestine)",.,.,.,.,.,.,.,.,.,.,.,.,.,.,.,.,"anterior semicircular canal development (GO:0060873)|anterior/posterior pattern specification (GO:0009952)|artery development (GO:0060840)|axon guidance (GO:0007411)|branching involved in ureteric bud morphogenesis (GO:0001658)|camera-type eye morphogenesis (GO:0048593)|cell differentiation involved in kidney development (GO:0061005)|cerebral cortex radial glia guided migration (GO:0021801)|developmental growth (GO:0048589)|embryonic digestive tract development (GO:0048566)|embryonic digestive tract morphogenesis (GO:0048557)|embryonic digit morphogenesis (GO:0042733)|embryonic skeletal system morphogenesis (GO:0048704)|forebrain dorsal/ventral pattern formation (GO:0021798)|forebrain radial glial cell differentiation (GO:0021861)|frontal suture morphogenesis (GO:0060364)|heart development (GO:0007507)|hindgut morphogenesis (GO:0007442)|hippocampus development (GO:0021766)|in utero embryonic development (GO:0001701)|lambdoid suture morphogenesis (GO:0060366)|lateral ganglionic eminence cell proliferation (GO:0022018)|lateral semicircular canal development (GO:0060875)|limb morphogenesis (GO:0035108)|lung development (GO:0030324)|mammary gland specification (GO:0060594)|melanocyte differentiation (GO:0030318)|metanephros development (GO:0001656)|negative regulation of alpha-beta T cell differentiation (GO:0046639)|negative regulation of apoptotic process (GO:0043066)|negative regulation of canonical Wnt signaling pathway (GO:0090090)|negative regulation of cell proliferation (GO:0008285)|negative regulation of neuron differentiation (GO:0045665)|negative regulation of smoothened signaling pathway (GO:0045879)|negative regulation of transcription from RNA polymerase II promoter (GO:0000122)|negative regulation of transcription, DNA-templated (GO:0045892)|negative thymic T cell selection (GO:0045060)|nose morphogenesis (GO:0043585)|odontogenesis of dentin-containing tooth (GO:0042475)|oligodendrocyte differentiation (GO:0048709)|optic nerve morphogenesis (GO:0021631)|palate development (GO:0060021)|positive regulation of alpha-beta T cell differentiation (GO:0046638)|positive regulation of chondrocyte differentiation (GO:0032332)|positive regulation of neuroblast proliferation (GO:0002052)|positive regulation of osteoblast differentiation (GO:0045669)|positive regulation of protein import into nucleus (GO:0042307)|positive regulation of transcription from RNA polymerase II promoter (GO:0045944)|positive regulation of transcription, DNA-templated (GO:0045893)|protein processing (GO:0016485)|proximal/distal pattern formation (GO:0009954)|response to estrogen (GO:0043627)|sagittal suture morphogenesis (GO:0060367)|smoothened signaling pathway (GO:0007224)|smoothened signaling pathway involved in dorsal/ventral neural tube patterning (GO:0060831)|smoothened signaling pathway involved in spinal cord motor neuron cell fate specification (GO:0021776)|smoothened signaling pathway involved in ventral spinal cord interneuron specification (GO:0021775)|T cell differentiation in thymus (GO:0033077)|thymocyte apoptotic process (GO:0070242)|tongue development (GO:0043586)|transcription, DNA-templated (GO:0006351)|wound healing (GO:0042060)",cilium (GO:0005929)|cytoplasm (GO:0005737)|cytosol (GO:0005829)|nuclear speck (GO:0016607)|nucleus (GO:0005634)|primary cilium (GO:0072372)|transcriptional repressor complex (GO:0017053),beta-catenin binding (GO:0008013)|chromatin binding (GO:0003682)|histone acetyltransferase binding (GO:0035035)|histone deacetylase binding (GO:0042826)|metal ion binding (GO:0046872)|RNA polymerase II core promoter proximal region sequence-specific DNA binding (GO:0000978)|sequence-specific DNA binding transcription factor activity (GO:0003700),.,.,.,.,57,3,CSS16106000102
