,Variant_classification,Gene_classification,Comment,Difficultregion,CNV-SNV,ID,OMIM_Phenotype,Disease,Clinical_synopsis,OMIM_Link,Uniprot,Inheritance,Zygosity,CHR,POS,REF,ALT,Flank,Repeat_flag,FILTER,FORMAT,VAF,Pileup_data,Mutation_type,Gene_name,Entrez_Gene_Id,In_Key_Gene,HGVS_nomenclature,HGMD_transcript,ExonNumber,PolarChange,1000G_ASN_AF,1000G_ALL_AF,ESP6500_AC,ESP6500_AF,gnomAD_exome_ALL,gnomAD_exome_EAS,gnomAD_genome_ALL,gnomAD_genome_EAS,ExAC_EAS_HomoAlt_Count,ExAC_EAS_AC,ExAC_EAS_AF,ExAC_HomoAlt_Count,ExAC_AC,ExAC_AF,In_house_freq,In_house_count,ExAC_Link,ExAC_MisZ,ExAC_Expected,ExAC_observed,ExAC_PLI,PLI_Link,Phylop_Vertebrate_score,Phylop_Mammal_score,SIFT_score,SIFT_prediction,Polyphen2_HDIV_score,Polyphen2_HDIV_pred,Polyphen2_HVAR_score,Polyphen2_HVAR_pred,LRT_score,LRT_prediction,Mutationtatser_score,Mutationtatser_prediction,Gerp++,CADD,Rs_ID,Swiss_prot_function,Swiss_prot_disease_association,Swiss_prot_post_translational_modifications,Swiss_prot_expression,HGMD_mutation_type,HGMD_variant_class,HGMD_disease,HGMD_pubmed_ID,HGMD_indel_type,HGMD_Indel_class,HGMD_indel_disease,HGMD_indel_PMID,HGMD_nearby_alleles,Clinvar,Clinvar_Link,CosmicID,Cosmic_Occurence,Mother_zygosity,Mother_filter,Mother_format,Mother_VAF,Mother_pileup,Father_zygosity,Father_filter,Father_format,Father_VAF,Father_pileup,Recessive,Com_het,De_novo,Other_relatives,Covered,Less_20,GO_BP,GO_CC,GO_MF,KEGG_PATHWAY,PID_PATHWAY,BIOCARTA_PATHWAY,REACTOME_PATHWAY,pheno_rank,intersect_rank,CaseID
6,.,.,HGMD|OMIM,.,.,MFS17005400102,125310;130720;615293,"Cerebral arteriopathy with subcortical infarcts and leukoencephalopathy 1;Lateral meningocele syndrome;?Myofibromatosis, infantile 2","1.$$$mimNumber,125310###prefix,####preferredTitle,CEREBRAL ARTERIOPATHY, AUTOSOMAL DOMINANT, WITH SUBCORTICAL INFARCTS AND LEUKOENCEPHALOPATHY, TYPE 1; CADASIL1###inheritance,Autosomal dominant ###headAndNeckEyes,Acute vision loss due to optic nerve infarction (rare) ;###headAndNeckEyes,Nonarteritic anterior ischemic optic neuropathy (NAION) ;###headAndNeckEyes,Abnormal electroretinogram (ERG) ;###headAndNeckEyes,Abnormal visual evoked responses (VEP) ###cardiovascularVascular,Vasculopathy of the small arteries penetrating the white matter ;###cardiovascularVascular,Small and medium-sized leptomeningeal arteries show luminal narrowing or obliteration ;###cardiovascularVascular,Long perforating arteries of the brain are affected ;###cardiovascularVascular,Affected arteries have electron-dense granular material close to vascular smooth muscle cell membranes ;###cardiovascularVascular,Affected arteries show loss of smooth muscle cells ;###cardiovascularVascular,Varicose veins (reported in 1 family) ###genitourinaryBladder,Urinary incontinence ###skinNailsHairSkin,Varicose veins (reported in 1 family) ###skinNailsHairSkinElectronMicroscopy,Biopsy shows granular osmiophilic material of variable electron density adjacent to basal membrane of vascular smooth muscle cell ###neurologicCentralNervousSystem,Recurrent subcortical infarcts (strokes) ;###neurologicCentralNervousSystem,Pseudobulbar palsy ;###neurologicCentralNervousSystem,Subcortical dementia, progressive (6% of patients) ;###neurologicCentralNervousSystem,Migraine (40% of patients) ;###neurologicCentralNervousSystem,Seizures (2-10% of patients) ;###neurologicCentralNervousSystem,Gait abnormalities ;###neurologicCentralNervousSystem,Leukoencephalopathy ;###neurologicCentralNervousSystem,Subcortical lacunar lesions seen early in disease ;###neurologicCentralNervousSystem,Patients 20-30 years old have hyperintense lesions on T2-weighted MRI in the frontal and anterior temporal lobes ;###neurologicCentralNervousSystem,Patients 30-40 years old have hyperintense lesions in periventricular areas, the external capsule, basal ganglia, thalamus, and brainstem ;###neurologicCentralNervousSystem,Lacunar infarcts develop after age 40 years ;###neurologicCentralNervousSystem,Lesions in the internal capsule after age 40 years ;###neurologicCentralNervousSystem,Microbleeds (most smaller than 5 mm) occur after age 40 years ;###neurologicCentralNervousSystem,Patients older than 50 years have hyperintensities, lacunar infarcts, and microbleeds ;###neurologicCentralNervousSystem,Vasculopathy of the small arteries penetrating the white matter ;###neurologicCentralNervousSystem,Small and medium-sized leptomeningeal arteries show luminal narrowing or obliteration ;###neurologicCentralNervousSystem,Long perforating arteries of the brain are affected ;###neurologicCentralNervousSystem,Affected arteries have electron-dense granular material close to vascular smooth muscle cell membranes ;###neurologicCentralNervousSystem,Affected arteries show loss of smooth muscle cells ###neurologicBehavioralPsychiatricManifestations,Psychiatric disturbances (9% of patients) ;###neurologicBehavioralPsychiatricManifestations,Mood disorders ###miscellaneous,Adult onset (third decade) ;###miscellaneous,Death usually in sixth decade ;###miscellaneous,Penetrance of disease is complete between 30 and 40 years of age ;###miscellaneous,Presents as early-onset strokes in 43% of patients ###molecularBasis,Caused by mutations in the homolog of the Drosophila Notch 3 gene (NOTCH3, ). 2.$$$mimNumber,130720###prefix,####preferredTitle,LATERAL MENINGOCELE SYNDROME; LMNS###inheritance,Autosomal dominant ###growthHeight,Short stature ###headAndNeckHead,Dolichocephaly ###headAndNeckFace,Micrognathia ;###headAndNeckFace,Malar hypoplasia ;###headAndNeckFace,Long, smooth philtrum ###headAndNeckEars,Hearing loss, conductive ;###headAndNeckEars,Low-set ears ;###headAndNeckEars,Posteriorly rotated ears ;###headAndNeckEars,Malformed ossicles ###headAndNeckEyes,Downslanting palpebral fissures ;###headAndNeckEyes,Hypertelorism ;###headAndNeckEyes,Ptosis ###headAndNeckNose,Short nasal bridge ###headAndNeckMouth,High-arched palate ###headAndNeckTeeth,Dental crowding ###headAndNeckNeck,Short neck ###cardiovascularHeart,Bicuspid aortic valve (1 patient) ###cardiovascularVascular,Patent ductus arteriosus ###chestExternalFeatures,Pectus excavatum ###abdomenExternalFeatures,Umbilical hernia ;###abdomenExternalFeatures,Inguinal hernia ###genitourinaryExternalGenitaliaMale,Cryptorchidism ###skeletal,Joint hyperextensibility ###skeletalSkull,Platybasia ;###skeletalSkull,Sclerosis of the skull base ;###skeletalSkull,Wormian bones ###skeletalSpine,Vertebral fusion ;###skeletalSpine,Scalloping of vertebral bodies ;###skeletalSpine,Scoliosis ;###skeletalSpine,Kyphosis ###skinNailsHairSkin,Keloid formation ###skinNailsHairHair,Coarse hair ###muscleSoftTissue,Hypotonia ###neurologicCentralNervousSystem,Delayed motor development ;###neurologicCentralNervousSystem,Meningoceles, multiple, lateral ;###neurologicCentralNervousSystem,Syringomyelia ;###neurologicCentralNervousSystem,Arachnoid cyst ;###neurologicCentralNervousSystem,Dural ectasia ;###neurologicCentralNervousSystem,Widening of the spinal canal ;###neurologicCentralNervousSystem,Chiari I malformation ###voice,High nasal voice ###miscellaneous,Mutations occur de novo ###molecularBasis,Caused by mutation in the homolog of the Drosophila NOTCH gene 3 (NOTCH3, ) 3.$$$mimNumber,615293###prefix,####preferredTitle,MYOFIBROMATOSIS, INFANTILE, 2; IMF2###inheritance,Autosomal dominant ###muscleSoftTissue,Myofibromatosis ###miscellaneous,Onset in infancy or early childhood ;###miscellaneous,One family has been reported and no additional clinical features were provided (last curated June 2013) ###molecularBasis,Caused by mutation in the homolog of the Drosophila NOTCH, 3, gene (NOTCH3, )",https://www.omim.org/entry/125310;https://www.omim.org/entry/130720;https://www.omim.org/entry/615293,.,Autosomal dominant,Het,19,15290031,G,A,.,.,PASS,0/1:35:72,48.61,".$.A,aaa,AA,$,a.aAAa.A.a.,Aa,..,A.$A....,AaA.aa.aa.A..aA.A.a.Aa..,,^].^].",missense_variant,NOTCH3,4854,.,NM_000435.2(NOTCH3):c.3523C>T(p.Arg1175Trp),NM_000435.2,exon22(33),P+=>NP,0.0079,0.0016,0,0,0.0010,0.0120,0.0008,0.0155,1,109,0.013,1,125,0.0010,0.0266393442623,13/488,http://exac.broadinstitute.org/variant/19-15290031-G-A,4.79,55.0,13,0.21,http://exac.broadinstitute.org/gene/ENSG00000074181,0.58886,.,0.09,T,0.998,D,0.916,D,.,.,1.000,N,2.93,16.86,rs200504060,.,.,.,.,NM_000435.2(NOTCH3):c.3523C>T(p.R1175W),DM?,CADASIL,25105908,.,.,.,.,.,.,.,.,.,.,.,.,.,.,.,.,.,.,.,.,.,.,.,.,.,"forebrain development (GO:0030900)|gene expression (GO:0010467)|glomerular capillary formation (GO:0072104)|negative regulation of neuron differentiation (GO:0045665)|neuron fate commitment (GO:0048663)|Notch receptor processing (GO:0007220)|Notch signaling pathway (GO:0007219)|positive regulation of smooth muscle cell proliferation (GO:0048661)|regulation of transcription, DNA-templated (GO:0006355)|transcription initiation from RNA polymerase II promoter (GO:0006367)",actin cytoskeleton (GO:0015629)|cytoplasm (GO:0005737)|cytosol (GO:0005829)|endoplasmic reticulum membrane (GO:0005789)|extracellular region (GO:0005576)|Golgi membrane (GO:0000139)|integral component of membrane (GO:0016021)|nucleoplasm (GO:0005654)|nucleus (GO:0005634)|plasma membrane (GO:0005886)|receptor complex (GO:0043235),calcium ion binding (GO:0005509),.,.,.,.,58,3,MFS17005400102
384,.,.,HGMD|OMIM,Name=GCcontent,.,MFS17005400102,167030,"?Nephrolithiasis, calcium oxalate","1.$$$mimNumber,167030###prefix,####preferredTitle,NEPHROLITHIASIS, CALCIUM OXALATE; CAON###inheritance,Autosomal recessive ###genitourinaryKidneys,Nephrolithiasis, calcium oxalate ;###genitourinaryKidneys,Acute renal failure ###genitourinaryBladder,Ureteropelvic junction obstruction ###laboratoryAbnormalities,Increased urinary oxalate###miscellaneous,Onset in childhood ;###miscellaneous,One patient has been reported (last curated June 2016)###molecularBasis,Caused by mutation in the solute carrier family 26 (sulfate transporter), member 1 gene (SLC26A1, )",https://www.omim.org/entry/167030,.,Autosomal recessive,Het,4,981672,C,T,.,.,PASS,0/1:29:58,50.0,"t.,,..tTt,T.,.,tttttttTTT.T.T.,Tt.......TTT..T.T..Ttt^].^]T",synonymous_variant,IDUA,10861,.,NM_000203.3(IDUA):c.234C>T(p.Gly78=),NM_000203.4,exon2(14),.,.,0.0014,10,0.00077,0.0010,0,0.0003,0,0,0,0,1,113,0.0012,.,.,http://exac.broadinstitute.org/variant/4-981672-C-T,0.22,18.3,14,0.0,http://exac.broadinstitute.org/gene/ENSG00000127415,0.51057,0.001048,.,.,.,.,.,.,.,.,0.995,N,-7.01,15.45,rs138932617,.,.,.,.,.,.,.,.,.,.,.,.,"NM_000203.4(IDUA):c.236C>T(p.A79V),DM,Hurler-Scheie syndrome,12189649",.,.,.,.,.,.,.,.,.,.,.,.,.,.,.,.,.,.,.,.,3'-phosphoadenosine 5'-phosphosulfate biosynthetic process (GO:0050428)|3'-phosphoadenosine 5'-phosphosulfate metabolic process (GO:0050427)|carbohydrate metabolic process (GO:0005975)|chloride transport (GO:0006821)|glycosaminoglycan metabolic process (GO:0030203)|ion transport (GO:0006811)|oxalate transport (GO:0019532)|small molecule metabolic process (GO:0044281)|sulfate transmembrane transport (GO:1902358)|sulfate transport (GO:0008272)|transmembrane transport (GO:0055085)|xenobiotic metabolic process (GO:0006805),integral component of membrane (GO:0016021)|plasma membrane (GO:0005886),anion:anion antiporter activity (GO:0015301)|chloride transmembrane transporter activity (GO:0015108)|oxalate transmembrane transporter activity (GO:0019531)|secondary active sulfate transmembrane transporter activity (GO:0008271)|sulfate transmembrane transporter activity (GO:0015116),.,.,.,.,11,1,MFS17005400102
438,.,.,HGMD|OMIM|truncating|novel,.,.,MFS17005400102,119600;156510,"Cleidocranial dysplasia;Cleidocranial dysplasia, forme fruste, dental anomalies only;Cleidocranial dysplasia, forme fruste, with brachydactyly;Metaphyseal dysplasia with maxillary hypoplasia with or without brachydactyly","1.$$$mimNumber,119600###prefix,####preferredTitle,CLEIDOCRANIAL DYSPLASIA; CCD###inheritance,Autosomal dominant ###growthHeight,Short stature, moderate ###headAndNeckHead,Delayed fontanelle closure ;###headAndNeckHead,Parietal bossing ;###headAndNeckHead,Anterior fontanelle open in adults ###headAndNeckFace,Frontal bossing ;###headAndNeckFace,Metopic groove ;###headAndNeckFace,Midface hypoplasia ;###headAndNeckFace,Micrognathia ###headAndNeckEars,Deafness ###headAndNeckEyes,Hypertelorism ###headAndNeckNose,Low nasal bridge ###headAndNeckMouth,Cleft palate ;###headAndNeckMouth,Narrow, high-arched palate ###headAndNeckTeeth,Delayed eruption of deciduous teeth ;###headAndNeckTeeth,Delayed eruption of permanent teeth ;###headAndNeckTeeth,Supernumerary teeth ;###headAndNeckTeeth,Retention cysts ;###headAndNeckTeeth,Enamel hypoplasia ###respiratoryAirways,Respiratory distress in early infancy ###chestExternalFeatures,Narrow thorax ;###chestExternalFeatures,Abnormal facility in opposing the shoulders ###chestRibsSternumClaviclesAndScapulae,Small scapula ;###chestRibsSternumClaviclesAndScapulae,Hypoplastic clavicles ;###chestRibsSternumClaviclesAndScapulae,Aplastic clavicles ;###chestRibsSternumClaviclesAndScapulae,Short ribs ;###chestRibsSternumClaviclesAndScapulae,Cervical ribs ###skeletal,Osteosclerosis ;###skeletal,Increased bone fragility ###skeletalSkull,Wormian bones ;###skeletalSkull,Bossing of frontal bone ;###skeletalSkull,Bossing of occipital bone ;###skeletalSkull,Bossing of parietal bone ;###skeletalSkull,Calvarial thickening ;###skeletalSkull,Absent frontal sinuses ;###skeletalSkull,Absent paranasal sinuses ;###skeletalSkull,Hypoplastic frontal sinuses ;###skeletalSkull,Hypoplastic paranasal sinuses ;###skeletalSkull,Large foramen magnum ###skeletalSpine,Spondylolysis ;###skeletalSpine,Spondylolisthesis ;###skeletalSpine,Scoliosis ;###skeletalSpine,Kyphosis ###skeletalPelvis,Wide pubic symphysis ;###skeletalPelvis,Delayed mineralization of pubic bone ;###skeletalPelvis,Broad femoral head with short femoral neck ;###skeletalPelvis,Coxa vara ;###skeletalPelvis,Hypoplastic iliac wing ###skeletalHands,Brachydactyly ;###skeletalHands,Long second metacarpal ;###skeletalHands,Short middle phalanges of second and fifth fingers ;###skeletalHands,Cone-shaped phalangeal epiphyses ###neurologicPeripheralNervousSystem,Syringomyelia ###miscellaneous,One third of patients represent new mutations ###molecularBasis,Caused by mutation in the runt-related transcription factor 2 gene (RUNX2, ) ",https://www.omim.org/entry/119600;https://www.omim.org/entry/156510,.,Autosomal dominant,Het,6,45399692,T,-,.,.,PASS,0/1:32:67,47.76,".,.-1T.,..,.-1T..,.-1T..-1T...-1T,-1t.,-1t,.,.-1T,.-1T..-1T,-1t..-1T.,.-1T.-1T.-1T,-1t...-1T.-1T.....-1T,-1t,-1t..-1T",frameshift_variant;frameshift_variant;frameshift_variant,RUNX2,860,.,NM_001015051.3(RUNX2):c.516delT(p.Ala173LeufsTer3);NM_001278478.1(RUNX2):c.474delT(p.Ala159LeufsTer3);NM_001024630.3(RUNX2):c.516delT(p.Ala173LeufsTer3),NM_001024630.3,exon4(8);exon2(6);exon4(9),.;.;.,.,.,.,.,.,.,.,.,.,.,.,.,.,.,.,.,.,2.56,16.0,0,1.0,http://exac.broadinstitute.org/gene/ENSG00000124813,.,.,.,.,.,.,.,.,.,.,.,.,.,.,.,.,.,.,.,.,.,.,.,.,.,.,.,"NM_001024630.3(RUNX2):c.514delT,DM,Cleidocranial dysplasia,20702542",.,.,.,.,.,.,.,.,.,.,.,.,.,.,.,.,.,.,.,.,"BMP signaling pathway (GO:0030509)|cell maturation (GO:0048469)|cellular response to BMP stimulus (GO:0071773)|chondrocyte development (GO:0002063)|embryonic cranial skeleton morphogenesis (GO:0048701)|embryonic forelimb morphogenesis (GO:0035115)|endochondral ossification (GO:0001958)|gene expression (GO:0010467)|negative regulation of smoothened signaling pathway (GO:0045879)|negative regulation of transcription, DNA-templated (GO:0045892)|odontogenesis of dentin-containing tooth (GO:0042475)|ossification (GO:0001503)|osteoblast development (GO:0002076)|osteoblast differentiation (GO:0001649)|osteoblast fate commitment (GO:0002051)|positive regulation of cell proliferation (GO:0008284)|positive regulation of chondrocyte differentiation (GO:0032332)|positive regulation of osteoblast differentiation (GO:0045669)|positive regulation of transcription from RNA polymerase II promoter involved in cellular response to chemical stimulus (GO:1901522)|positive regulation of transcription, DNA-templated (GO:0045893)|regulation of fibroblast growth factor receptor signaling pathway (GO:0040036)|regulation of odontogenesis of dentin-containing tooth (GO:0042487)|stem cell differentiation (GO:0048863)|T cell differentiation (GO:0030217)|transcription initiation from RNA polymerase II promoter (GO:0006367)",cytoplasm (GO:0005737)|nuclear chromatin (GO:0000790)|nucleus (GO:0005634)|transcription factor complex (GO:0005667),ATP binding (GO:0005524)|chromatin binding (GO:0003682)|sequence-specific DNA binding transcription factor activity (GO:0003700)|transcription regulatory region DNA binding (GO:0044212),.,.,.,.,0,0,MFS17005400102
530,.,.,OMIM|novel,"Name=GCcontent,LowComplexity",.,MFS17005400102,135900,Coffin-Siris syndrome 1,"1.$$$mimNumber,135900###prefix,####preferredTitle,COFFIN-SIRIS SYNDROME 1; CSS1###inheritance,Autosomal dominant ###growthHeight,Short stature (in some patients) ###headAndNeckFace,Coarse facies ;###headAndNeckFace,Facial hypertrichosis ###headAndNeckEars,Low-set ears ;###headAndNeckEars,Posteriorly rotated ears ###headAndNeckEyes,Visual impairment ;###headAndNeckEyes,Strabismus ;###headAndNeckEyes,Downslanting palpebral fissures ;###headAndNeckEyes,Bushy eyebrows ;###headAndNeckEyes,Long eyelashes ###headAndNeckNose,Broad nasal tip ###headAndNeckMouth,Large mouth ;###headAndNeckMouth,Thin upper lip vermilion ;###headAndNeckMouth,Thick lower lip vermilion ###headAndNeckTeeth,Delayed dentition ###respiratory,Frequent upper and lower respiratory tract infections (early life) ###abdomenGastrointestinal,Feeding problems ###skeletalHands,Hypoplastic to absent terminal phalanges (especially fifth finger) ;###skeletalHands,Single transverse palmar crease ;###skeletalHands,Prominent distal phalanges ;###skeletalHands,Prominent interphalangeal joints ###skeletalFeet,Hypoplastic to absent terminal phalanges (especially fifth toe) ###skinNailsHairNails,Hypoplastic to absent fifth finger- and toenails ###skinNailsHairHair,Bushy eyebrows ;###skinNailsHairHair,Long eyelashes ;###skinNailsHairHair,Lumbosacral hirsutism ;###skinNailsHairHair,Sparse scalp hair ;###skinNailsHairHair,Hypertrichosis ###neurologicCentralNervousSystem,Delayed psychomotor development ;###neurologicCentralNervousSystem,Severe expressive language delay ;###neurologicCentralNervousSystem,Seizures (in some patients) ;###neurologicCentralNervousSystem,Mental retardation ;###neurologicCentralNervousSystem,Moderate to severe hypotonia ;###neurologicCentralNervousSystem,Hypoplastic corpus callosum (in some patients) ;###neurologicCentralNervousSystem,Partial agenesis of corpus callosum (in some patients) ###miscellaneous,Highly variable phenotype ###molecularBasis,Caused by mutation in the AT-rich interaction domain-containing protein 1B gene (ARID1B, )",https://www.omim.org/entry/135900,.,Autosomal dominant,Het,6,157100442,C,T,.,Name=201:(CGG)n:Simple_repeat,low coverage,0/1:11:19,57.89,".,t,GtTT,T.TTTT,.",missense_variant;missense_variant,ARID1B,57492,.,NM_017519.2(ARID1B):c.1379C>T(p.Ala460Val);NM_020732.3(ARID1B):c.1379C>T(p.Ala460Val),NM_020732.3,exon1(19);exon1(20),NP=>NP;NP=>NP,.,.,.,.,.,.,8.131e-05,0.0013,.,.,.,.,.,.,0.00819672131148,4/488,.,3.39,54.2,6,1.0,http://exac.broadinstitute.org/gene/ENSG00000049618,0.10678,.,0.16,T,0.706,P,0.124,B,0.008,U,1.000,N,-0.656,5.638,.,.,.,.,.,.,.,.,.,.,.,.,.,.,.,.,.,.,.,.,.,.,.,.,.,.,.,.,.,.,.,.,.,.,"chromatin-mediated maintenance of transcription (GO:0048096)|nervous system development (GO:0007399)|transcription, DNA-templated (GO:0006351)",cytoplasm (GO:0005737)|nucleus (GO:0005634)|SWI/SNF complex (GO:0016514),DNA binding (GO:0003677)|transcription coactivator activity (GO:0003713),.,.,.,.,50,2,MFS17005400102
785,.,.,HGMD|OMIM,.,.,MFS17005400102,214800;612370,CHARGE syndrome;Hypogonadotropic hypogonadism 5 with or without anosmia,"1.$$$mimNumber,214800###prefix,####preferredTitle,CHARGE SYNDROME###inheritance,Autosomal dominant ###growthOther,Postnatal growth retardation ###headAndNeckHead,Microcephaly ###headAndNeckFace,Square face ;###headAndNeckFace,Malar flattening ;###headAndNeckFace,Micrognathia ;###headAndNeckFace,Facial asymmetry ###headAndNeckEars,Small ears ;###headAndNeckEars,Lop ears ;###headAndNeckEars,Cup-shaped ears ;###headAndNeckEars,Deafness (sensorineural or mixed sensorineural and conductive) ;###headAndNeckEars,Mondini defect ;###headAndNeckEars,Hypoplastic semicircular canals ###headAndNeckEyes,Colobomas (iris, choroid, retina, disc, and optic nerve) ;###headAndNeckEyes,Anophthalmia ;###headAndNeckEyes,Microphthalmia ;###headAndNeckEyes,Ptosis ;###headAndNeckEyes,Hypertelorism ;###headAndNeckEyes,Downslanting palpebral fissures ###headAndNeckNose,Posterior choanal atresia (membranous and/or bony) ;###headAndNeckNose,Anosmia ###headAndNeckMouth,Cleft palate ;###headAndNeckMouth,Cleft lip ###cardiovascularHeart,Tetralogy of Fallot ;###cardiovascularHeart,Atrial septal defect ;###cardiovascularHeart,Ventricular septal defect ;###cardiovascularHeart,Double-outlet right ventricle ;###cardiovascularHeart,Pulmonary valve stenosis ###cardiovascularVascular,Patent ductus arteriosus ###chestRibsSternumClaviclesAndScapulae,Rib anomalies ###abdomenGastrointestinal,Tracheoesophageal fistula ;###abdomenGastrointestinal,Esophageal atresia ;###abdomenGastrointestinal,Duodenal atresia ;###abdomenGastrointestinal,Anal atresia ;###abdomenGastrointestinal,Anal stenosis ;###abdomenGastrointestinal,Poor feeding ;###abdomenGastrointestinal,Chewing/swallowing difficulties ###genitourinary,Delayed pubertal development ###genitourinaryExternalGenitaliaMale,Micropenis ###genitourinaryExternalGenitaliaFemale,Hypoplastic labia ###genitourinaryInternalGenitaliaMale,Cryptorchidism ###genitourinaryKidneys,Horseshoe kidney ;###genitourinaryKidneys,Hydronephrosis ###skeletalLimbs,Monodactyly (some) ;###skeletalLimbs,Ulnar hypoplasia (some) ;###skeletalLimbs,Tibial aplasia (some) ;###skeletalLimbs,Bifid femur (some) ;###skeletalLimbs,Radial aplasia (reported in 1 patient) ###neurologicCentralNervousSystem,Mental retardation, variable severity ;###neurologicCentralNervousSystem,Intellectual function may be high in milder cases ;###neurologicCentralNervousSystem,Balance disturbances ###neurologicPeripheralNervousSystem,Facial palsy ;###neurologicPeripheralNervousSystem,Dysphagia ;###neurologicPeripheralNervousSystem,Cranial nerve anomalies ###neurologicBehavioralPsychiatricManifestations,Autistic features ###endocrineFeatures,Growth hormone deficiency ;###endocrineFeatures,Parathyroid hypoplasia ;###endocrineFeatures,Gonadotropin deficiency ;###endocrineFeatures,Hypothyroidism ###immunology,Thymic hypoplasia or aplasia ;###immunology,T cell defect, mild to severe ;###immunology,Lymphopenia ;###immunology,Humoral defect (in some) ###laboratoryAbnormalities,Hypocalcemia ###miscellaneous,Highly variable phenotype, even within families ;###miscellaneous,Many cases are sporadic, but somatic and germline mosaicism has been reported ;###miscellaneous,CHARGE acronym (Coloboma, Heart defect, Atresia choanae, Retarded growth and development, Genital hypoplasia, Ear anomalies/deafness, Extremity abnormalities) ;###miscellaneous,Incidence ranges from 1 in 8,500 to 1 in 12,000 births ###molecularBasis,Caused by mutation in the chromodomain helicase DNA-binding protein 7 gene (CHD7, ) ",https://www.omim.org/entry/214800;https://www.omim.org/entry/612370,.,Autosomal dominant,Het,8,61736394,T,C,.,.,PASS,0/1:31:62,50.0,"C$CCC...C.C....c..C.,CC..CC.c..C.,..CC.CCCCcc.CCC..CCC^].",splice_region_variant,CHD7,55636,.,NM_017780.3(CHD7):c.3202-5T>C,NM_017780.3,intron12(37),.,0.022,0.0046,1,0.000084,0.0022,0.0265,0.0013,0.0241,4,242,0.030,4,271,0.0024,0.0901639344262,44/488,http://exac.broadinstitute.org/variant/8-61736394-T-C,1.92,87.7,2,1.0,http://exac.broadinstitute.org/gene/ENSG00000171316,.,.,.,.,.,.,.,.,.,.,.,.,.,.,rs147994149,.,.,.,.,NM_017780.3(CHD7):c.3202-5T>C,DP,"Congenital heart disease, protection, asssociation with",19065520,.,.,.,.,"NM_017780.3(CHD7):c.3202-3T>G,DM,CHARGE syndrome,22033296",95784,https://www.ncbi.nlm.nih.gov/clinvar/variation/95784,.,.,.,.,.,.,.,.,.,.,.,.,.,.,.,.,.,.,"adult heart development (GO:0007512)|adult walking behavior (GO:0007628)|artery morphogenesis (GO:0048844)|blood circulation (GO:0008015)|central nervous system development (GO:0007417)|chromatin modification (GO:0016568)|cognition (GO:0050890)|cranial nerve development (GO:0021545)|embryonic hindlimb morphogenesis (GO:0035116)|epithelium development (GO:0060429)|face development (GO:0060324)|female genitalia development (GO:0030540)|genitalia development (GO:0048806)|heart morphogenesis (GO:0003007)|in utero embryonic development (GO:0001701)|inner ear morphogenesis (GO:0042472)|limb development (GO:0060173)|nose development (GO:0043584)|olfactory behavior (GO:0042048)|olfactory bulb development (GO:0021772)|olfactory nerve development (GO:0021553)|palate development (GO:0060021)|positive regulation of multicellular organism growth (GO:0040018)|regulation of growth hormone secretion (GO:0060123)|regulation of neurogenesis (GO:0050767)|regulation of transcription, DNA-templated (GO:0006355)|retina development in camera-type eye (GO:0060041)|rRNA processing (GO:0006364)|semicircular canal morphogenesis (GO:0048752)|sensory perception of sound (GO:0007605)|skeletal system development (GO:0001501)|T cell differentiation (GO:0030217)|transcription, DNA-templated (GO:0006351)",nucleus (GO:0005634),ATP binding (GO:0005524)|chromatin binding (GO:0003682)|DNA binding (GO:0003677)|helicase activity (GO:0004386),.,.,.,.,61,4,MFS17005400102
